MeasID,YEAR,CO,JUR,CNTYNAME,DATE,PLACE,CSD,MEASTYPE,LTR,BALQUEST,Orig_TYPE,RECTYPE,RECTYPENAME,Orig_TOPIC,RECTOPIC,RECTOPNAME,YES,NO,TOTAL,PERCENT,REQ,OUTCOME,PASSFAIL,Multi_CO,Multi_MeasID,YES_sum,NO_sum,Total_sum,Percent_sum,Outcome_sum,passfail_sum,typerec,topicrec
201000098,2010,7,3,CONTRA COSTA,2010-06-08,Mt. Diablo Unified,2,M,C,"To support quality education and safety for local students, and reduce impacts of State budget cuts by improving sciences, career and technical education facilities; upgrading classroom instructional technology; repairing leaky roofs; improving safety; maximizing energy efficiency including adding solar panels and modern air conditioning; and repairing, replacing, equipping or modernizing other school facilities; shall Mt. Diablo Unified School District issue $348,000,000 of bonds at legal interest rates, with independent citizen oversight, audits, and no money for administrator salaries?",11,11,GO Bond,11,11,Education: Bonds,32152,20662,52814,0.608778,F,1,PassF,0,201000095,32152,20662,52814,0.608778,1,PassF,10,10
201000099,2010,7,3,CONTRA COSTA,2010-06-08,West Contra Costa Unified,2,M,D,"To make schools safe, complete essential health/safety repairs, qualify for state matching grants, shall West Contra Costa Unified Schol District upgrade schools for earthquake safety/handicap accessibility, remove asbestos, upgrade classrooms, vocational classrooms/technology/energy systems to reduce costs, install lighting and security systems, acquire, repair, construct, equipment/sites/facilities, by issuing $380,000,000 in bonds within legal rates and bonding capacity limits with independent audits, citizen oversight, and no money for administrators' salaries?",11,11,GO Bond,11,11,Education: Bonds,23014,13740,36754,0.6261631,F,1,PassF,0,201000096,23014,13740,36754,0.6261631,1,PassF,10,10
201000100,2010,10,3,FRESNO,2010-06-08,Cutler-Orosi Joint Unified,2,M,P,"To develop a recreation department within the Cutler-Orosi area to promote youth activites including sports, and other experiences that develop young people into active, responsible citizens, shall Cutler-Orosi Joint Unified School District levy a tax of $97.00 per parcel annually, with annual cost of living adjustments, so long as the Cutler-Orosi School Board oversees the program?",3,3,Property Tax,10,10,Education,22,129,151,0.14569536,T,2,FailT,1,201000127,453,569,1022,0.44324854,2,FailT,1,10
201000101,2010,12,3,HUMBOLDT,2010-06-08,Blue Lake Union Elementary,2,M,K,"To acquire, construct and improve classrooms and support facilities, including improving student access to computers and technology, building a multipurpose facility for school and community use, and providing repairs and renewable energy improvements to reduce operating costs and put more money in the classroom, shall the Blue Lake Union Elementary School District be authorized to issue up to $2,000,000 in bonds at legal interest rates, with a Citizens' Oversight Committee, annual audits, and provided no funds are used for salaries?",11,11,GO Bond,11,11,Education: Bonds,528,293,821,0.64311814,F,1,PassF,0,201000097,528,293,821,0.64311814,1,PassF,10,10
201000102,2010,12,3,HUMBOLDT,2010-06-08,Rohnerville Elementary,2,M,M,"To improve the quality of education, upgrade and modernize classrooms and schools, make health and safety improvements; upgrade electrical systems, computers, and technology; repair leaky roofs; replace deteriorating plumbing and outdated windows; upgrade heating, ventilation, and cooling systems, and improve energy efficiency, shall the Rohnerville School District issue $5,000,000 of bonds within legal interest rates, have an independent citizens' oversight committee and have no money used for administrative or teacher salaries or be taken by the State?",11,11,GO Bond,11,11,Education: Bonds,934,647,1581,0.59076536,F,1,PassF,0,201000098,934,647,1581,0.59076536,1,PassF,10,10
201000103,2010,12,3,HUMBOLDT,2010-06-08,Southern Humboldt Joint Unified,2,M,L,"To improve the quality of education, modernize and renovate all schools in the District, improve energy efficiency including installing solar panels, replace deteriorating plumbing and drainage systems, upgrade inadequate electrical systems, improve technology, modernize restrooms, and make health and safety improvements, shall the Southern Humboldt Joint Unified School District issue $25,200,000 of bonds at legal interest rates, have an independent citizens' oversight committee and have no money used for administrative or teacher salaries or be taken by the State?",11,11,GO Bond,11,11,Education: Bonds,1497,833,2330,0.64248925,F,1,PassF,1,201000104,1528,851,2379,0.64228666,1,PassF,10,10
201000104,2010,13,3,IMPERIAL,2010-06-08,Calipatria Unified,2,M,I,"To acquire, construct, modernize and improve classrooms and support facilities, including plumbing, electrical, and mechanical systems, classrooms and play areas, high school vocational classrooms and support facilities, solar utility improvements, to reduce annual costs and increase student access to modern technology, shall the Calipatria Unified School District be authorized to issue up to $25,000,000 in bonds at legal interest rates, with an independent Citizens' Oversight Committee, annual audits, and no money for salaries?",11,11,GO Bond,11,11,Education: Bonds,317,338,655,0.48396948,F,2,FailF,0,201000099,317,338,655,0.48396948,2,FailF,10,10
201000105,2010,14,3,INYO,2010-06-08,Big Pine Unified,2,M,A,"To acquire, construct, and improve classrooms and facilities, including repairing, upgrading, and modernizing Big Pine schools, improving student access to computers and modern technology, upgrading athletic facilities and playgrounds, and making renewable energy improvements and improving efficiency to reduce costs and put more money in the classroom, shall the Big Pine Unified School District be authorized to issue $4,100,000 in bonds at legal interest rates with annual audits, an independent citizens' oversight committee, and no money for administrator salaries?",11,11,GO Bond,11,11,Education: Bonds,360,221,581,0.61962134,F,1,PassF,0,201000100,360,221,581,0.61962134,1,PassF,10,10
201000106,2010,16,3,KINGS,2010-06-08,Corcoran Joint Unified,2,M,Q,"To improve the quality of educaiton, modernize, upgrade and repair classrooms and school facilities in the District; improve energy efficiency; make health/safety improvements; construct new classrooms and restrooms; and renovate plumbing and sewer systems; shall Corcoran Joint Unified School District acquire, construct, repair, and equip school facilities by issuing $24,700,000 of bonds at legal interest rates, have an independent citizens' oversight committee and have NO money used for administrative or teach salaries or be taken by the State?",11,11,GO Bond,11,11,Education: Bonds,613,570,1183,0.5181741,F,2,FailF,1,201000126,618,588,1206,0.5124378,2,FailF,10,10
201000107,2010,19,3,LOS ANGELES,2010-06-08,Los Angeles Unified,2,M,E,"To offset severe state budget cuts; promote student achievement in reading/mathematics/science/arts; maintain vocational education/job training programs; limit class size increases; reduce teacher/staff layoffs; keep schools safe/bathrooms clean; shall the Los Angeles Unified School District levy a temporary $100 annual education parcel tax ending after four years, exempting low-income seniors, no money for central district administrators' salaries, mandatory audits, with all funds going to neighborhood schools?",3,3,Property Tax,10,10,Education,198586,176459,375045,0.5294991,T,2,FailT,0,201000101,198586,176459,375045,0.5294991,2,FailT,1,10
201000108,2010,19,3,LOS ANGELES,2010-06-08,Lynwood Unified,2,M,AA,"To improve student safety by upgrading school security systems and alarms; upgrade classrooms with up-to-date technology; acquire classrooms throughout the District; and provide more money for essential learning in the classrooms, shall the Lynwood Unified School District be authorized to issue $37.4 million of bonds within legal interest rates, with annual audits and an independent citizens' oversight committee, with all funds spent locally and no money used for administrative salaries or taken by the State?",11,11,GO Bond,11,11,Education: Bonds,1312,1276,2588,0.5069552,F,2,FailF,0,201000102,1312,1276,2588,0.5069552,2,FailF,10,10
201000109,2010,23,3,MENDOCINO,2010-06-08,Anderson Valley Unified,2,M,A,"To acquire, construct, and improve classrooms and facilities, including repairing, upgrading, and modernizing Anderson Valley Elementary, improving student access to modern technology at Anderson Valley Junior Senior High, improving energy efficiency, installing solar panels to reduce energy costs, and qualifying the District for $1.5 million in State aid, shall the Anderson Valley School District be authorized to issue $15,250,000 in bonds at legal interest rates with annual audits, a citizens' oversight committee, and no money for administrator salaries or overhead?",11,11,GO Bond,11,11,Education: Bonds,551,296,847,0.6505313,F,1,PassF,0,201000103,551,296,847,0.6505313,1,PassF,10,10
201000110,2010,23,3,MENDOCINO,2010-06-08,Southern Humboldt Joint Unified,2,M,L,"To improve the quality of education, modernize and renovate all schools in the District, improve energy efficiency including installing solar panels, replace deteriorating plumbing and drainage systems, upgrade inadequate electrical systems, improve technology, modernize restrooms, and make health and safety improvements, shall the Southern Humboldt Joint Unified School District issue $25,200,000 of bonds at legal interest rates, have an independent citizens' oversight committee and have no money used for administrator or teacher salaries or be taken by the State?",11,11,GO Bond,11,11,Education: Bonds,31,18,49,0.63265306,F,1,PassF,1,201000104,1528,851,2379,0.64228666,1,PassF,10,10
201000111,2010,23,3,MENDOCINO,2010-06-08,Willits Unified,2,M,B,"Shall Willits Unified School District be authorized to acquire, construct, repair and improve local schools, including replacing portable facilities with permanent classrooms, improving student access to computers and technology, building vocational and technical classrooms, and making improvements to reduce annual operating costs and put more money in the classroom, by issuing up to $43,000,000 in bonds at legal interest rates with a citizens' oversight committee, annual audits, and provided no funds are spent on administrator salaries?",11,11,GO Bond,11,11,Education: Bonds,2211,1395,3606,0.61314476,F,1,PassF,0,201000105,2211,1395,3606,0.61314476,1,PassF,10,10
201000112,2010,27,3,MONTEREY,2010-06-08,Greenfield Union Elementary,2,M,L,"To improve the quality of education, make health and safety improvements, modernize classrooms, renovate restrooms, upgrade computers/technology, improve energy efficiency including solar panel installation, replace old plumbing and windows, and modernize Greenfield Elementary School, shall Greenfield Union School District acquire, construct, repair, equip school facilities by issuing $8,300,000 of bonds at legal interest rates, have an independent citizens' oversight committee and have NO money  used for administrative or teacher salaries or be taken by the State?",11,11,GO Bond,11,11,Education: Bonds,761,515,1276,0.59639496,F,1,PassF,0,201000106,761,515,1276,0.59639496,1,PassF,10,10
201000113,2010,30,3,ORANGE,2010-06-08,Buena Park Elementary,2,M,B,"To prevent deep cuts in Buena Park elementary and middle school educational programs; retain qualified, experienced teachers; keep school libraries open; and maintain school campuses, nurses/health and counseling services, music and physical education programs; shall Buena Park School District levy an annual tax of $.0375 per square foot of building space per each assessor's parcel, for 4 years only, with independent oversight, an exemption for senior citizens, and all funds benefiting neighborhood K-8 schools?",40,40,Initiative,10,10,Education,2334,2183,4517,0.51671463,T,2,FailT,0,201000107,2334,2183,4517,0.51671463,2,FailT,40,10
201000114,2010,30,3,ORANGE,2010-06-08,Garden Grove Unified,2,M,A,"To provide Garden Grove Unified School District students with competitive classrooms and school facilities, improve student health/safety, qualify for $200,000,000 in State funds, shall Garden Grove Unified School District repair, renovate, acquire, construct and equip classrooms, sites, school facilities, make earthquake safety improvements, repair/replace aging roofs, plumbing, heating/ventilation systems, upgrade electrical wiring, fire, security equipment by issuing $250,000,000 of bonds at legal rates, with mandatory audits, citizen oversight, and no money for administrators' salaries?",11,11,GO Bond,11,11,Education: Bonds,21149,12019,33168,0.63763267,F,1,PassF,0,201000108,21149,12019,33168,0.63763267,1,PassF,10,10
201000115,2010,34,3,SACRAMENTO,2010-06-08,Arcohe Union Elementary,2,M,A,"To acquire, construct, and improve classrooms and facilities, including continuing to upgrade student access to computers and modern technology, renovating the library to expand educational opportunities for our children, and making renewable energy improvements to reduce energy costs and put more money into the classroom, shall the Arcohe School District be authorized to issue $3,900,000 in bonds at legal interest rates with annual audits, a citizens' oversight committee, and no money for administrator salaries or overhead?",11,11,GO Bond,11,11,Education: Bonds,377,933,1310,0.28778625,F,2,FailF,0,201000109,377,933,1310,0.28778625,2,FailF,10,10
201000116,2010,36,3,SAN BERNARDINO,2010-06-08,Lucerne Valley Unified,2,M,S,"To continue improving the quality of education in local schools, by refunding certificates of participation, which financed school facilities and equipment, shall the Lucerne Valley Unified School District issue $7,950,000 of bonds at legal interest rates, with independent citizens' oversight and audits, and no money for salaries?",11,11,GO Bond,11,11,Education: Bonds,472,920,1392,0.33908045,F,2,FailF,0,201000110,472,920,1392,0.33908045,2,FailF,10,10
201000117,2010,38,3,SAN FRANCISCO,2010-06-08,San Francisco Unified,2,M,A,"To improve earthquake and fire safety and implement critical capital maintenance of its schools and facilities, shall the San Francisco Unified School District be authorized to renew the levy of an annual special tax not to exceed $32.20 per parcel for single family residential and nonresidential parcels and $16.10 per dwelling unit for mixed use and multifamily residential parcels, adjusted for inflation, in its Community Facilities District No. 90-1, and establish its annual appropriations limit at $16,000,000?",3,3,Property Tax,10,10,Education,102873,44043,146916,0.7002165,T,1,PassT,0,201000111,102873,44043,146916,0.7002165,1,PassT,1,10
201000118,2010,39,3,SAN JOAQUIN,2010-06-08,Lammersville Joint Unified-P,2,M,A,Shall a portion of Tracy Joint Unified School District and the Lammersville Elementary School District be unified to form the Lammersville Joint Unified School District with a five-member board elected at large while permitting the Mountain House Elementary School District to continue to exist as an independent elementary school district?,70,70,Ordinance,12,12,Education: Districts,909,210,1119,0.81233245,M,1,Pass,1,201000112,1853,428,2281,0.81236297,1,Pass,70,10
201000119,2010,39,3,SAN JOAQUIN,2010-06-08,Stockton City Unified,2,R,1,Shall Daniel Castillo be recalled (removed) from the office of Governing Board Member?,50,50,Recall,13,13,Education: Recall,2035,1258,3293,0.6179775,M,1,Pass,0,201000113,2035,1258,3293,0.6179775,1,Pass,50,10
201000120,2010,41,3,SAN MATEO,2010-06-08,Cabrillo Unified,2,M,E,"To continue student achievement in our local elementary, middle, and high schools; preserve strong academic programs including science, math, reading, and writing, keep schools open; retain qualified teachers and smaller class sizes; and maintain updated classroom computer technology; shall the Cabrillo Unified School District assess an annual education parcel tax of $150 per parcel, for five years, with annual audits, citizen oversight, no funds for administrators' salaries, and all revenues staying in our local schools?",3,3,Property Tax,10,10,Education,5780,2331,8111,0.7126125,T,1,PassT,0,201000114,5780,2331,8111,0.7126125,1,PassT,1,10
201000121,2010,41,3,SAN MATEO,2010-06-08,San Mateo Community College,2,M,G,"To provide College of San Mateo, Skyline College, and Canada College local funds the State cannot take away and ensure affordable quality education for students including training for careers in nursing, healthcare, technology, engineering, sciences, police, firefighting, maintaining core academics in reading, writing, math, preparing students for universities, and keeping libraries open, shall San Mateo County Community College District levy $34 per parcel annually for four years and establish Citizens' Oversight, exempt seniors, and prohibit proceeds for administrators' salaries?",3,3,Property Tax,10,10,Education,81843,40105,121948,0.6711303,T,1,PassT,0,201000115,81843,40105,121948,0.6711303,1,PassT,1,10
201000122,2010,42,3,SANTA BARBARA,2010-06-08,Hope Elementary,2,M,L,"To improve the quality of education, shall Hope School District be authorized to acquire, construct, and improve facilities, increasing student access to computers and modern technology, providing comparable school libraries, and installing solar panels to qualify for over $900,000 in savings and reimbursements and reduce operating costs, by issuing $8,000,000 in bonds at legal interest rates, with an independent citizens' oversight committee, annual audits, and provided bonds are only issued with NO estimated increase in tax rate?",11,11,GO Bond,11,11,Education: Bonds,3278,1468,4746,0.6906869,F,1,PassF,0,201000116,3278,1468,4746,0.6906869,1,PassF,10,10
201000123,2010,43,3,SANTA CLARA,2010-06-08,Alum Rock Union Elementary,2,M,I,"To protect local schools from budget cuts, provide stable funding that cannot be taken away by the State, and preserve quality education by maintaining reading, math and science programs; attracting and retaining qualified teachers and school counselors; keeping school libraries open; and maintaining small K-3 class sizes; shall Alum Rock Union Elementary School District increase its expiring parcel tax by $48.00 per parcel for 5 years, with annual adjustments for inflation, independent citizen oversight and no money for administrators' salaries?",3,3,Property Tax,10,10,Education,8173,2812,10985,0.74401456,T,1,PassT,0,201000117,8173,2812,10985,0.74401456,1,PassT,1,10
201000124,2010,43,3,SANTA CLARA,2010-06-08,Campbell Union Elementary,2,M,G,"To provide safe, modern schools by reparing leaky roofs; prviding disabled access; upgrading wiring, electrical, fire alarm and security systems; improving energy efficiency; replacing failing heating and cooling systems; upgrading computer learning technology; and constructing and equipping classrooms and facilites, shall Campbell Union Elementary School District issue $150 million in bonds under a no-tax-rate-increas financing plan, at lawful interest rates, with citizen oversight and independent audits, and using no funds for administrators' salaries?",11,11,GO Bond,11,11,Education: Bonds,12753,4484,17237,0.7398619,F,1,PassF,0,201000118,12753,4484,17237,0.7398619,1,PassF,10,10
201000125,2010,43,3,SANTA CLARA,2010-06-08,Los Gatos Union Elementary,2,M,E,To accommodate increasing student enrollment and continue modernizing elementary and middle schools in the Los Gatos Union School District by creating additional classrooms and school facilites to avoid overcrowding: providing science labs; improving energy efficiency and fire safety; replacing aging portable classrooms and infrastructure; and improving student access to information technology; shall the Los Gatos Union School District be authorized to issue $30.9 million in general obligation bonds subject to an annual audit and with an independent citizens' ovesight committee?,11,11,GO Bond,11,11,Education: Bonds,6412,2554,8966,0.7151461,F,1,PassF,0,201000119,6412,2554,8966,0.7151461,1,PassF,10,10
201000126,2010,43,3,SANTA CLARA,2010-06-08,Milpitas Unified,2,M,B,"Milpitas Unified School District high quality educatin and local control measure. To help protect local school from state budget cuts; provide revenue to stabilize local school funding; help maintain existing math, science, engineering, arts, music, athletic programs and smaller class sizes; and help prevent reduction in classroom instruction days, shall the Milpitas Unified School District assess an annual parcel tax of $84 for 5 years, with annual audits, exemptions for senior citizens, no money for district office administrators, and citizen oversight?",3,3,Property Tax,10,10,Education,7002,2889,9891,0.70791626,T,1,PassT,0,201000120,7002,2889,9891,0.70791626,1,PassT,1,10
201000127,2010,43,3,SANTA CLARA,2010-06-08,Mountain View-Los Altos Union High,2,M,A,"Local High School Improvement Measure. Without increasing current tax rates, shall Mountain View-Los Altos Union High School District add classrooms and science labs to prevent student overcrowding, improve instructional technology to support academic programs, lower energy costs by upgrading heating, ventilation, electrical and other systems, improve/add student safety systems, repair, construct and acquire school facilities and equipment, by issuing $41,300,000 in bonds at legal interest rates, with all expenditures subject to independent citizens' oversight.",11,11,GO Bond,11,11,Education: Bonds,19480,5587,25067,0.7771173,F,1,PassF,0,201000121,19480,5587,25067,0.7771173,1,PassF,10,10
201000128,2010,43,3,SANTA CLARA,2010-06-08,Mt. Pleasant Elementary,2,M,H,"Continue improving the quality of local elementary schools by protecting reading, math and science programs, restoring libraries, music/art, retaining qualified teachers, including those for students with special needs and tutoring programs, maintaining updated classroom materials/computer technology, and reduce class size, shall Mount Pleasant Elementary School District levy an annual education tax of $95 per parcel for five years with an exemption for seniors, no funds for administrator's salaries, independent citizen oversight and all funds benefiting local schools?",3,3,Property Tax,10,10,Education,2099,842,2941,0.7137028,T,1,PassT,0,201000122,2099,842,2941,0.7137028,1,PassT,1,10
201000129,2010,43,3,SANTA CLARA,2010-06-08,Oak Grove Elementary,2,M,C,"Shall the Gann Appropriations Limit increase approved by the Oak Grove School District voters in 1991 be continued for four years, allowing the District to continue to expend funds generated by the existing special tax of $68 per parcel for remedial services, repair of school buildings and grounds, purchase of instructional supplies and equipment, installation of energy conservation equipment, and restoration of services reduced in prior years in the library, counseling, custodial and maintenance areas?",3,3,Property Tax,10,10,Education,11890,4376,16266,0.7309726,M,1,Pass,0,201000123,11890,4376,16266,0.7309726,1,Pass,1,10
201000130,2010,49,3,SONOMA,2010-06-08,Mark West Union Elementary,2,M,C,"In order to improve locals schools and classrooms by making health and safety improvements to campuses, upgrading restrooms, plumbing, heating, ventilation and airconditioning systems, fixing leaking roofs, expanding student access to computers and technology, and removing or replacing outdated portables, shall Mark West Union School District be authorized to issue up to $14,000,000 in bonds at lawful interest rates, with annual audits, citizen oversight, and no money for administrators' salaries?",11,11,GO Bond,11,11,Education: Bonds,2372,1622,3994,0.59389085,F,1,PassF,0,201000124,2372,1622,3994,0.59389085,1,PassF,10,10
201000131,2010,51,3,SUTTER,2010-06-08,Sutter Union High,2,R,1,Shall Tim Crabtree be recalled (removed) from the office of Governing Board Member?,50,50,Recall,13,13,Education: Recall,1482,548,2030,0.73004925,M,1,Pass,0,201000125,1482,548,2030,0.73,1,Pass,50,10
201000132,2010,54,3,TULARE,2010-06-08,Corcoran Joint Unified,2,M,Q,"To improve the quality of educaiton, modernize, upgrade and repair classrooms and school facilities in the District; improve energy efficiency; make health/safety improvements; construct new classrooms and restrooms; and renovate plumbing and sewer systems; shall Corcoran Joint Unified School District acquire, construct, repair, and equip school facilities by issuing $24,700,000 of bonds at legal interest rates, have an independent citizens' oversight committee and have NO money used for administrative or teach salaries or be taken by the State?",11,11,GO Bond,11,11,Education: Bonds,5,18,23,0.2173913,F,2,FailF,1,201000126,618,588,1206,0.5124378,2,FailF,10,10
201000133,2010,54,3,TULARE,2010-06-08,Cutler-Orosi Joint Unified,2,M,P,"To develop a recreation department within the Cutler-Orosi area to promote youth activities including sports, and other experiences that develop young people into active, responsible citizens, shall Cutler-Orosi Joint Unified School District levy a tax of $97.00 per parcel annually, with annual cost of living adjustments, so long as the Cutler-Orosi School Board oversees the program?",3,3,Property Tax,10,10,Education,431,440,871,0.49483353,T,2,FailT,1,201000127,453,569,1022,0.44324854,2,FailT,1,10
