MeasID,YEAR,CO,JUR,CNTYNAME,DATE,PLACE,CSD,MEASTYPE,LTR,BALQUEST,Orig_TYPE,RECTYPE,RECTYPENAME,Orig_TOPIC,RECTOPIC,RECTOPNAME,YES,NO,TOTAL,PERCENT,REQ,OUTCOME,PASSFAIL,Multi_CO,Multi_MeasID,YES_sum,NO_sum,Total_sum,Percent_sum,Outcome_sum,Passfail_sum,typerec,topicrec,OTH
201100089,2011,13,2,Imperial,2011-11-08,Brawley,2,M,K,"Shall the City of Brawley extend the collection of the Utility User tax in an amount Not to exceed four percent, upon the following utilities: defined telephone, electricity, gas, water, sewer, trash and cable television; in order to maintain City public services, including, but not limited to police, fire, administration, library and parks and recreation, and subject to future council action to reduce said percentage, for a period of time which would expire on May 31, 2018?",5,5,Utility Tax,112,112,Revenues: Tax Creation/Incr./Contin.,1653,1207,2860,0.577972,M,1,Pass,0,201100086,1653,1207,2860,0.577972,1,Pass,1,110,0
201100090,2011,13,2,Imperial,2011-11-08,Holtville,2,M,M,"Shall the ordinance reducing the Utility Users Tax by 1% a year for a five year period commencing July 1, 2012 until the tax is totally eliminated be adopted?",5,5,Utility Tax,111,111,Revenues: Tax Repeal/Reduction/Limit,274,292,566,0.484099,M,2,Fail,0,201100087,274,292,566,0.484099,2,Fail,1,110,0
201100091,2011,13,2,Imperial,2011-11-08,Holtville,2,M,N,"Shall the City of Holtville reduce the current 5% Utility Users Tax by 0.5% each year beginning with fiscal year 2012-2013, for a period of three years (through November 2016), whereupon the City Council shall consider the continued reduction of the remaining 3.5% Utility Users Tax?",5,5,Utility Tax,111,111,Revenues: Tax Repeal/Reduction/Limit,200,352,552,0.362319,M,2,Fail,0,201100088,200,352,552,0.362319,2,Fail,1,110,0
201100092,2011,13,2,Imperial,2011-11-08,Holtville,2,M,O,"Shall the electors of the City of Holtville extend the five percent (5%) Utility Users Tax for a period of five years through 2016, in order to maintain City General Government Services, including police (sheriff), fire and emergency paramedic services, parks and recreation services, equipment and facilities?",5,5,Utility Tax,112,112,Revenues: Tax Creation/Incr./Contin.,241,325,566,0.425795,M,2,Fail,0,201100089,241,325,566,0.425795,2,Fail,1,110,0
201100093,2011,15,2,Kern,2011-11-08,California City,2,M,A,"Shall a city-wide special tax of up to $150.00 per lot or parcel be approved for each of ten (10) fiscal years beginning July 1, 2012, for (1) police operations, training and supplies, personnel, equipment, law enforcement, dispatch, code enforcement, and animal control, and (2) fire prevention and suppression operations, training and supplies, firefighter and paramedic personnel, equipment and supplies?",3,3,Property Tax,30,30,Safety,1250,731,1981,0.630994,T,2,FailT,0,201100090,1250,731,1981,0.630994,2,FailT,1,30,0
201100094,2011,19,2,Los Angeles,2011-11-08,Vernon,2,M,A,"Shall the Vernon City Charter be amended to limit the number of terms a City Council member may serve at two terms, with a lifetime band thereafter?",20,20,Charter Amendment,45,45,Governance: Political Reform/Term Limits,43,9,52,0.826923,M,1,Pass,0,201100091,43,9,52,0.826923,1,Pass,20,40,0
201100095,2011,19,2,Los Angeles,2011-11-08,Vernon,2,M,B,Shall the Vernon City Charter be amended to reaffirm the City's longstanding policy of ensuring the payment of prevailing wages on public works projects?,20,20,Charter Amendment,42,42,Governance: Personnel/Labor Relations,52,0,52,1.0,M,1,Pass,0,201100092,52,0,52,1.0,1,Pass,20,40,0
201100096,2011,19,2,Los Angeles,2011-11-08,Vernon,2,M,C,Shall the Vernon City Charter be amended to remove the provision mandating at-will employment for City employees?,20,20,Charter Amendment,42,42,Governance: Personnel/Labor Relations,52,0,52,1.0,M,1,Pass,0,201100093,52,0,52,1.0,1,Pass,20,40,0
201100097,2011,19,2,Los Angeles,2011-11-08,Maywood,2,M,C,Shall the Office of City Clerk of the City of Maywood be appointive?,70,70,Ordinance,43,43,Governance: Organization,536,745,1281,0.418423,M,2,Fail,0,201100094,536,745,1281,0.418423,2,Fail,70,40,0
201100098,2011,19,2,Los Angeles,2011-11-08,Vernon,2,M,D,Shall Article VI of the Vernon City Charter be amended to eliminate restrictions on the City Council's authority to remove the City Administrator and to reduce the City Administrator's compensation?,20,20,Charter Amendment,42,42,Governance: Personnel/Labor Relations,52,0,52,1.0,M,1,Pass,0,201100095,52,0,52,1.0,1,Pass,20,40,0
201100099,2011,19,3,Los Angeles,2011-11-08,Newhall Elementary,2,M,E,"Without increasing local tax rates and to protect the quality of education in neighborhood elementary schools, shall School Facilities Improvement District No. 2011-1 of the Newhall School District, repair/replace deteriorated roofs, lighting, and electrical systems; upgrade classrooms, science labs, libraries and technology; and improve energy efficiency, using savings to maintain instruction; by issuing $60 million in bonds at legal interest rates, with mandatory audits, independent citizen oversight, no money for administrators, and all funds staying in our community benefiting local children grades K-6?",11,11,GO Bond,11,11,Education: Bonds,3706,1850,5556,0.667027,F,1,PassF,0,201100096,3706,1850,5556,0.667027,1,PassF,10,10,0
201100101,2011,19,3,Los Angeles,2011-11-08,Palos Verdes Peninsula Unified,2,M,M,"Without increasing existing taxes and to protect the quality of education and promote student achievement shall Palos Verdes Peninsula Unified School District extend the existing school parcel taxes to fund advanced programs in math, science and technology, keep classroom technology up-to-date, attract and retain highly qualified teachers, and maintain manageable class sizes, with an exemption for seniors, a cost of living adjustment for inflation, with all money staying in our community to benefit local schools?",3,3,Property Tax,10,10,Education,9499,4298,13797,0.688483,T,1,PassT,0,201100098,9499,4298,13797,0.688483,1,PassT,1,10,0
201100102,2011,19,2,Los Angeles,2011-11-08,Hermosa Beach,2,M,N,"Shall an ordinance be adopted as recommended by the Business License Tax Review Committee, comprised of residents and business owners, and a unanimous City Council to simplify, update and restructure the City's business license tax Ordinance and offer incentives for new businesses?",70,70,Ordinance,110,110,Revenues,1703,1076,2779,0.61281,M,1,Pass,0,201100099,1703,1076,2779,0.61281,1,Pass,70,110,0
201100103,2011,19,2,Los Angeles,2011-11-08,Montebello,2,M,O,Shall an ordinance be approved which requires franchises for providing solid waste (trash) hauling services to be awarded through a competitive bidding process requiring a public hearing and other compliance requirements to ensure fairness and transparency?,70,70,Ordinance,47,47,Governance: Contracting/Bidding/Leasing,3039,1236,4275,0.710877,M,1,Pass,0,201100100,3039,1236,4275,0.710877,1,Pass,70,40,0
201100104,2011,19,2,Los Angeles,2011-11-08,San Marino,2,M,P,"Shall an ordinance be adopted to establish term limits for members of the City Council limiting them to two (2), four (4) year consecutive terms, with a hiatus of two (2) years before being eligible to hold office again as a member of the City Council",70,70,Ordinance,45,45,Governance: Political Reform/Term Limits,1794,568,2362,0.759526,M,1,Pass,0,201100101,1794,568,2362,0.759526,1,Pass,70,40,0
201100105,2011,19,2,Los Angeles,2011-11-08,Hermosa Beach,2,I,Q,(INITIATIVE) Shall an ordinance be adopted as submitted by initiative petition to amend the City's business license tax ordinance by modifying the amount of business license tax on restaurants and bars in order to increase tax revenue to the City?,40,40,Initiative,110,110,Revenues,610,2128,2738,0.22279,M,2,Fail,0,201100102,610,2128,2738,0.22279,2,Fail,40,110,0
201100106,2011,19,2,Los Angeles,2011-11-08,San Marino,2,M,S,"Shall an ordinance be adopted to continue a Special Public Safety Tax for Paramedic Services, Fire Protection and Prevention and Police Protection in the City of San Marino?",7,7,Miscellaneous Tax,34,34,Safety: Multiple Emergency Services,1794,651,2445,0.733742,T,1,PassT,0,201100103,1794,651,2445,0.733742,1,PassT,1,30,0
201100107,2011,19,2,Los Angeles,2011-11-08,Maywood,2,M,T,Shall the Office of City Treasurer of the City of Maywood be appointive?,70,70,Ordinance,43,43,Governance: Organization,505,773,1278,0.395149,M,2,Fail,0,201100104,505,773,1278,0.395149,2,Fail,70,40,0
201100108,2011,19,2,Los Angeles,2011-11-08,South Pasadena,2,M,UT,"To offset state cuts and provide vital city services, shall an ordinance be adopted to extend and reduce the South Pasadena Utility User's Tax from 8% to 7.5% to maintain police patrols, fire, paramedics and 9-1-1 emergency services and safety equipment; fix potholes; repair streets and sidewalks; maintain senior meals and services; and other essential city services, requiring equal taxpayer treatment, annual audits, with no funds for Sacramento, with the entire tax expiring in 10 years?",5,5,Utility Tax,111,111,Revenues: Tax Repeal/Reduction/Limit,2463,2104,4567,0.539304,M,1,Pass,0,201100105,2463,2104,4567,0.539304,1,Pass,1,110,0
201100109,2011,21,3,Marin,2011-11-08,Larkspur-Corte Madera Unified,2,M,A,"To relieve overcrowding in the Larkspur-Corte Madera School District by reopening the San Clemente School site; make essential fire and earthquake safety upgrades to existing facilities; improve access for the disabled; repair or replace outdated heating, ventilation and electrical systems; and enhance classroom technology infrastructure, shall the Larkspur-Corte Madera School District be authorized to issue up to twenty-six million dollars in bonds and establish a citizens' oversight committee to ensure all expenditures are made according to approved plans?",11,11,GO Bond,11,11,Education: Bonds,3243,1331,4574,0.709007,F,1,PassF,0,201100106,3243,1331,4574,0.709007,1,PassF,10,10,0
201100110,2011,21,3,Marin,2011-11-08,Tamalpais Union High,2,M,B,"To maintain quality public high school education including small class sizes and exceptional instructional programs in Belvedere, Bolinas, Corte Madera, Fairfax, Greenbrae, Kentfield, Larkspur, Marin City, Mill Valley, Nicasio, Ross, San Anselmo, San Geronimo, Sausalito, Stinson Beach, and Tiburon, shall Tamalpais Union High School District be authorized to renew a parcel tax for ten years commencing July 1, 2012, at the current rate plus an annual 3% increase ($245.94 + tax year 2012-2013), with an exemption for parcels owned and occupied by persons 65 and older?",3,3,Property Tax,10,10,Education,22146,8040,30186,0.733651,T,1,PassT,0,201100107,22146,8040,30186,0.733651,1,PassT,1,10,0
201100111,2011,21,2,Marin,2011-11-08,Corte Madera,2,M,C,"In order to continue existing emergency services in the Town of Corte Madera, shall there be a continuation of the special tax for paramedic and/or emergency medical services for four more years at the annual amount of $60.00 per residence and per 1,000 square feet of floor area for nonresidential uses for fiscal year 2011-2012, increasing a maximum of $5.00 yearly, if needed, with the appropriations limit increasing by the amount of said tax?",3,3,Property Tax,36,36,Safety: Emergency Medical/Paramedic,2540,539,3079,0.824943,T,1,PassT,0,201100108,2540,539,3079,0.824943,1,PassT,1,30,0
201100112,2011,21,2,Marin,2011-11-08,Fairfax,2,M,D,"To offset declining property tax revenues and severe state budget cuts and to prevent further cuts to general Town services, shall an ordinance be adopted to enact a one-half cent transaction and use tax in the Town of Fairfax, subject to annual independent audits, public expenditure reports, local use of all funds, and expiration on March 31, 2017?",4,4,Sales Tax,112,112,Revenues: Tax Creation/Incr./Contin.,1568,829,2397,0.654151,M,1,Pass,0,201100109,1568,829,2397,0.654151,1,Pass,1,110,0
201100113,2011,21,1,Marin,2011-11-08,Lucas Valley County Service Area No.13,1,M,E,"Shall the existing special tax for paramedic services be increased from $85.00 to a maximum of $95.00 per year for each living unit, and from 11 cents to a maximum of 13.2 cents per square foot of structure for each non-residential structure? These increases will be phased in over four years.",3,3,Property Tax,36,36,Safety: Emergency Medical/Paramedic,367,107,474,0.774262,T,1,PassT,0,201100110,367,107,474,0.774262,1,PassT,1,30,0
201100114,2011,21,1,Marin,2011-11-08,Santa Venetia-Bayside Acres Fire Protection District County Service Area No.19,1,M,F,"Shall the existing special tax for paramedic services be increased from $85.00 to a maximum of $95.00 per year for each living unit, and from 11 cents to a maximum of 13.2 cents per square foot of structure for each non-residential structure? These increases will be phased in over four years.",3,3,Property Tax,36,36,Safety: Emergency Medical/Paramedic,947,331,1278,0.741002,T,1,PassT,0,201100111,947,331,1278,0.741002,1,PassT,1,30,0
201100115,2011,21,1,Marin,2011-11-08,Marinwood CSD,1,M,G,"To maintain current fire protection services, shall Resolution No. 2011-06 be approved increasing the Special Tax for Fire Protection Service by 10 cents to a maximum of 28 cents per square foot of living or working area, and by $30 to a maximum of $90 per acre of unimproved lands, with annual cost of living adjustments consistent with CPI, and the appropriation limit increased by the amount of said tax?",3,3,Property Tax,33,33,Safety: Fire,888,436,1324,0.670695,T,1,PassT,0,201100112,888,436,1324,0.670695,1,PassT,1,30,0
201100116,2011,23,1,Mendocino,2011-11-08,Mendocino,2,M,A,"Shall the ordinance titled ""Library Special Transactions And Use Tax"" be approved?",7,7,Miscellaneous Tax,71,71,Facilities: Libraries,15000,4825,19825,0.75662,M,1,Pass,0,201100113,15000,4825,19825,0.75662,1,Pass,1,70,0
201100117,2011,26,3,Mono,2011-11-08,Mammoth Unified,2,M,S,"To protect our local schools from ongoing state budget cuts and to maintain high quality academic programs by preserving smaller classes, attracting and retaining excellent teachers, strengthening core curriculum, and enhancing technology, art, music and athletics, shall Mammoth Unified School District extend the current $59 annual education parcel tax for five years with an exemption for senior citizens' primary residences, overseen by an independent citizen's oversight committee, and every dollar spent on Mammoth Schools?",3,3,Property Tax,10,10,Education,1213,399,1612,0.752481,T,1,PassT,0,201100114,1213,399,1612,0.752481,1,PassT,1,10,0
201100118,2011,27,2,Monterey,2011-11-08,Del Rey Oaks,2,M,S,"Shall the existing one percent (1%) Transactions and Use Tax be re-authorized and extended for a period of not more than five (5) years, unless terminated sooner by the City Council or unless extension or re-authorization is approved by the voters of the City at an election called for that purpose, the proceeds of said tax to be utilized for general purposes?",4,4,Sales Tax,112,112,Revenues: Tax Creation/Incr./Contin.,323,54,377,0.856764,M,1,Pass,0,201100115,323,54,377,0.856764,1,Pass,1,110,0
201100119,2011,27,3,Monterey,2011-11-08,Bradley Union Elementary,2,M,T,"To improve the quality of education at Bradley School, make health and safety improvements; modernize classrooms and restrooms; repair leaky roofs; improve student access to computers and modern technology; upgrade outdated electrical systems; and replace old heating, ventilation and air-conditioning systems, shall the Bradley Union Elementary School District issue $1,100,000 of bonds at legal interest rates, have an independent citizens' oversight committee and have NO money used for administrative or teacher salaries to be taken by the State?",11,11,GO Bond,11,11,Education: Bonds,33,21,54,0.611111,F,1,PassF,0,201100116,33,21,54,0.611111,1,PassF,10,10,0
201100120,2011,27,2,Monterey,2011-11-08,Pacific Grove,2,M,U,Shall Chapter 23.52 of the Pacific Grove municipal Code be amended to allow not more than 79 (total) additional motel guest units and ease guest unit restrictions that existed prior to voter approval of measure C in 1986?,20,20,Charter Amendment,22,22,Land Use: Zoning,2804,1053,3857,0.72699,M,1,Pass,0,201100117,2804,1053,3857,0.72699,1,Pass,20,20,0
201100121,2011,27,3,Monterey,2011-11-08,Pacific Grove Unified,2,M,V,"To preserve the educational quality of our schools in the face of Statewide budget cuts, including but not limited to science, math, music, art, computers and libraries; maintain small class sized; and retain qualified teachers; shall Pacific Grove Unified School District levy $60 per parcel for four years to replace and extend the previously approved tax, with an independent citizens' oversight committee, and all funds spent locally and no money used for administrative salaries or taken by the State?",3,3,Property Tax,10,10,Education,2972,1789,4761,0.624239,T,2,FailT,0,201100118,2972,1789,4761,0.624239,2,FailT,1,10,0
201100122,2011,32,1,Plumas,2011-11-08,West Alamanor CSD,1,M,A,"Upon a two-thirds vote of approval, shall a special tax, replacing the current special tax of $90.00 which will expire on June 30, 2012, be imposed for an indefinite period starting July 1, 2012 for the specific purpose of emergency medical response, fire protection and prevention and hazardous materials response; and shall this tax be authorized in the amount of $200.00 per year on each parcel of real property or condominium unit within the District, excluding those parcels exempt from property tax and the following parcel numbers: 108-010-004, 108-101-008, 108-101-015, 108-010-016, 108-010-017, 108-010-021, 108-010-023, 108-053-006, 108-053-007, 108-090-002, 108-141-001, 108-211-008, 108-283-004, 108-232-001, 108-241-003 and 108-320-035, said tax will be collected along with the Plumas County property taxes and shall the District appropriations limit (spending limit) be raised by the amount of the annual proceeds from this special tax for the period this tax is in effect, which revenue shall be deposited into a specifically created account on which an annual report shall be made as required by Government Code Section 50075.3?",3,3,Property Tax,34,34,Safety: Multiple Emergency Services,122,64,186,0.655914,T,2,FailT,0,201100119,122,64,186,0.655914,2,FailT,1,30,0
201100123,2011,33,2,Riverside,2011-11-08,Indian Wells,2,M,H,Shall Ordinance Bill No. 2011-05 be adopted to approve an increase in the City's Transient Occupancy Tax from the current rate of nine and one-quarter percent (9.25%) to a rate of eleven and one-quarter percent (11.25%)?,9,9,Transient Occupancy Tax,112,112,Revenues: Tax Creation/Incr./Contin.,857,455,1312,0.653201,M,1,Pass,0,201100120,857,455,1312,0.653201,1,Pass,1,110,0
201100124,2011,33,2,Riverside,2011-11-08,Riverside,2,M,I,"Should library services for all City of Riverside residents including children, teens, adults, and seniors, be continued without a tax increase, to preserve after-school programs, retain librarians, provide homework assistance and reading programs for seniors, and materials for the hearing and vision impaired, by continuing the $19 annual library parcel tax, for ten years, with annual audits, and all funds spent locally on library services, with no money taken by the State?",3,3,Property Tax,71,71,Facilities: Libraries,17495,3080,20575,0.850304,T,1,PassT,0,201100121,17495,3080,20575,0.850304,1,PassT,1,70,0
201100125,2011,33,2,Riverside,2011-11-08,Palm Springs,2,M,J,"Shall an ordinance to provide funding that cannot be taken by the State and help preserve Palm Springs' city services, including without limitation police, fire, library, parks, streets/pothole repair, acquisition and development of garages and parking facilities, installation and maintenance of improvements and facilities for the implementation of the Museum Market Plaza Specific Plan, by enacting a City of Palm Springs 1% sales and use tax, for 25 years, subject to independent annual audits, be adopted?",4,4,Sales Tax,112,112,Revenues: Tax Creation/Incr./Contin.,6550,4845,11395,0.574814,M,1,Pass,0,201100122,6550,4845,11395,0.574814,1,Pass,1,110,0
201100126,2011,33,2,Riverside,2011-11-08,Coachella,2,M,K,"Shall the ordinance adding Chapter 4.26 to the City Code to approve a 1/2 percent sales and use tax, in order to continue funding general municipal services, be adopted?",70,70,Ordinance,112,112,Revenues: Tax Creation/Incr./Contin.,806,291,1097,0.734731,M,1,Pass,0,201100123,806,291,1097,0.734731,1,Pass,70,110,0
201100127,2011,33,2,Riverside,2011-11-08,Coachella,2,A,L,"(ADVISORY) If the City's Sales and Use Tax is increased by 0.5%, should the City solely allocate the additional revenue towards purchasing and constructing park and recreational facilities and providing related park and recreational services, and prohibit the additional revenue from being used for general City operations?",30,30,Advisory,78,78,Facilities: Parks & Recreation,557,534,1091,0.510541,M,1,Pass,0,201100124,557,534,1091,0.510541,1,Pass,30,70,0
201100128,2011,38,3,San Francisco,2011-11-08,San Francisco Unified,2,M,A,"Shall San Francisco Unified School District repair and rehabilitate facilities to current accessibility, health, safety and instructional standards, replace worn out plumbing, electrical and other major building systems, replace aging heating, ventilation and air handling systems, renovate outdated classrooms and training facilities, construct facilities to replace aging modular classrooms, by issuing bonds in an amount not to exceed $531,000,000, at legal interest rates, with guaranteed annual audits, citizens' oversight and no money for school administrators' salaries?",11,11,GO Bond,11,11,Education: Bonds,134695,54750,189445,0.710998,F,1,PassF,0,201100125,134695,54750,189445,0.710998,1,PassF,10,10,0
201100129,2011,38,1,San Francisco,2011-11-08,San Francisco,2,M,B,"To fix potholes and repave deteriorating streets in neighborhoods throughout San Francisco, repair and strengthen deteriorating stairways, bridges and overpasses, improve safety for pedestrians and bicyclists, improve disabled access to sidewalks, and construct and renovate traffic infrastructure to improve Municipal Transportation Agency transit reliability and traffic flow on local streets, shall the City and County of San Francisco issue $248,000,000 in general obligation bonds subject to independent oversight and regular audits?",11,11,GO Bond,60,60,Transport,129123,60733,189856,0.68011,T,1,PassT,0,201100126,129123,60733,189856,0.68011,1,PassT,10,60,0
201100130,2011,38,1,San Francisco,2011-11-08,San Francisco,2,M,C,Shall the City amend its Charter to adjust pension contribution rates for most current and future City employees based on the City's costs; reduce pension benefits for future City employees; limit cost-of-living adjustments to pension benefits; decrease City contributions to retiree health care costs for certain former employees; require all current and future employees to contribute toward their retiree health care costs; change the composition and voting requirements of the Health Service Board; and make other changes to the City's retirement and health benefits systems?,20,20,Charter Amendment,42,42,Governance: Personnel/Labor Relations,129511,58445,187956,0.68905,M,1,Pass,0,201100127,129511,58445,187956,0.68905,1,Pass,20,40,0
201100131,2011,38,1,San Francisco,2011-11-08,San Francisco,2,M,D,Shall the City amend its Charter to increase pension contribution rates for most current City employees based on the City's costs; reduce contribution rates and pension benefits for most future City employees; limit cost-of-living adjustments to pension benefits; prohibit the City from picking up any employee's contribution for pension benefits; and make other changes to the City's retirement system?,20,20,Charter Amendment,42,42,Governance: Personnel/Labor Relations,124002,62349,186351,0.665422,M,1,Pass,0,201100128,124002,62349,186351,0.665422,1,Pass,20,40,0
201100132,2011,38,1,San Francisco,2011-11-08,San Francisco,2,M,E,"Shall the City amend its Charter to allow the Board of Supervisors and the Mayor to amend or repeal initiative ordinances and declarations of policy that the Board of Supervisors or the Mayor place on the ballot and that the voters approve after January 1, 2012?",20,20,Charter Amendment,40,40,Governance,59356,121202,180558,0.328736,M,2,Fail,0,201100129,59356,121202,180558,0.328736,2,Fail,20,40,0
201100133,2011,38,1,San Francisco,2011-11-08,San Francisco,2,M,F,"Shall the City amend its campaign consultant ordinance to redefine ""campaign consultant;"" require campaign consultants to file monthly reports; authorize the City's Ethics Commission to require electronic filing instead of paper reports; change the calculation of City fees campaign consultants must pay; and allow the City to change any of the ordinance's requirements without further voter approval while still permitting voters to make additional changes?",70,70,Ordinance,48,48,Governance: Elections,77240,98761,176001,0.438861,M,2,Fail,0,201100130,77240,98761,176001,0.438861,2,Fail,70,40,0
201100134,2011,38,1,San Francisco,2011-11-08,San Francisco,2,M,G,"Shall the City increase its local sales tax by 0.50% for up to 10 years to fund public safety programs and programs for children and seniors, unless the State increases its sales tax by either 1.0% before November 30, 2011 or 0.75% before January 1, 2016?",4,4,Sales Tax,30,30,Safety,86033,100490,186523,0.461246,T,2,FailT,0,201100131,86033,100490,186523,0.461246,2,FailT,1,30,0
