MeasID,YEAR,CO,JUR,CNTYNAME,DATE,PLACE,CSD,MEASTYPE,LTR,BALQUEST,Orig_TYPE,RECTYPE,RECTYPENAME,Orig_TOPIC,RECTOPIC,RECTOPNAME,YES,NO,TOTAL,PERCENT,REQ,OUTCOME,PASSFAIL,Multi_CO,Multi_MeasID,YES_sum,NO_sum,Total_sum,Percent_sum,Outcome_sum,passfail_sum,typerec,topicrec
199600001,1996,52,1,TEHAMA,1996-02-06,TEHAMA,0,R,Dist. 2,"Recall of Supervisor, District Two - Shirley M. Marelli.",50,50,Recall,48,46,Governance: Recall,8265,4144,12409,0.6660488355226045,M,1,Pass,0,199600001,8265,4144,12409,0.6660488355226045,1,Pass,50,40
199600002,1996,52,1,TEHAMA,1996-02-06,TEHAMA,0,R,Dist. 4,"Recall of Supervisor, District Four - Joann Landingham.",50,50,Recall,48,46,Governance: Recall,7714,4589,12303,0.6270015443387792,M,1,Pass,0,199600002,7714,4589,12303,0.6270015443387792,1,Pass,50,40
199600003,1996,52,1,TEHAMA,1996-02-06,TEHAMA,0,R,Dist. 5,"Recall of Supervisor, District Five - Kathleen Rowen.",50,50,Recall,48,46,Governance: Recall,8422,3869,12291,0.6852168253193394,M,1,Pass,0,199600003,8422,3869,12291,0.6852168253193394,1,Pass,50,40
199600004,1996,37,3,SAN DIEGO,1996-02-27,SWEETWATER UNION HIGH SCHOOL DISTRICT-SEAT 2,0,R,2,Shall STEVE HOGAN be recalled (removed) from Seat No. 2 of the Governing Board for Sweetwater Union High School District?,50,50,Recall,46,13,Education: Recall,7195,8587,15782,0.4558991255861108,M,2,Fail,0,199600004,7195,8587,15782,0.45589912558611073,2,Fail,50,10
199600005,1996,37,3,SAN DIEGO,1996-02-27,SWEETWATER UNION HIGH SCHOOL DISTRICT-SEAT 3,0,R,3,Shall GREG R. SANDOVAL be recalled (removed) from Seat No. 3 of the Governing Board for Sweetwater Union High School District?,50,50,Recall,46,13,Education: Recall,6805,9588,16393,0.41511620813761974,M,2,Fail,0,199600005,6805,9588,16393,0.41511620813761974,2,Fail,50,10
199600006,1996,37,3,SAN DIEGO,1996-02-27,SWEETWATER UNION HIGH SCHOOL DISTRICT-SEAT 4,0,R,4,Shall ROBERT GRIEGO be recalled (removed) from Seat No. 4 of the Governing Board for Sweetwater Union High School District?,50,50,Recall,46,13,Education: Recall,7229,9303,16532,0.4372731671909025,M,2,Fail,0,199600006,7229,9303,16532,0.4372731671909025,2,Fail,50,10
199600007,1996,2,1,ALPINE,1996-03-26,ALPINE,0,R,,"Shall WARREN JANG be recalled (removed) from the office of Supervisor, 4th District of Alpine County?",50,50,Recall,48,46,Governance: Recall,114,38,152,0.75,M,1,Pass,0,199600007,114,38,152,0.75,1,Pass,50,40
199600008,1996,4,1,BUTTE,1996-03-26,BUTTE,0,M,A,"In order to maintain the current level of County services, including fire protection, law enforcement, criminal prosecution and library services, shall the Utility User Tax levied in the unincorporated area of Butte County by Ordinance Number 3229 be aproved, thereby continuing the tax at its current rate until the year 20, at which time the tax shall expire?",5,5,Utility Tax,100,112,Revenues: Tax Creation/Incr./Contin.,16906,14170,31076,0.544021109537907,M,1,Pass,0,199600008,16906,14170,31076,0.544021109537907,1,Pass,1,110
199600009,1996,5,1,CALAVERAS,1996-03-26,CALAVERAS,0,M,A,"Shall the ""Calaveras Municipal Utility District"" be created and established as a Countywide district with the intent to seek approval to provide electric service?",70,70,Ordinance,43,43,Governance: Organization,3648,1086,4734,0.770595690747782,M,1,Pass,0,199600009,3648,1086,4734,0.770595690747782,1,Pass,70,40
199600010,1996,5,1,CALAVERAS,1996-03-26,CALAVERAS,0,M,B,"Shall the County-wide Transient Occupancy Tax be raised from six percent (6%) to eight percent (8%), with an amount equal to thirty-one percent (31%) of the total Transient Occupancy Tax received by the County to be used to promote tourism in the County?",2,2,Business Tax,200,201,Other: Promotion of Tourism,3964,8252,12216,0.3244924688932547,T,2,FailT,0,199600010,3964,8252,12216,0.3244924688932547,2,FailT,1,200
199600011,1996,11,1,GLENN,1996-03-26,GLENN,0,M,C,"Shall the Board of Supervisors establish the consolidated office of Director of Finance, to perform the duties of Auditor-Controller and Treasurer-Tax Collector for Glenn County?",70,70,Ordinance,42,42,Governance: Personnel/Labor Relations,3505,2087,5592,0.626788268955651,M,1,Pass,0,199600011,3505,2087,5592,0.626788268955651,1,Pass,70,40
199600012,1996,11,1,GLENN,1996-03-26,GLENN,0,M,D,Shall a unified school district be formed between Orland Joint Union High School and the Orland Joint Union School District excluding the school districts of Lake and Plaza?,70,70,Ordinance,12,12,Education: Districts,1560,1021,2581,0.6044168926772568,M,1,Pass,0,199600012,1560,1021,2581,0.6044168926772568,1,Pass,70,10
199600013,1996,17,1,LAKE,1996-03-26,LAKE,0,M,S,We the people of the County of Lake support the sitting of a State Prison in the County of Lake.,30,30,Advisory,31,31,Safety: Jails/Courts,7952,8887,16839,0.4722370687095433,M,2,Fail,0,199600013,7952,8887,16839,0.4722370687095433,2,Fail,30,30
199600014,1996,22,1,MARIPOSA,1996-03-26,MARIPOSA,0,M,A,"Shall the following ordinance (measure) be adopted?  ""The Office of the Mariposa County Constable is hereby abolished.  The duties of the Constable shall be performed by the Mariposa County Sheriff's Office commencing January 1, 1997.""  This ordinance shall become operative and effective at 12:01 a.m. on January 1, 1997 if approved by a majority vote of the electorate in the March 1996 Primary Election.",70,70,Ordinance,32,32,Safety: Police,3779,1700,5479,0.6897244022631869,M,1,Pass,0,199600014,3779,1700,5479,0.6897244022631868,1,Pass,70,30
199600015,1996,22,1,MARIPOSA,1996-03-26,MARIPOSA,0,M,B,"Shall the following ordinance (measure) be adopted?  ""For the privilege of occupancy in any hotel, each transient is subject to and shall pay a tax in the amount of ten percent (10%) of the rent charged by the operator.  Such tax constitutes a debt owed by the transient to the county which is extinguished old by payment to the operator or to the county.  The transient shall pay the tax to the operator of the hotel at the time the rent is paid.  If the rent is paid in installments, a proportionate share of the tax shall be paid with each installment.  The unpaid tax shall be due upon the transient's ceasing to occupy space in the hotel.  If for any reason the tax due is not aid to the operator of the hotel, the tax collector may require that such tax be paid directly to the tax collector.""  This ordinance shall become effective March 27, 1996, if approved by a majority of the voters in the March 1996 Primary Election.",2,2,Business Tax,100,112,Revenues: Tax Creation/Incr./Contin.,3514,1975,5489,0.6401894698487884,M,1,Pass,0,199600015,3514,1975,5489,0.6401894698487884,1,Pass,1,110
199600016,1996,23,1,MENDOCINO,1996-03-26,MENDOCINO,0,M,C,Shall Ordinance No. 3919 proposing an additional countrywide transactions and use tax of one-quarter of one percent (.25%) be adopted in the incorporated and unincorporated territory of Mendocino County?,4,4,Sales Tax,200,110,Revenues,8309,13378,21687,0.38313275234011157,T,2,FailT,0,199600016,8309,13378,21687,0.38313275234011157,2,FailT,1,110
199600017,1996,25,1,MODOC,1996-03-26,MODOC,0,M,A,"Shall the Legislature place on the statewide ballot a proposed amendment to the California Constitution to give local government jurisdictions the legal authority to (a) decline to implement a program mandated by the State or Federal government without the full funding necessary to perform the mandated service, or (b) discontinue a program mandated by the State or Federal government when all funds provided by the State or Federal government for such a mandate have been expended?",30,30,Advisory,45,45,Governance: Political Reform/Term Limits,2606,814,3420,0.762,M,1,Pass,0,199600017,2606,814,3420,0.7619883040935672,1,Pass,30,40
199600018,1996,28,1,NAPA,1996-03-26,NAPA,0,M,W,Should Napa County Ordinance No. 96-1 (Controlled Growth Initiative) be adopted?,70,70,Ordinance,21,21,Land Use: Growth Cap/Boundary,6053,30702,36755,0.16468507686029113,M,2,Fail,0,199600018,6053,30702,36755,0.16468507686029113,2,Fail,70,20
199600019,1996,28,1,NAPA,1996-03-26,NAPA,0,M,X,Should Napa County Ordinance No. 96-2 (Suscol Creek Balanced Planning Initiative) be adopted?,40,40,Initiative,22,22,Land Use: Zoning,5244,31575,36819,0.14242646459708302,M,2,Fail,0,199600019,5244,31575,36819,0.14242646459708302,2,Fail,40,20
199600020,1996,29,1,NEVADA,1996-03-26,NEVADA,0,M,B,"Shall the electorate of the County of Nevada request and direct the California State Legislature to propose an amendment to the California Constitution opposing unfunded Federal and State mandates imposed on local governments and giving local government the legal authority to (a) decline to implement a program mandated by the State or Federal government without the full funding necessary to perform the mandated service, or (b) discontinue a program mandated by the State or Fedeal government when all funds provided by the State or Federal government when all funds provided by the State or Federal government for such a mandate have been expended?",30,30,Advisory,200,40,Governance,23478,5297,28775,0.8159165942658558,M,1,Pass,0,199600020,23478,5297,28775,0.8159165942658558,1,Pass,30,40
199600021,1996,29,1,NEVADA,1996-03-26,NEVADA,0,M,F,"Shall the County of Nevada be required to expend at least one-half of the motor vehicle in lieu taxes received by the County on the maintenance, repair, circulation, enhancement, general road safety and fire access of the public roads, ways, and highways within the County of Nevada?",70,70,Ordinance,62,62,Transport: Roads,17735,12186,29921,0.5927275157915846,M,1,Pass,0,199600021,17735,12186,29921,0.5927275157915846,1,Pass,70,60
199600022,1996,30,1,ORANGE,1996-03-26,ORANGE,0,M,S,"INITIATIVE TO AMEND GENERAL PLAN  MARINE CORPS AIR STATION EL TORO.  Shall the initiative measure entitled ""The El Toro Responsible Economic Development Initiative,"" which would repeal Measure A, abolish the El Toro Airport Citizens Advisory Commission, and which states the highest and best civilian use for Marine Corps Air Station El Toro is not a civilian airport, be approved?",40,40,Initiative,22,22,Land Use: Zoning,195223,287430,482653,0.40447899422566524,M,2,Fail,0,199600022,195223,287430,482653,0.40447899422566524,2,Fail,40,20
199600023,1996,30,1,ORANGE,1996-03-26,ORANGE,0,M,T,"MEASURE TO ADOPT ORANGE COUNTY PROPOSED CHARTER.  Shall the measure entitled ""orange County Proposed Charter"" which would result in Orange County becoming a charter county be adopted?",20,20,Charter Amendment,43,43,Governance: Organization,168545,258961,427506,0.3942517765832526,M,2,Fail,0,199600023,168545,258961,427506,0.3942517765832526,2,Fail,20,40
199600024,1996,30,1,ORANGE,1996-03-26,ORANGE,0,M,U,"MEASURE TO AMEND THE ORANGE COUNTY PROPOSED CHARTER TO INCREASE MEMBERS OF BOARD OF SUPERVISORS FROM FIVE TO NINE.  Shall the measure entitled ""proposed Amendment to Orange County Proposed Charter to Increase Members of Board of Supervisors From Five to Nine"" be adopted?",3,3,Property Tax,43,43,Governance: Organization,111279,339256,450535,0.2469930194102567,M,2,Fail,0,199600024,111279,339256,450535,0.2469930194102567,2,Fail,1,40
199600025,1996,35,1,SAN BENITO,1996-03-26,SAN BENITO,0,M,D,Shall the amended business license tax ordinance increasing the business tax of mining operations be approved?,2,2,Business Tax,100,112,Revenues: Tax Creation/Incr./Contin.,2732,5647,8379,0.3260532283088674,M,2,Fail,0,199600025,2732,5647,8379,0.3260532283088674,2,Fail,1,110
199600026,1996,36,1,SAN BERNARDINO,1996-03-26,SAN BERNARDINO,0,M,L,"Shall an ordinance of the County of San Bernardino be adopted which would prohibit, in the unincorporated portion of the County, large solid waste landfills which overlie or are located within 10 miles from the point of extraction of a significant water resource, unless the large solid waste landfill was fully permitted, constructed and had commenced operations s of March 14, 1995?",70,70,Ordinance,24,24,Land Use: Private Projects,103758,115994,219752,0.47215952528304633,M,2,Fail,0,199600026,103758,115994,219752,0.47215952528304633,2,Fail,70,20
199600027,1996,36,1,SAN BERNARDINO,1996-03-26,SAN BERNARDINO,0,M,M,"Shall the levy of a business license tax on permitted operators of solid waste disposal sites located within the unincorporated territory of the County, as provided in sections 43.031 through 43.037 of the San Bernardino County Code, be approved?",2,2,Business Tax,100,112,Revenues: Tax Creation/Incr./Contin.,88764,125136,213900,0.4149789621318373,M,2,Fail,0,199600027,88764,125136,213900,0.4149789621318373,2,Fail,1,110
199600028,1996,37,1,SAN DIEGO,1996-03-26,SAN DIEGO,0,M,A,PROPOSED AMENDMENT TO THE SAN DIEGO COUNTY CHARTER.  Shall the San Diego County Charter be amended to change the Treasurer/Tax Collector from an elective to an appointive officer appointed by the Chief Administrative Officer?,20,20,Charter Amendment,42,42,Governance: Personnel/Labor Relations,139661,339945,479606,0.2911994428760274,M,2,Fail,0,199600028,139661,339945,479606,0.2911994428760274,2,Fail,20,40
199600029,1996,38,1,SAN FRANCISCO,1996-03-26,SAN FRANCISCO,0,M,A,"Shall the City use lease financing to expand the Moscone Convention Center, if the total owed for this lease financing does not exceed $157.5 million plus interest?",70,70,Ordinance,70,70,Facilities,103680,53005,156685,0.6617097999170309,T,2,FailT,0,199600029,103680,53005,156685,0.6617097999170309,2,FailT,70,70
199600030,1996,38,1,SAN FRANCISCO,1996-03-26,SAN FRANCISCO,0,M,B,Shall various City ordinances be changed so that a ballpark may be built at China Basin?,70,70,Ordinance,24,24,Land Use: Private Projects,108968,55368,164336,0.6630805179631973,M,1,Pass,0,199600030,108968,55368,164336,0.6630805179631973,1,Pass,70,20
199600031,1996,40,1,SAN LUIS OBISPO,1996-03-26,SAN LUIS OBISPO,0,M,B,"Shall limitations be established on the compensation for members of the County Board of Supervisors by: (1) Rescinding San Luis Obispo County Ordinance No. 2695, adopted October 11, 1994, which established the current compensation for members of the Board of Supervisors; and (2) amending San Luis Obispo County Code Section 2.48.095 by deleting certain provisions for establishing compensation for members of the Board of Supervisors based upon a salary survey of six comparable counties, and replacing those provisions with a requirement that salary increases for members of the Board f Supervisors shall be approved by a majority vote of the people?",70,70,Ordinance,41,41,Governance: Benefits/Compensation,46578,15816,62394,0.7465140878930666,M,1,Pass,0,199600031,46578,15816,62394,0.7465140878930666,1,Pass,70,40
199600032,1996,41,1,SAN MATEO,1996-03-26,SAN MATEO,0,M,A,Shall Resolution No. 59915 of the County of San Mateo imposing an annual special tax for fire protection and extended police services according to the schedule therein be approved?,3,3,Property Tax,34,34,Safety: Multiple Emergency Services,1118,283,1401,0.7980014275517487,T,1,PassT,0,199600032,1118,283,1401,0.7980014275517487,1,PassT,1,30
199600033,1996,42,1,SANTA BARBARA,1996-03-26,SANTA BARBARA,0,M,A96,"VOTER APPROVAL OF SOUTH COAST ONSHORE OIL AND GAS SUPPORT FACILITIES OUTSIDE OF EXISTING CONSOLIDATED PROCESSING SITES.  Shall an ordinance be adoptd that required voter approval, for a period of 25 years, of any legislative approval made by the Santa Barbara County Board of Supervisors that authorizes or allows the development, constructtion, installation or expansion of any onshore use, installation or activty on the South Coast of the County of Santa Barbara (from Point Arguello to Venture County border) that proposed to effectuate or support the exploration, development, productin, storage, processing or other activities related to offshore energy resources?",70,70,Ordinance,24,24,Land Use: Private Projects,46412,40146,86558,0.5361953834423161,M,1,Pass,0,199600033,46412,40146,86558,0.5361953834423161,1,Pass,70,20
199600034,1996,42,1,SANTA BARBARA,1996-03-26,SANTA BARBARA,0,M,B96,"BRADLEY FLOOD ZONE.  Shall the Santa Barbara County Flood Control and Water Conservation District be authorized to levy increased benefit assessments on real property in the Bradley Flood Zone, as proposed in its 1995 Flood Control Benefit Assessment Ordinance, adopted December 5, 1995?",3,3,Property Tax,74,73,Facilities: Museum/Cultural/Comm Ctrs,109,287,396,0.27525252525252525,M,2,Fail,0,199600034,109,287,396,0.27525252525252525,2,Fail,1,70
199600035,1996,42,1,SANTA BARBARA,1996-03-26,SANTA BARBARA,0,M,C96,"GUADALUPE FLOOD ZONE.  Shall the Santa Barbara County Flood Control and Water Conservation District be authorized to levy increased benefit assessments on real property in the Guadalupe Flood Zone, as proposed in its 1995 Flood Control Benefit Assessment Ordinance, adopted December 5, 1995?",3,3,Property Tax,74,73,Facilities: Museum/Cultural/Comm Ctrs,199,323,522,0.38122605363984674,M,2,Fail,0,199600035,199,323,522,0.38122605363984674,2,Fail,1,70
199600036,1996,42,1,SANTA BARBARA,1996-03-26,SANTA BARBARA,0,M,D96,"LOMPOC VALLEY FLOOD ZONE.  Shall the Santa Barbara County Flood Control and Water Conservation District be authorized to levy increased benefit assessments on real property in the Lompc Valley Flood Zone, as proposed in its 1995 Flood Control Benefit Assessment Ordinance, adopted December 5, 1995?",3,3,Property Tax,74,73,Facilities: Museum/Cultural/Comm Ctrs,1532,2334,3866,0.39627521986549413,M,2,Fail,0,199600036,1532,2334,3866,0.3962752198654941,2,Fail,1,70
199600037,1996,42,1,SANTA BARBARA,1996-03-26,SANTA BARBARA,0,M,E96,"LOS ALAMOS FLOOD ZONE.  Shall the Santa Barbara County Flood Control and Water Conservation District be authorized to levy increased benefit assessments on real property in the Los Alamos Flood Zone, as proposed in its 1995 Flood Control Benefit Assessment Ordinance, adopted December 5, 1995?",3,3,Property Tax,74,73,Facilities: Museum/Cultural/Comm Ctrs,101,245,346,0.29190751445086704,M,2,Fail,0,199600037,101,245,346,0.29190751445086704,2,Fail,1,70
199600038,1996,42,1,SANTA BARBARA,1996-03-26,SANTA BARBARA,0,M,F96,"ORCUTT FLOOD ZONE.  Shall the Santa Barbara County Flood Control and Water Conservation District be authorized to levy increased benefit assessments on real property in the Orcutt Flood Zone, as proposed in its 1995 Flood Control Benefit Assessment Ordinance, adopted December 5, 1995?",3,3,Property Tax,74,73,Facilities: Museum/Cultural/Comm Ctrs,3443,7522,10965,0.3139990880072959,M,2,Fail,0,199600038,3443,7522,10965,0.3139990880072959,2,Fail,1,70
199600039,1996,42,1,SANTA BARBARA,1996-03-26,SANTA BARBARA,0,M,G96,"SANTA MARIA FLOOD ZONE.  Shall the Santa Barbara County Flood Control and Water Conservation District be authorized to levy increased benefit assessments on real property in the Santa Maria Flood Zone, as proposed in its 1995 Flood Control Benefit Assessment Ordinance, adopted December 5, 1995?",3,3,Property Tax,74,73,Facilities: Museum/Cultural/Comm Ctrs,3587,5221,8808,0.4072434150772026,M,2,Fail,0,199600039,3587,5221,8808,0.4072434150772025,2,Fail,1,70
199600040,1996,42,1,SANTA BARBARA,1996-03-26,SANTA BARBARA,0,M,H96,"SANTA MARIA RIVER LEVEE FLOOD ZONE.  Shall the Santa Barbara County Flood Control and Water Conservation District be authorized to levy increased benefit assessments on real property in the Santa Maria River Levee Flood Zone, as proposed in its 1995 Flood Control Benefit Assessment Ordinance, adopted December 5, 1995?",3,3,Property Tax,74,73,Facilities: Museum/Cultural/Comm Ctrs,3356,4826,8182,0.4101686629186018,M,2,Fail,0,199600040,3356,4826,8182,0.4101686629186018,2,Fail,1,70
199600041,1996,42,1,SANTA BARBARA,1996-03-26,SANTA BARBARA,0,M,I96,"SANTA YNEZ FLOOD ZONE.  Shall the Santa Barbara County Flood Control and Water Conservation District be authorized to levy increased benefit assessments on real property in the , as proposed in its 1995 Flood Control Benefit Assessment Ordinance, adopted December 5, 1995?",3,3,Property Tax,74,73,Facilities: Museum/Cultural/Comm Ctrs,2054,4123,6177,0.33252387890561763,M,2,Fail,0,199600041,2054,4123,6177,0.33252387890561763,2,Fail,1,70
199600042,1996,42,1,SANTA BARBARA,1996-03-26,SANTA BARBARA,0,M,J96,"SOUTH COAST FLOOD ZONE.  Shall the Santa Barbara County Flood Control and Water Conservation District be authorized to levy increased benefit assessments on real property in the South Coast Flood Zone, as proposed in its 1995 Flood Control Benefit Assessment Ordinance, adopted December 5, 1995?",3,3,Property Tax,74,73,Facilities: Museum/Cultural/Comm Ctrs,24424,23810,48234,0.5063648049094001,M,1,Pass,0,199600042,24424,23810,48234,0.5063648049094001,1,Pass,1,70
199600043,1996,43,1,SANTA CLARA,1996-03-26,SANTA CLARA,0,M,A,"AMENDMENT TO THE CHARTER OF THE COUNTY OF SANTA CLARA.  Shall the Santa Clara County Charter be extended to provide for the acquisition, development, maintenance, and operation of parks, without increasing taxes, by continuing the annual transfer from the general fund of an amount estimated to equal one and one-half cents ($0.015 per hundred dollars of assessed valuation of all real and personal property for five years and $0.01425 per one hundred dollars of assessed valuation thereafter for seven years?",20,20,Charter Amendment,51,51,Environment: Parks/Recreation,219874,54208,274082,0.8022197736443838,M,1,Pass,0,199600043,219874,54208,274082,0.8022197736443838,1,Pass,20,50
199600044,1996,46,1,SIERRA,1996-03-26,SIERRA,0,M,A,"Shall the Transient Occupancy Tax currently levied on the occupying of lodging accommodations, including the imposition of such tax on rented reserved outdoor space (recreational vehicle parks, campgrounds, or parking areas) and increasing such tax from 6% to 10% effective January 1993, be ratified and shall the reimposition of the same transient occupancy tax levy adopted by the Sierra County Board of Supervisors by Ordinance No. 835 be approved?",2,2,Business Tax,100,112,Revenues: Tax Creation/Incr./Contin.,852,565,1417,0.6012702893436839,M,1,Pass,0,199600044,852,565,1417,0.6012702893436839,1,Pass,1,110
199600045,1996,52,1,TEHAMA,1996-03-26,TEHAMA,0,M,A,"Shall the Charter of Tehama County be amended by adding Article VI, sections 1 and  2 as ordered by the Board of Supervisors on December 19, 1995 to be placed before the electorate, be adopted and added to the Charter of Tehama County?",20,20,Charter Amendment,200,40,Governance,9096,3966,13062,0.696371152962793,M,1,Pass,0,199600045,9096,3966,13062,0.6963711529627928,1,Pass,20,40
199600046,1996,53,1,TRINITY,1996-03-26,TRINITY,0,M,A,Shall Ordinance No. 1201 adopted by the Trinity County Board of Supervisors establishing a 3% utility tax on electricity and telephone charges be confirmed?,5,5,Utility Tax,100,112,Revenues: Tax Creation/Incr./Contin.,459,4096,4555,0.10076838638858399,T,2,FailT,0,199600046,459,4096,4555,0.10076838638858397,2,FailT,1,110
199600047,1996,53,1,TRINITY,1996-03-26,TRINITY,0,M,B,Shall the Transient Occupancy Tax provided for in Chapter 3.28 of the Trinity County Code be increased to 10%?,2,2,Business Tax,100,112,Revenues: Tax Creation/Incr./Contin.,1051,3466,4517,0.23267655523577596,M,2,Fail,0,199600047,1051,3466,4517,0.23267655523577596,2,Fail,1,110
199600048,1996,53,1,TRINITY,1996-03-26,TRINITY,0,M,C,"If the Transient Occupancy Tax in increased to 10%, should 4% still be dedicated to the promotion and advertisement of Trinity County, as provided for in Chapter 3.28 of the Trinity County Code?",2,2,Business Tax,200,201,Other: Promotion of Tourism,2405,2077,4482,0.536590807675145,M,1,Pass,0,199600048,2405,2077,4482,0.536590807675145,1,Pass,1,200
199600049,1996,55,1,TUOLUMNE,1996-03-26,TUOLUMNE,0,M,G,Shall the County ordinance allowing for the control of rents in mobile home parks be repealed?,70,70,Ordinance,82,82,Housing: Rent Control,5414,10063,15477,0.34980939458551397,M,2,Fail,0,199600049,5414,10063,15477,0.34980939458551397,2,Fail,70,80
199600050,1996,58,1,YUBA,1996-03-26,YUBA,0,M,I,Shall an eight (8) percent transient occupancy tax be imposed upon those businesses providing campgrounds and recreational vehicle parks within the unincorporated area of Yuba County.  The tax shall be collected from every transient and shall be reported by each operator and paid by each operator on or before the last day of the month following each calendar quarter as prescribed from time to time by the Yuba County Treasurer/Tax Collector?,2,2,Business Tax,100,112,Revenues: Tax Creation/Incr./Contin.,4334,5973,10307,0.4204909284951975,M,2,Fail,0,199600050,4334,5973,10307,0.4204909284951974,2,Fail,1,110
199600051,1996,58,1,YUBA,1996-03-26,YUBA,0,M,J,"Shall an eight cent per ton mineral depletion special purpose tax on mined minerals be imposed on those businesses engaged in the mining of minerals from land repair, maintenance and reconstruction of county streets and roads?",2,2,Business Tax,54,54,Environment: Regulation/Mitigation,5190,6147,11337,0.4577930669489283,M,2,Fail,0,199600051,5190,6147,11337,0.4577930669489283,2,Fail,1,50
199600052,1996,1,2,ALAMEDA,1996-03-26,ALAMEDA,0,M,C,Shall an ordinance be adopted forming a citywide assessment district to provide funds to build a new main library and to rehabilitate and seismically upgrade the Carnegie Building for use as a museum or other public purpose through the levy of an annual assessment that shall not exceed $68.50 on residential properties and a proportionate annual assessment on non-residential properties for up to 30 years?,3,3,Property Tax,71,71,Facilities: Libraries,7067,9375,16442,0.4298138912541054,T,2,FailT,0,199600052,7067,9375,16442,0.42981389125410535,2,FailT,1,70
