MeasID,YEAR,CO,JUR,CNTYNAME,DATE,PLACE,CSD,MEASTYPE,LTR,BALQUEST,Orig_TYPE,RECTYPE,RECTYPENAME,Orig_TOPIC,RECTOPIC,RECTOPNAME,YES,NO,TOTAL,PERCENT,REQ,OUTCOME,PASSFAIL,Multi_CO,Multi_MeasID,YES_sum,NO_sum,Total_sum,Percent_sum,Outcome_sum,passfail_sum,typerec,topicrec
201000386,2010,50,2,STANISLAUS,2010-11-02,Riverbank,2,M,G,"Shall an ordinance amending Section 34.47 of the Code of the City of Riverbank, providing that ""for the privilege of occupancy in any hotel, each transient is subject and shall pay a tax in the amount of 9% of the rent charged by the operator"", be adopted? If Measure G passes the transient occupancy tax rate as set forth in Section 34.47 of the Riverbank City Code would be increased ffrom 4% to 9%?",9,9,Transient Occupancy Tax,112,112,Revenues: Tax Creation/Incr./Contin.,1790,2616,4406,0.4062642,M,2,Fail,0,201000380,1790,2616,4406,0.4062642,2,Fail,1,110
201000387,2010,54,2,TULARE,2010-11-02,Tulare,2,M,W,"Shall the City Charter be amended clarifying when municipal elections are held; repealing the procedure to deposit for signatures for initiative, referendum, and recall petitions; separating the titles of Parks &amp; Recreation Director and Library Director; and repealing sections that are no longer applicable to the City?",20,20,Charter Amendment,40,40,Governance,6299,2926,9225,0.6828184,M,1,Pass,0,201000381,6299,2926,9225,0.6828184,1,Pass,20,40
201000388,2010,56,2,VENTURA,2010-11-02,Port Hueneme,2,M,G,"Shall an ordinance of the City of Port Hueneme, California, amending Article V, Chapter 4 of the Port Hueneme Municipal Code replacing the Telephone Users tax regulations with Modern Communication Services tax regulations and reducing the tax rate from 4% to 3.75% be adopted?",7,7,Miscellaneous Tax,111,111,Revenues: Tax Repeal/Reduction/Limit,3284,948,4232,0.77599245,M,1,Pass,0,201000382,3284,948,4232,0.77599245,1,Pass,1,110
201000389,2010,58,2,YUBA,2010-11-02,Wheatland,2,M,S,"To preserve the safety and character of Wheatland, and maintain and protect general city services including essential services such as neighborhood police patrols, 911 emergency response, disaster preparedness, street paving and pothole repair, park maintenance and other essential services, shall the City of Wheatland enact a one-half cent transaction (sales) and use tax for 10 years, subject to annual audits and public review?",4,4,Sales Tax,112,112,Revenues: Tax Creation/Incr./Contin.,503,434,937,0.53681964,M,1,Pass,0,201000383,503,434,937,0.53681964,1,Pass,1,110
201000390,2010,1,3,ALAMEDA,2010-11-02,Berkeley Unified,2,M,H,"To provide essential maintenance of schools and grounds, shall Berkeley Unified School District continue its existing special tax of 6.31¢ / square foot on residential buildings and 9.46¢ / square foot on commercial buildings, and $20 on unimproved parcels with annual cost-of-living adjustments for 10 years? Revenues maintain school buildings, classrooms, playgrounds, roofs, electrical systems, and address fire and safety hazards. The state cannot take funds. An independent committee oversees funds.",3,3,Property Tax,10,10,Education,33946,8027,41973,0.808758,T,1,PassT,0,201000384,33946,8027,41973,0.808758,1,PassT,1,10
201000391,2010,1,3,ALAMEDA,2010-11-02,Berkeley Unified,2,M,I,"To improve school safety and facilities for learning and teaching, shall Berkeley Unified School District issue $210,000,000 in bonds at interest rates within the legal limit, to construct new classrooms for growth, complete seismic upgrades, construct science labs, upgrade computers and education technology, renovate playgrounds, replace restrooms, cafeterias, roofs, heating and fire safety systems, remove hazardous materials, improve energy efficiency, and qualify for State grants, with independent audits and citizen oversight? The State cannot take the funds.",11,11,GO Bond,11,11,Education: Bonds,31723,9390,41113,0.7716051,F,1,PassF,0,201000385,31723,9390,41113,0.7716051,1,PassF,10,10
201000392,2010,1,3,ALAMEDA,2010-11-02,Emery Unified,2,M,J,"Shall Emery Unified School District: maintain academic excellence/student performance, attract and retain quality teachers by: replacing/upgrading outdated schools no longer meeting seismic safety standards; provide updated classrooms, technology, science/computer labs: improve school safety; create energy efficient cost-saving facilities that provide job training, after-school, pre-school, and other community services by issuing $95 million dollars in bonds at legal rates with independent citizens' oversight, audits, and NO money for administrator salaries, benefits, or pensions?",11,11,GO Bond,11,11,Education: Bonds,1982,701,2683,0.7387253,F,1,PassF,0,201000386,1982,701,2683,0.7387253,1,PassF,10,10
201000393,2010,1,3,ALAMEDA,2010-11-02,Fremont Unified,2,M,K,"To provide Fremont schools stable funding for quality local education and programs that cannot be taken away by the state, including: Maintaining math, science, reading and writing programs; Keeping school libraries open; Supporting classroom/learning technology; Maintaining college and workforce preparation programs; and Retaining qualified teachers -- Shall the Fremont Unified School District levy $53 per parcel annually for 5 years, exempting seniors, with citizen oversight, no money for administrator salaries, and all money benefiting local schools?",3,3,Property Tax,10,10,Education,33699,14381,48080,0.70089436,T,1,PassT,0,201000387,33699,14381,48080,0.70089436,1,PassT,1,10
201000394,2010,1,3,ALAMEDA,2010-11-02,Oakland Unified,2,M,L,"To offset severe state budget cuts, improve student achievement, help every child read at or above grade level, and prepare students for college and careers by retaining teachers, teachers' aides, safety officers and other student support staff, shall Oakland Unified School District levy a tax of $195 per parcel annually for ten years, with low- income taxpayer exemptions, independent audits and citizens' oversight, and no money for Sacramento or administrators' salaries?",3,3,Property Tax,10,10,Education,70741,36390,107131,0.6603224,T,2,FailT,0,201000388,70741,36390,107131,0.6603224,2,FailT,1,10
201000395,2010,1,3,ALAMEDA,2010-11-02,Ohlone Community College,2,M,G,"To improve and continue affordable college education, job training/workforce preparation by constructing/acquiring equipment/sites/facilities and making repairs/upgrades, inclduing: Renovating classrooms/science laboratories, Acquiring up-to-date classroom technology, Upgrading for earthquake/fire safety, and Improved disabled access, shall Ohlone Community College District issue $349,000,000 of bonds, at legal rates with all funds spent locally, independent citizens' oversight, annual audits, no money for administrators' salaries or Sacramento?",11,11,GO Bond,11,11,Education: Bonds,37042,21772,58814,0.62981606,F,1,PassF,0,201000389,37042,21772,58814,0.62981606,1,PassF,10,10
201000396,2010,1,3,ALAMEDA,2010-11-02,San Leandro Unified,2,M,M,"To continue to improve and modernize its schools, renovate athletic facilities including Burrell Field, replace the pools at San Leandro High School, enhance energy efficiency and promote safe, healthy schools for all students, shall the San Leandro Unified School District be authorized to replace, renovate, acquire and construct school facilities, and issue $50,100,000 in bonds at legal interest rates with no funds for administrator salaries, conduct annual independent audits, and appoint an Independent Oversight Committee to monitor bond expenditures?",11,11,GO Bond,11,11,Education: Bonds,10638,6226,16864,0.6308112,F,1,PassF,0,201000390,10638,6226,16864,0.6308112,1,PassF,10,10
201000397,2010,7,3,CONTRA COSTA,2010-11-02,John Swett Unified,2,M,J,"To maintain and improve academic programs including math, science, reading and writing; fund computer technology, music and arts; retain highly qualified teachers; shall John Swett Unified School District levy a special tax of $96 per parcel, except for industrial/commercial parcels which are levied at $0.015 per square foot (see voter pamphlet), with citizens' oversight, senior exemption and all funds spent at neighborhood schools and not taken by the State?",3,3,Property Tax,10,10,Education,2368,1992,4360,0.54311925,T,2,FailT,0,201000391,2368,1992,4360,0.54311925,2,FailT,1,10
201000398,2010,7,3,CONTRA COSTA,2010-11-02,Knightsen Elementary,2,M,N,"To upgrade classrooms with up-to-date computers and technology infrastructure; repair and replace deteriorating roofs, plumbing and restrooms, and improve the District's budget, preserve school programs and retain teachers by paying lease obligations relating to existing school facility debt; shall Knightsen Elementary School District be authorized to issue $5 million of bonds within legal interest rates, so long as there is independent local citizens' oversight and funds cannot be taken by the State and spent elsewhere?",11,11,GO Bond,11,11,Education: Bonds,375,309,684,0.5482456,F,2,FailF,0,201000392,375,309,684,0.5482456,2,FailF,10,10
201000399,2010,7,3,CONTRA COSTA,2010-11-02,Martinez Unified,2,M,K,"To qualify for State grants; install solar energy improvements; provide and upgrade classrooms; rehabilitate infrastructure; improve school grounds; enhance Alhambra's performing arts building; add culinary arts, career and technical education classrooms, and furnish computers and other electronic equipment, shall Martinez Unified School District be authorized to issue up to $45,000,000 in bonds at legal interest rates, with citizens' oversight, independent annual performance and financial audits and no increase in the estimated tax rate?",11,11,GO Bond,11,11,Education: Bonds,6863,3611,10474,0.65524155,F,1,PassF,0,201000393,6863,3611,10474,0.65524155,1,PassF,10,10
201000400,2010,7,3,CONTRA COSTA,2010-11-02,Pittsburg Unified,2,M,L,"To provide safe, modern neighborhood schools with updated energy systems, including solar, reduce cost, improve student learning by acquiring, upgrading, constructing, equipping classrooms, science and computer labs, and school facilities, replace aging roofs, plumbing, heating, ventilation/ electrical systems, improve fire alarms, school security and earthquake safety, shall Pittsburg Unified School District issue $100,000,000 of bonds, within legal rates and state approved bonding capacity limits with independent oversight, no administrators' salaries, keeping funds local?",11,11,GO Bond,11,11,Education: Bonds,7391,3396,10787,0.6851766,F,1,PassF,0,201000394,7391,3396,10787,0.6851766,1,PassF,10,10
201000401,2010,7,3,CONTRA COSTA,2010-11-02,West Contra Costa Unified,2,M,M,"To provide local funding the State cannot take away, and preserve quality education by: providing manageable class sizes to improve core academics like math, science, reading/ writing, restoring arts/ music programs, attracting/ retaining quality teachers, improving campus safety/ cleanliness, preparing students for college and workforce, shall West Contra Costa Unified School District charge an annual tax of 7.2 cents per square foot of building area, or $7.20 per vacant parcel for five years, exempting seniors and requiring independent citizen oversight?",3,3,Property Tax,10,10,Education,35078,24017,59095,0.5935866,T,2,FailT,0,201000395,35078,24017,59095,0.5935866,2,FailT,1,10
201000402,2010,10,3,FRESNO,2010-11-02,Coalinga-Huron Joint Unified,2,M,E,"To improve the quality of education; modernize, upgrade, and renovate outdated classrooms, restrooms, and school facilities; replace inadequate electrical and heating, ventilation and air conditioning systems; upgrade computers and technology; improve energy efficiency; and make health and safety improvements shall the Coalinga-Huran Joint Unified School District issue $16,100,000 of existing bonds at legal interest rates, have an independent citizens' oversight committee and have NO money used for administrative or teacher salaries or be taken by the state?",11,11,GO Bond,11,11,Education: Bonds,1810,1030,2840,0.6373239,F,1,PassF,1,201000422,1813,1031,2844,0.6374824,1,PassF,10,10
201000403,2010,10,3,FRESNO,2010-11-02,Cutler-Orosi Joint Unified,2,M,T,"To improve the quality of education, construct, modernize and renovate outdated classrooms, restrooms, and other school facilities; make health and safety improvements; update sports facilities; improve student access to computer and modern technology; improvement to kitchen facilities; and construct a local gymnasium for school and community use; shall the Cutler-Orosi Joint Unified School District issue $15,000,000 in bonds, within legal interest rates, requiring a citizens' oversight committee, annual financial audits, and no money for administrative salaries?",11,11,GO Bond,11,11,Education: Bonds,57,167,224,0.2544643,T,2,FailT,1,201000464,869,883,1752,0.49600455,2,FailT,10,10
201000404,2010,10,3,FRESNO,2010-11-02,Cutler-Orosi Joint Unified,2,M,U,"To develop a recreation department within the Cutler-Orosi area to promote youth activities including sports, and other experiences that develop young people into active, responsible citizens, shall Cutler-Orosi Joint Unified School District levy a tax of $89.00 per parcel annually, with annual cost of living adjustments, so long as the Cutler-Orosi School Board oversees the program?",3,3,Property Tax,10,10,Education,28,193,221,0.12669684,T,2,FailT,1,201000465,692,1012,1704,0.40610328,2,FailT,1,10
201000405,2010,10,3,FRESNO,2010-11-02,Fresno Unified,2,M,Q,"To offset state budget cuts, attract quality teachers, and repair classrooms by: Upgrading vocational education classrooms / science labs / technology / libraries; improving security / fire safety / restrooms / plumbing / ventilation systems; Increasing handicapped access; Securing state matching funds; Replacing deteriorating portables; Preventing dropouts by improving alternative schools; Acquiring, constructing, repairing campuses / facilities / equipment; Shall Fresno Unified School District issue $280 million in bonds requiring audits, citizens' oversight, no money for administrators' salaries, no money for Sacramento, and no tax rate increase?",11,11,GO Bond,11,11,Education: Bonds,51125,16397,67522,0.7571606,F,1,PassF,0,201000396,51125,16397,67522,0.7571606,1,PassF,10,10
201000406,2010,10,3,FRESNO,2010-11-02,Newly Unified,2,M,W,"Shall the territory of the American Union Elementary School District and the Washington Union High School District be unified, with Orange Center, Pacific Union, Washington Colony, West Fresno and West Park elementary school districts excluded from the unification, and be governed by a seven member Board of Trustees elected by trustee area?",70,70,Ordinance,12,12,Education: Districts,1844,1150,2994,0.6158985,M,1,Pass,0,201000397,1844,1150,2994,0.6158985,1,Pass,70,10
201000407,2010,10,3,FRESNO,2010-11-02,Sierra Unified,2,M,S,"To upgrade calssrooms with up-to-date computers and technology; repair and replace deteriorating roofs, plumbing and restrooms; install fire alarms, remove asbestos, and improve the District's budget, preserve school programs and retain teachers by paying off existing school facility debt; shall Sierra Unified School District School Facilities District No.1 be authorized to issue $9.6 million of bonds within legal interest rates, so long as there is independent local citizens' oversight and funds cannot be taken by the State and spent elsewhere?",11,11,GO Bond,11,11,Education: Bonds,2087,2140,4227,0.49373078,F,2,FailF,0,201000398,2087,2140,4227,0.49373078,2,FailF,10,10
201000408,2010,11,3,GLENN,2010-11-02,Hamilton Unified,2,M,O,"To improve the quality of education; modernize and renovate classrooms, restrooms and school facilities; improve energy efficiency; make health and safety imrprovements; improve student access to computers and modern technology; replace dilapidated temporary portables with permanent classrooms; and renovate physical education fields and facilities for school and community use, shall Hamilton Unified School District issue $5,400,000 of bonds at legal interest rates, have an independent citizens' oversight committee and have NO money used for administrative or teacher salaries?",11,11,GO Bond,11,11,Education: Bonds,372,332,704,0.52840906,F,2,FailF,0,201000399,372,332,704,0.52840906,2,FailF,10,10
201000409,2010,12,3,HUMBOLDT,2010-11-02,Northern Humboldt Union High,2,M,Q,"Shall the Northern Humboldt Union High School District issue $25,800,000 of bonds within legal interest rates to provide finance for specific school facilities projects.",11,11,GO Bond,11,11,Education: Bonds,10386,7079,17465,0.59467506,F,1,PassF,0,201000400,10386,7079,17465,0.59467506,1,PassF,10,10
201000410,2010,13,3,IMPERIAL,2010-11-02,Imperial Community College,2,M,J,"To improve the quality of education and expand career opportunities, shall the Imperial Community College District be authorized to acquire, construct and improve classrooms and facilites, including vocational, career, and technical facilities, modernize outdated calssrooms, and improve student access to computers and modern technology, by issuing $80,000,000 in bonds at legal interest rates, with an independent Citizens' Oversight Committee, annual financial and performance audits, no money for salaries, and bonds only issued without increasing existing tax rates?",11,11,GO Bond,11,11,Education: Bonds,16325,8895,25220,0.6473037,F,1,PassF,0,201000401,16325,8895,25220,0.6473037,1,PassF,10,10
201000411,2010,15,3,KERN,2010-11-02,Fairfax Elementary,2,M,C,"To improve learning and safety in neighborhood schools and qualify for state matching funds, shall Fairfax School District rehabilitate/replace aging school safety, heating, ventilation, roofing, plumbing, electrical and building systems; upgrade classroom technology and school libraries; build a new school to relieve overcrowding; and renovate, acquire, construct and equip schools; by issuing $24.8 million of bonds at legal interest rates, with mandatory audits, citizens' overisght, and no administrators' salaries and all funds benefiting Fiarfax schools?",11,11,GO Bond,11,11,Education: Bonds,1265,443,1708,0.7406323,F,1,PassF,0,201000402,1265,443,1708,0.7406323,1,PassF,10,10
201000412,2010,19,3,LOS ANGELES,2010-11-02,Centinela Valley Union High,2,M,CV,"To protect students from earthquakes; remove asbestos, lead paint, and other safety hazards from schools; and improve learning and academic achievement, shall the Centinela Valley Union High School District issue $98,000,000 in bonds, at legal rates, to repair, acquire, and construct local schools, sites, and facilities, including libraries, classrooms, science labs, and academic academies; and replace aging plumbing, heating, electrical, and school security systems; with mandatory audits, independent citizen oversight, no money for administrator salaries, and all funds staying local?",11,11,GO Bond,11,11,Education: Bonds,16057,8697,24754,0.64866287,F,1,PassF,0,201000403,16057,8697,24754,0.64866287,1,PassF,10,10
201000413,2010,19,3,LOS ANGELES,2010-11-02,Claremont Unified,2,M,CL,"To support and repair Claremont schools, make funding available for qualified teachers and academic programs threatened by the State cuts, provide safe/modern classrooms, qualify for State matching funds, construct, acquire, repair equip classrooms/school facilities/sites, improve fire/student safety, upgrade instructional technology, labs/librairies, roofs, plumbing, wiring, shall Claremont Unified School District issue $95,000,000 in bonds, at legal rates, with independent citizen oversight and all funds supporting local schools?",11,11,GO Bond,11,11,Education: Bonds,6198,9156,15354,0.40367332,F,2,FailF,0,201000404,6198,9156,15354,0.40367332,2,FailF,10,10
201000414,2010,19,3,LOS ANGELES,2010-11-02,Duarte Unified,2,M,E,"To improve learning in neighborhood schools and attract/ retain quality teachers by upgrading classroom technology, improving facilities that prepare Duarte students for college/ high demand jobs, repairing aging roofs, plumbing, restrooms and electrical systems, improving school security/ safety systems, renovating, acquiring, contructing/ equipping classrooms, sites, facilities and schools, shall Duarte Unified School District issue $62 million of bonds at legal rates, with independent citizens' oversight, mandatory annual audits, no money for administrators' salaries and all funds staying local?",11,11,GO Bond,11,11,Education: Bonds,4198,2810,7008,0.59902966,F,1,PassF,0,201000405,4198,2810,7008,0.59902966,1,PassF,10,10
201000415,2010,19,3,LOS ANGELES,2010-11-02,El Rancho Unified,2,M,EE,"To construct and improve local schools and student support facilities, improve student access to computers and classroom technology, build vocational technical classrooms, provide improvements to better maintain our schools, and provide renewable energy improvements to reduce operating costs and put more money into the classroom, shall El Rancho Unified School District be authorized to issue up to $52,000,000 in bonds at legal interest rates, with annual audits, a Citizens' Oversight Committee, and no increase to current tax rates?",11,11,GO Bond,11,11,Education: Bonds,9549,3354,12903,0.74006045,F,1,PassF,0,201000406,9549,3354,12903,0.74006045,1,PassF,10,10
201000416,2010,19,3,LOS ANGELES,2010-11-02,Lynwood Unified,2,M,L,"To improve education, make schools safe, complete essential health/safety repairs, fix roofs, shall Lynwood Unified School District upgrade plumbing, electrical, sewer/heating/cooling systems, aging schools, science labs, install energy efficient lighting/windows, improve school safety, remove hazardous materials; repair, acquire, construct, equip schools/facilities/sites, upgrade fire safety, by issuing $45,000,000 in bonds at legal rates, with guaranteed annual audits, independent citizens' oversight, and all money staying local?",11,11,GO Bond,11,11,Education: Bonds,4821,4142,8963,0.5378779,F,2,FailF,0,201000407,4821,4142,8963,0.5378779,2,FailF,10,10
201000417,2010,19,3,LOS ANGELES,2010-11-02,Pomona Unified,2,M,SS,"To maintain and improve academic programs including math, science, reading, history and writing; computer technology, music and arts; and retain highly qualified teachers; shall Pomona Unified School District be authorized to raise $4 million per year through a $96 parcel tax for four years (per voter pamphlet), provided there is an annual accounting of funds, senior exemptions, and all funds are spent on neighborhood schools and cannot be taken by the state and used elsewhere?",3,3,Property Tax,10,10,Education,15004,12462,27466,0.5462754,T,2,FailT,0,201000408,15004,12462,27466,0.5462754,2,FailT,1,10
201000418,2010,19,3,LOS ANGELES,2010-11-02,Wiseburn Elementary,2,M,AA,"To improve Wiseburn school facilities, and build a modern high school that accommodates all Wiseburn children, focuses on math, science and the arts, improves academic performance, safety, and security, and allows students to continue to achieve some of the highest test scores in the South Bay, shall the be authorized to issue up to $87 million in bonds at legal interest rates, with taxpayer safeguards, annual audits, and an independent Citizens' Oversight Committee?",11,11,GO Bond,11,11,Education: Bonds,3285,1053,4338,0.7572614,F,1,PassF,0,201000409,3285,1053,4338,0.7572614,1,PassF,10,10
201000419,2010,21,3,MARIN,2010-11-02,Ross Valley Elementary,2,M,A,"Local quality education school measure. To maintain quality local public education, relieve overcrowding, maintain low class size ratios, restore art, music, multipurpose rooms, build science labs, upgrade computer/classroom technology and energy efficiency, shall Ross Valley School District replace portables with permanent classrooms, qualify for matching grants, acquire, repair, construct, equipment, sites and facilities, by issuing $41,000,000 in bonds within legal rates, with independent audits, citizen oversight, no money for administrators' salaries and all money staying local?",11,11,GO Bond,11,11,Education: Bonds,8565,3490,12055,0.71049356,T,1,PassT,0,201000410,8565,3490,12055,0.71049356,1,PassT,10,10
201000420,2010,27,3,MONTEREY,2010-11-02,Aromas/San Juan Unified,2,M,Z,"To improve the quality of public education, attract qualified teachers, provide up-to-date science labs/classrooms/technology without increasing current tax rates, shall Aromas San Juan Unified School District equip classrooms with effective heating and cooling systems, upgrade aging plumbing, lighting/electrical systems, renovate restrooms, cafeteria, pay off facilities loans, repair, construct school facilities/acquire equipment, by issuing $9,700,000 in bonds at legal interest rates, with mandatory audits, independent citizen oversight, no administrator salaries, and all money staying local?",11,11,GO Bond,11,11,Education: Bonds,596,512,1108,0.5379061,F,2,FailF,1,201000447,1822,1294,3116,0.584724,1,PassF,10,10
201000421,2010,27,3,MONTEREY,2010-11-02,Coalinga-Huron Joint Unified,2,M,E,"To improve the quality of education; modernize, upgrade, and renovate outdated classrooms, restrooms, and school facilities; replace inadequate electrical and heating, ventilation and air conditioning systems; upgrade computers and technology; improve energy efficiency; and make health and safety improvements shall the Coalinga-Huron Joint Unified School District issue $16,100,000 of existing bonds at legal interest rates, have an independent citizens' oversight committee and have NO money used for administrative or teacher salaries or be taken by the state?",11,11,GO Bond,11,11,Education: Bonds,3,0,3,1.0,F,1,PassF,1,201000422,1813,1031,2844,0.6374824,1,PassF,10,10
