MeasID,YEAR,CO#,JUR,CNTYNAME,DATE,PLACE,CSD,MEASTYPE,LTR,BALQUEST,RECTYPE,RECTYPENAME,RECTOPIC,RECTOPICNAME,YES,NO,TOTAL,PERCENT,REQ,OUTCOME,PASSFAIL,Multi_CO,Multi_MeasID,YES_sum,NO_sum,Total_sum,Percent_sum,Outcome_sum,Passfail_sum,typerec,topcrec,OTH
201300049,2013,19,2,LOS ANGELES,2013-05-21,Los Angeles,0,M,E,"(INITIATIVE) Shall an ordinance regulating associations of six or more qualified patients and/or primary caregivers who gather to cultivate, distribute or engage in other activities related to marijuana for medical purposes (MMCs) by: (1) prohibiting MMCs but providing limited immunity for MMCs that operated since September 2007, timely registered with the City, generally have not ceased operations for 90 days, pass annual background checks, are separated from residential zones, maintain certain distances from schools, parks, child care facilities and other designated places, and satisfy other requirements; (2) establishing operational standards enforceable as infractions; and (3) exempting associations of five or fewer patients/caregivers who process or cultivate medical marijuana on-site for MMCs, their patients or themselves, and other exemptions; be adopted?",70,Ordinance,200,Other,117421,225227,342648,0.343,M,2,Fail,0,201300049,117421,225227,342648,0.3426869557096496,2,Fail,70,200,
201300050,2013,19,2,LOS ANGELES,2013-05-21,Los Angeles,0,M,F,"(INITIATIVE) Shall an ordinance regulating associations of qualified patients and/or primary caregivers who cultivate, provide or engage in other activities related to marijuana for medical purposes (MMCs) by: (1) prohibiting MMCs but providing limited immunity for MMCs that register with the City (without limiting the number that can register but giving registration priority to those possessing City tax certificates by October 2012), generally have not ceased operations for more than 90 days, pass annual background checks, are separated from residential uses, maintain certain distances from schools, parks, child care facilities, other designated places and other MMCs, and meet other requirements and operational standards; (2) exempting dwellings zoned residential, and other exemptions; and (3) increasing the MMC tax to $60 per each $1,000 of gross receipts; be adopted?",2,Business Tax,112,Revenues: Tax Creation/Incr./Contin.,144268,206015,350283,0.412,M,2,Fail,0,201300050,144268,206015,350283,0.4118612664616895,2,Fail,1,110,
201300051,2013,19,2,LOS ANGELES,2013-06-04,San Fernando,0,M,A,"To stabilize the City financially and offset severe cuts in federal and state funding as well as sharp reductions in general fund revenues which threaten the City’s ability to adequately provide general municipal services, including but not limited to police and fire service; and street, sidewalk, park and other vital infrastructure maintenance, shall an ordinance imposing a temporary, seven-year half percent (1/2%) transactions and use (sales) tax be approved?",4,Sales Tax,112,Revenues: Tax Creation/Incr./Contin.,567,369,936,0.606,M,1,Pass,0,201300051,567,369,936,0.6057692307692307,1,Pass,1,110,
201300052,2013,19,2,LOS ANGELES,2013-07-02,Monterey Park,0,M,FF,Shall an ordinance amending the Monterey Park Municipal Code to authorize and direct the City Council to negotiate to transfer all functions of the Monterey Park Fire Department to the consolidated Fire Protection District of Los Angeles County (aka the Los Angeles County Fire Department) be adopted?,70,Ordinance,33,Safety: Fire,2290,4102,6392,0.358,M,2,Fail,0,201300052,2290,4102,6392,0.35826032540675845,2,Fail,70,30,
201300053,2013,19,2,LOS ANGELES,2013-11-05,El Monte,0,M,EM,"Shall the term of office for the elected office of Mayor be extended from two (2) years to four (4) years, commencing with the 2015 General Municipal Election cycle?",70,Ordinance,43,Governance: Organization,1921,2665,4586,0.419,M,2,Fail,0,201300053,1921,2665,4586,0.4188835586567815,2,Fail,70,40,
201300054,2013,19,2,LOS ANGELES,2013-11-05,El Monte,0,M,GG,"To preserve and stabilize funding for essential public services such as keeping the City’s four fire stations open; maintaining staffing levels for emergency response police services; street lighting and repair; senior services; and youth parks programs and to build the City’s “rainy day"" general fund reserves, shall the City’s existing one half of one percent (1/2%) transactions and use tax be extended for five years?",4,Sales Tax,112,Revenues: Tax Creation/Incr./Contin.,3331,1366,4697,0.709,M,1,Pass,0,201300054,3331,1366,4697,0.7091760698318076,1,Pass,1,110,
201300055,2013,19,2,LOS ANGELES,2013-11-05,El Monte,0,M,RM,Shall the City Council be reorganized to replace the current structure of one elected Mayor serving a two-year term and four elected Council Members serving staggered four-year terms with a structure composed of five elected City Council Members who will share the title of Mayor on a rotating basis subject to voter approved procedures for accomplishing the rotation?,70,Ordinance,43,Governance: Organization,1798,2686,4484,0.401,M,2,Fail,0,201300055,1798,2686,4484,0.4009812667261374,2,Fail,70,40,
201300056,2013,19,2,LOS ANGELES,2013-11-05,Hawthorne,0,M,A,"Shall the directly elected mayor for the City of Hawthorne serve a four-year term of office rather than a two-year term of office, so that all members of the City Council of the City of Hawthorne serve four-year terms of office, effective for the 2015 election?",70,Ordinance,43,Governance: Organization,2088,2031,4119,0.507,M,1,Pass,0,201300056,2088,2031,4119,0.5069191551347414,1,Pass,70,40,
201300057,2013,19,2,LOS ANGELES,2013-11-05,Hermosa Beach,0,M,B,"Shall an ordinance be adopted to incrementally, over a five-year period, reduce the postmidnight operating hours of specified businesses in the downtown area of Hermosa Beach?",70,Ordinance,200,Other,1318,3523,4841,0.272,M,2,Fail,0,201300057,1318,3523,4841,0.2722577979756249,2,Fail,70,200,
201300058,2013,19,2,LOS ANGELES,2013-11-05,Santa Fe Springs,0,M,S,"Shall Ordinance No. 1044, which would increase the oil barrel tax charged to operators of oil wells in the City from $.20 per barrel to an amount ranging from a minimum of $.41 to a maximum of $.52 per barrel, be adopted?",2,Business Tax,112,Revenues: Tax Creation/Incr./Contin.,1309,506,1815,0.721,M,1,Pass,0,201300058,1309,506,1815,0.7212121212121212,1,Pass,1,110,
201300059,2013,21,2,MARIN,2013-11-05,Corte Madera,0,M,B,"To maintain essential Town services including but not limited to: current levels of local fire prevention, flood control, streets and potholes, disaster preparedness, safe routes to schools, and senior and youth programs, shall the Town enact a half-cent sales tax for 6 years, requiring a citizen’s oversight committee review and annual examination to ensure funds are spent locally as promised for the benefit of Corte Madera residents?",4,Sales Tax,112,Revenues: Tax Creation/Incr./Contin.,1785,837,2622,0.681,M,1,Pass,0,201300059,1785,837,2622,0.6807780320366132,1,Pass,1,110,
201300060,2013,21,2,MARIN,2013-11-05,Larkspur,0,M,C,"To repair aging and deteriorating neighborhood streets and roads; repair potholes; maintain police and fire protection; maintain 9-1-1 emergency/medical response; clear hazardous and flammable brush to prevent fires and improve emergency vehicle access; and maintain essential city services, shall the City of Larkspur enact a ½ cent sales tax for 5 years with annual performance reviews, independent annual audits, citizens oversight, and no money for Sacramento?",4,Sales Tax,112,Revenues: Tax Creation/Incr./Contin.,2771,884,3655,0.758,M,1,Pass,0,201300060,2771,884,3655,0.7581395348837209,1,Pass,1,110,
201300061,2013,21,2,MARIN,2013-11-05,San Anselmo,0,M,D,"To repair potholes, repave roads, reduce traffic congestion, maintain and improve sidewalks/drainage/street medians, preserve public safety, and improve other general Town services, facilities, and infrastructure, shall the Town of San Anselmo establish a one-half percent (.5%) sales tax for ten years, with annual independent audits, mandatory public expenditure reports, and an independent citizens’ oversight committee with all funds staying in San Anselmo under local control?",4,Sales Tax,112,Revenues: Tax Creation/Incr./Contin.,2376,1022,3398,0.699,M,1,Pass,0,201300061,2376,1022,3398,0.6992348440258976,1,Pass,1,110,
201300062,2013,21,2,MARIN,2013-11-05,San Rafael,0,M,E,"Shall the City of San Rafael extend the existing one-half percent local sales tax and increase the rate by one-quarter percent to provide funding that cannot be taken by the State, and can be used to preserve essential city services for a period of 20 years, including: maintaining rapid emergency police/fire response times, maintaining adequate numbers of on-duty firefighters/paramedics/police, ensuring earthquake safe police/fire stations, maintaining community centers and repairing city streets?",4,Sales Tax,112,Revenues: Tax Creation/Incr./Contin.,7760,4123,11883,0.653,M,1,Pass,0,201300062,7760,4123,11883,0.653033745687116,1,Pass,1,110,
201300063,2013,23,2,MENDOCINO,2013-08-27,Fort Bragg,0,M,H,"Shall the local Fort Bragg special purpose transactions and use tax (sales tax) of one-half of one percent for the express purpose of repairing, maintaining, and reconstructing existing streets, which expires December 31, 2014, be extended until December 31, 2024 to allow for continued maintenance of streets and alleys in Fort Bragg?",4,Sales Tax,62,Transport: Roads,757,322,1079,0.702,T,1,PassT,0,201300063,757,322,1079,0.7015755329008341,1,PassT,1,60,
201300064,2013,24,2,MERCED,2013-03-05,Atwater,0,M,H,"To preserve the City's long-term financial stability and maintain public safety services, including police patrols and fire protection; 911 emergency response; rapid response to gang violence, robberies and burglaries; park safety; youth, shall the City of Atwater enact a one-half cent sales tax, for the term of up to ten (10) years, with all funds to be spent locally, requiring independent Citizen's Oversight and published annual audits?",4,Sales Tax,34,Safety: Multiple Emergency Services,1822,895,2717,0.671,T,1,PassT,0,201300064,1822,895,2717,0.6705925653294075,1,PassT,1,30,
201300065,2013,24,2,MERCED,2013-11-05,Los Banos,0,M,K,"To maintain the number of local police officers/firefighters/E-M-Ts, anti-gang/crime units, and 9-1-1 emergency response times shall Los Banos voters extend Measure A for no more than 7 years to address local public safety needs and protect/maintain police officer and firefighter positions, with citizens oversight, independent annual audits, keeping all funds exclusively for Los Banos without raising taxes?",4,Sales Tax,34,Safety: Multiple Emergency Services,2357,375,2732,0.863,T,1,PassT,0,201300065,2357,375,2732,0.8627379209370425,1,PassT,1,30,
201300066,2013,24,2,MERCED,2013-11-05,Merced,0,M,J,Shall Section 400 of the City Charter be amended to reduce election costs to the City by consolidating the Mayor and City Council elections with statewide elections in even numbered years resulting in the next City election being in 2016 rather than 2015 and making a one-time adjustment in Mayor and City Council terms and term-limits to accomplish the change?,20,Charter Amendment,48,Governance: Elections,6339,698,7037,0.901,M,1,Pass,0,201300066,6339,698,7037,0.9008100042631804,1,Pass,20,40,
201300067,2013,27,2,MONTEREY,2013-11-05,Marina,0,M,I,"Shall an ordinance be adopted requiring each cardroom within the City to pay the City a tax of 5% of annual gross gaming revenues commencing January 1, 2014, to fund general municipal services such as public safety, street maintenance and neighborhood improvements",2,Business Tax,112,Revenues: Tax Creation/Incr./Contin.,2185,779,2964,0.737,M,1,Pass,0,201300067,2185,779,2964,0.7371794871794872,1,Pass,1,110,
201300068,2013,28,2,NAPA,2013-03-05,Calistoga,0,M,C,"Shall Resolution 2012-062, a general plan amendment approved by the City Council to establish a planned development overlay and certain planned development goals for the property generally located at 515 Foothill Boulevard, Calistoga, which will allow the development of the Enchanted Resorts resort and residential project, be adopted?",70,Ordinance,22,Land Use: Zoning,781,643,1424,0.548,M,1,Pass,0,201300068,781,643,1424,0.5484550561797753,1,Pass,70,20,
201300069,2013,30,2,ORANGE,2013-06-25,Cypress,0,M,A,"Shall the ordinance approving amendments to the Amended and Restated Cypress Business & Professional Center Specific Plan, together with related General Plan amendments and a zone change, to allow additional uses, including single-family housing and neighborhood commercial uses, in one planning area adjacent to Cerritos Avenue, and additional uses, including mixed-use commercial and business park uses, in a second planning area southeast of the Los Alamitos Race Course between Katella and Cerritos Avenues, be adopted?",70,Ordinance,22,Land Use: Zoning,2047,4825,6872,0.298,M,2,Fail,0,201300069,2047,4825,6872,0.29787543655413273,2,Fail,70,20,
201300070,2013,33,2,RIVERSIDE,2013-06-04,Riverside,0,M,A,"To maintain general fund services such as 9-1-1 response; police patrols/fire protection; children’s after-school and senior/disabled services; and protect supplies of clean drinking water from contamination; shall Section 1204.1 be added to the Charter continuing the annual transfer of funds from the City water utility to the general fund approved by City voters in 1968, with independent audits, funds staying local and no increase in taxes?",20,Charter Amendment,49,Governance: Budget Processes,16844,7995,24839,0.678,M,1,Pass,0,201300070,16844,7995,24839,0.6781271387737027,1,Pass,20,40,
201300071,2013,33,2,RIVERSIDE,2013-11-05,Blythe,0,M,C,Shall the offices of city clerk and city treasurer be appointed?,70,Ordinance,43,Governance: Organization,350,848,1198,0.292,M,2,Fail,0,201300071,350,848,1198,0.2921535893155259,2,Fail,70,40,
201300072,2013,33,2,RIVERSIDE,2013-11-05,Canyon Lake,0,M,D,Shall Ordinance No. 148 enacting a special tax to fund the continuation of Fire Station 60 and to fund fire protection services in the City of Canyon Lake be adopted?,7,Miscellaneous Tax,33,Safety: Fire,1277,1254,2531,0.505,T,2,FailT,0,201300072,1277,1254,2531,0.5045436586329514,2,FailT,1,30,
201300073,2013,33,2,RIVERSIDE,2013-11-05,Canyon Lake,0,M,E,(Advisory) Should the area of Canyon Lake commonly known as Goetz Hill be graded for retail development?,30,Advisory,22,Land Use: Zoning,610,1914,2524,0.242,M,2,Fail,0,201300073,610,1914,2524,0.24167987321711568,2,Fail,30,20,
201300074,2013,33,2,RIVERSIDE,2013-11-05,Palm Springs,0,M,B,"In order to help fund general municipal services, including but not limited to such matters as police protection and crime suppression services, fire prevention and suppression services, emergency medical services, park, recreation, and library facilities and services, and general improvements throughout the City, shall an ordinance to impose a tax at a rate of up to 15 cents per $1.00 of proceeds on cannabis or marijuana collectives operating in the City of Palm Springs be adopted?",4,Sales Tax,112,Revenues: Tax Creation/Incr./Contin.,5585,2842,8427,0.663,M,1,Pass,0,201300074,5585,2842,8427,0.662750682330604,1,Pass,1,110,
201300075,2013,36,2,SAN BERNARDINO,2013-03-05,Rialto,0,M,W,Shall the Ordinance to Continue the Utility User Tax for five years be Adopted?,5,Utility Tax,112,Revenues: Tax Creation/Incr./Contin.,3050,1803,4853,0.628,M,1,Pass,0,201300075,3050,1803,4853,0.6284772305790233,1,Pass,1,110,
201300076,2013,36,2,SAN BERNARDINO,2013-11-05,Chino,0,M,B,"Shall the General Plan of the City of Chino be amended to change the land use designation of 6.48 acres of vacant land from General Commercial to Residential RD8 and of 5.31 acres of vacant land from Office Commercial to Residential RD8, generally located at the southeast corner of Riverside Drive and Fern Avenue, for a maximum of 94 single-family dwelling units?",70,Ordinance,22,Land Use: Zoning,1885,817,2702,0.698,M,1,Pass,0,201300076,1885,817,2702,0.6976313841598816,1,Pass,70,20,
201300077,2013,36,2,SAN BERNARDINO,2013-11-05,Grand Terrace,0,M,C,"To ensure Grand Terrace has the funds necessary to remain an independent city and able to provide essential services to residents including rapid response to 9-1-1 police emergencies, maintenance/repair of local streets, adequate police services, and maintaining parks and public facilities, shall the City of Grand Terrace establish a utility users’ tax of 5% for six years only with independent citizen oversight, all money  staying local, and an exemption for low-income seniors?",5,Utility Tax,112,Revenues: Tax Creation/Incr./Contin.,932,1432,2364,0.394,M,2,Fail,0,201300077,932,1432,2364,0.3942470389170897,2,Fail,1,110,
201300078,2013,36,2,SAN BERNARDINO,2013-11-05,San Bernardino,0,R,1,Shall City Council Member Wendy J. McCammack be recalled?,50,Recall,46,Governance: Recall,1460,1033,2493,0.586,M,1,Pass,0,201300078,1460,1033,2493,0.5856397914159647,1,Pass,50,40,
201300079,2013,36,2,SAN BERNARDINO,2013-11-05,San Bernardino,0,R,2,Shall City Attorney James F. Penman be recalled?,50,Recall,46,Governance: Recall,7730,5013,12743,0.607,M,1,Pass,0,201300079,7730,5013,12743,0.6066075492427215,1,Pass,50,40,
201300080,2013,36,2,SAN BERNARDINO,2013-11-05,San Bernardino,0,R,3,Shall City Council Member John Valdivia be recalled?,50,Recall,46,Governance: Recall,426,705,1131,0.377,M,2,Fail,0,201300080,426,705,1131,0.376657824933687,2,Fail,50,40,
201300081,2013,36,2,SAN BERNARDINO,2013-11-19,Apple Valley,0,M,D,"Shall a General Plan Amendment be adopted, and shall Chapter 9.40 be repealed and Chapter 9.41 be added to the Town Development Code to enact the “Dale Evans Parkway Commercial Specific Plan” in order to allow a proposed commercial development in the Town of Apple Valley located on approximately 30 acres of undeveloped property north of Happy Trails Highway (SR-18), at the southeasterly corner of the intersection of Dale Evans Parkway and Thunderbird Road?",70,Ordinance,22,Land Use: Zoning,6230,4403,10633,0.586,M,1,Pass,0,201300081,6230,4403,10633,0.5859117840684661,1,Pass,70,20,
201300082,2013,37,2,SAN DIEGO,2013-06-18,Encinitas,0,M,A,"(INITIATIVE) Shall the people of Encinitas adopt an initiative measure, known as ""The Encinitas Right to Vote Amendment"" to require voter approval, by a majority vote of the electorate, for a major amendment to a planning policy document (defined to mean the Land Use Element of the General Plan, Land Use Policy Maps of the General Plan, Zoning Code, Zoning Map, any specific plan, and development agreements) and to impose a citywide height limit?",40,Initiative,26,Land Use: Voter Approval,6675,6198,12873,0.519,M,1,Pass,0,201300082,6675,6198,12873,0.5185271498485201,1,Pass,40,20,
201300083,2013,39,2,SAN JOAQUIN,2013-11-05,Stockton,0,M,A,"To pay for law enforcement and crime prevention services such as those described in Stockton’s Marshall Plan on Crime, to help end the bankruptcy and restore other City services; and provided it shall sunset in ten years or when economic recovery occurs, a Citizen’s Oversight Committee reports on the use of proceeds, and independent audits are done annually; shall Ordinance 2013-07-09-1601 be adopted to impose a 3/4-cent transaction and use (sales) tax?",4,Sales Tax,112,Revenues: Tax Creation/Incr./Contin.,14939,13869,28808,0.519,M,1,Pass,0,201300083,14939,13869,28808,0.5185712302138294,1,Pass,1,110,
201300084,2013,39,2,SAN JOAQUIN,2013-11-05,Stockton,0,M,B,"If Measure A is approved by the voters, shall (i) 65% of its proceeds be used only to pay for law enforcement and crime prevention services in the City such as those described in the City’s Marshall Plan on Crime and (ii) 35% of its proceeds be used only to pay for the City’s efforts to end the bankruptcy and for services to residents, businesses, and property owners?",70,Ordinance,40,Governance,16776,11530,28306,0.593,M,1,Pass,0,201300084,16776,11530,28306,0.5926658658941567,1,Pass,70,40,
201300085,2013,41,2,SAN MATEO,2013-11-05,Atherton,0,M,X,"To continue providing funding to maintain neighborhood police patrols and the Town's ability to respond to emergencies, repairing and maintaining streets, and repairing and constructing storm drains, shall an ordinance be adopted to continue a Special Parcel Tax for four years and allowing for the expenditure of funds derived from such tax?",3,Property Tax,112,Revenues: Tax Creation/Incr./Contin.,1466,532,1998,0.734,T,1,PassT,0,201300085,1466,532,1998,0.7337337337337337,1,PassT,1,110,
201300086,2013,41,2,SAN MATEO,2013-11-05,Brisbane,0,M,T,"To pay for general municipal expenses, shall the City increase the annual business license tax for liquid storage facilities up to $115.28 per one thousand cubic feet of liquid storage capacity, and provide for an offset for sales tax revenue received?",2,Business Tax,112,Revenues: Tax Creation/Incr./Contin.,881,262,1143,0.771,M,1,Pass,0,201300086,881,262,1143,0.7707786526684165,1,Pass,1,110,
201300087,2013,41,2,SAN MATEO,2013-11-05,Foster City,0,M,U,"To pay for general city services enjoyed by all residents and businesses in Foster City, including services such as police, fire, parks, recreation, and repairing and maintaining the levee, lagoon, streets and other infrastructure, shall an ordinance be adopted to increase the City's business license tax effective January 1, 2014?",2,Business Tax,112,Revenues: Tax Creation/Incr./Contin.,3077,1126,4203,0.732,M,1,Pass,0,201300087,3077,1126,4203,0.7320961218177492,1,Pass,1,110,
201300088,2013,41,2,SAN MATEO,2013-11-05,Pacifica,0,M,V,"Without raising the current 6.5% rate, and to fund fire protection; emergency services; police protection; Meals on Wheels and other senior citizen services; street, sidewalk and pothole repair; and other essential services, shall an ordinance be adopted to amend the City of Pacifica's Utility Users Tax adding telecommunications services, requiring equal treatment regardless of technology used, maintaining senior exemptions and adding independent citizens oversight, with all funds staying in Pacifica and no funds for Sacramento?",5,Utility Tax,112,Revenues: Tax Creation/Incr./Contin.,2575,4970,7545,0.341,M,2,Fail,0,201300088,2575,4970,7545,0.3412856196156395,2,Fail,1,110,
201300089,2013,41,2,SAN MATEO,2013-11-05,Portola Valley,0,M,Q,"Do the People of the Town of Portola Valley adopt an ordinance that continues the reduction of the general purpose Utility Users Tax levied on telephone, gas, water and electricity, set forth in Chapter 3.32 of the Portola Valley Municipal Code, from 5.5% to 4.5% on the charges made for such utility services for a period of four years from July 1, 2014 through June 30, 2018?",5,Utility Tax,111,Revenues: Tax Repeal/Reduction/Limit,1035,165,1200,0.863,M,1,Pass,0,201300089,1035,165,1200,0.8625,1,Pass,1,110,
201300090,2013,43,2,SANTA CLARA,2013-11-05,Palo Alto,0,M,D,Shall the Palo Alto Municipal Code be amended to rezone the property located at 567-595 Maybell Avenue from R-2 Low Density Residential and RM-15 Multiple Family Residential to Planned Community Overlay Zone to include 12 single family units and 60 units of affordable senior housing?,70,Ordinance,22,Land Use: Zoning,6538,8476,15014,0.435,M,2,Fail,0,201300090,6538,8476,15014,0.43546023711202875,2,Fail,70,20,
201300091,2013,43,2,SANTA CLARA,2013-11-05,Sunnyvale,0,M,A,"To help reduce the City’s elections costs through consolidation with County and State elections, shall the Sunnyvale City Charter be amended to change the City’s general municipal elections from odd numbered years to even numbered years, with the next general municipal election scheduled for 2016, and to provide a one time, one year extension to councilmember terms, and create a temporary one year mayoral term to enable the transition to even-numbered year elections?",20,Charter Amendment,48,Governance: Elections,13259,5142,18401,0.721,M,1,Pass,0,201300091,13259,5142,18401,0.7205586652899298,1,Pass,20,40,
201300092,2013,43,2,SANTA CLARA,2013-11-05,Sunnyvale,0,M,B,"Shall the Sunnyvale Municipal Code be amended to increase the transient occupancy tax rate (commonly called “hotel tax”) charged to persons who occupy hotel or motel rooms in the City for 30 days or less from 9.5% to 10.5% in order to help maintain the City’s ability to fund basic services such as public safety and streets, trees, and sidewalk maintenance, and to keep parity with neighboring cities’ hotel tax rates, effective January, 2014?",9,Transient Occupancy Tax,112,Revenues: Tax Creation/Incr./Contin.,12657,5799,18456,0.686,M,1,Pass,0,201300092,12657,5799,18456,0.6857932379713915,1,Pass,1,110,
201300093,2013,43,2,SANTA CLARA,2013-11-05,Sunnyvale,0,M,C,"Shall the City of Sunnyvale adopt a gun safety ordinance to require: 1) reporting to police, within 48 hours, known loss or theft of a firearm; 2) storing firearms in residences in a locked container or disabling them with a trigger lock when not in the owner’s immediate possession; 3) prohibiting the possession of ammunition magazines capable of holding more than 10 rounds, with certain exceptions; and 4) logging and tracking of ammunition sales within the City of Sunnyvale?",70,Ordinance,37,Safety: Firearms,12404,6235,18639,0.665,M,1,Pass,0,201300093,12404,6235,18639,0.665486345834004,1,Pass,70,30,
201300094,2013,44,2,SANTA CRUZ,2013-06-04,Watsonville,0,M,T,Should the City of Watsonville amend its Urban Limit Line to allow for the possible annexation of approximately 95 acres of agricultural land to the City limits for future economic development and jobs?,70,Ordinance,22,Land Use: Zoning,1064,3345,4409,0.241,M,2,Fail,0,201300094,1064,3345,4409,0.24132456339305966,2,Fail,70,20,
