MeasID,YEAR,CO,JUR,CNTYNAME,DATE,PLACE,CSD,MEASTYPE,LTR,BALQUEST,Orig_TYPE,RECTYPE,RECTYPENAME,Orig_TOPIC,RECTOPIC,RECTOPNAME,YES,NO,TOTAL,PERCENT,REQ,OUTCOME,PASSFAIL,Multi_CO,Multi_MeasID,YES_sum,NO_sum,Total_sum,Percent_sum,Outcome_sum,passfail_sum,typerec,topicrec
201000001,2010,1,2,ALAMEDA,2010-02-02,Alameda,2,M,B,"(INITIATIVE) Shall the City Charter Amendment, and ordinance proposing General Plan Amendments, Zoning Map and Text Amendment and Development Agreement, regarding development of Alameda Point be adopted?",40,40,Initiative,22,22,Land Use: Zoning,2361,13797,16158,0.14611956,M,2,Fail,0,201000001,2361,13797,16158,0.14611956,2,Fail,40,20
201000002,2010,30,2,ORANGE,2010-02-02,Mission Viejo,2,R,1,Shall Lance MacLean be recalled (removed) from the office of City Council Member?,50,50,Recall,46,46,Governance: Recall,7370,7351,14721,0.50064534,M,1,Pass,0,201000002,7370,7351,14721,0.50064534,1,Pass,50,40
201000003,2010,19,2,LOS ANGELES,2010-02-23,Montebello,2,R,1,Shall KATHY SALAZAR be recalled from the office of Member of the City Council of the City of Montebello?,50,50,Recall,46,46,Governance: Recall,2674,1052,3726,0.7176597,M,1,Pass,0,201000003,2674,1052,3726,0.7176597,1,Pass,50,40
201000004,2010,19,2,LOS ANGELES,2010-02-23,Montebello,2,R,2,Shall ROBERT URTEAGA be recalled from the office of Member of the City Council of the City of Montebello?,50,50,Recall,46,46,Governance: Recall,2672,1015,3687,0.72470844,M,1,Pass,0,201000004,2672,1015,3687,0.72470844,1,Pass,50,40
201000005,2010,33,2,RIVERSIDE,2010-02-23,Lake Elsinore,2,R,1,Shall Thomas Buckley be recalled (removed) from the office of the City Council Member?,50,50,Recall,46,46,Governance: Recall,1010,1290,2300,0.43913043,M,2,Fail,0,201000005,1010,1290,2300,0.43913043,2,Fail,50,40
201000006,2010,41,3,SAN MATEO,2010-02-23,San Mateo - Foster City Elementary,2,M,A,"To protect local schools from damaging State budget cuts, provide stable local funding that cannot be taken away by the State, and preserve quality education by attracting and retaining qualified teachers and staff, maintaining school libraries, providing middle school art and music programs and supporting small class sizes, shall San Mateo-Foster City School District increase the expiring school parcel tax by $96 for seven years, with annual cost of living adjustments, exemptions for seniors and independent fiscal oversight?",3,3,Property Tax,10,10,Education,14689,7238,21927,0.6699047,T,1,PassT,0,201000006,14689,7238,21927,0.6699047,1,PassT,1,10
201000007,2010,41,3,SAN MATEO,2010-03-02,Burlingame Elementary,2,M,B,"To maintain quality education, restore and protect critical school programs, including math and science, reading and writing, books and classroom materials, school library services, art and music, and to retain qualified teachers shall Burlingame Elementary School District renew its expiring education parcel tax, without increase, of $180 per parcel for ten years with no funds for administrators' salaries, all funds going to local elementary and middle schools, and an exemption for senior citizens?",3,3,Property Tax,10,10,Education,4685,1899,6584,0.71157354,T,1,PassT,0,201000007,4685,1899,6584,0.71157354,1,PassT,1,10
201000008,2010,15,3,KERN,2010-03-09,Tehachapi Unified,2,R,1,Shall Holly Hart be recalled (removed) from the office of Governing Board Member?,50,50,Recall,13,13,Education: Recall,2527,2846,5373,0.47031453,M,2,Fail,0,201000008,2527,2846,5373,0.47031453,2,Fail,50,10
201000009,2010,15,3,KERN,2010-03-09,Tehachapi Unified,2,R,2,Shall Patty Snyder be recalled (removed) from the office of Governing Board Member?,50,50,Recall,13,13,Education: Recall,2416,2946,5362,0.45057815,M,2,Fail,0,201000009,2416,2946,5362,0.45057815,2,Fail,50,10
201000010,2010,15,3,KERN,2010-03-09,Tehachapi Unified,2,R,3,Shall Mary Graham be recalled (removed) from the office of Governing Board Member?,50,50,Recall,13,13,Education: Recall,2444,2918,5362,0.4558001,M,2,Fail,0,201000010,2444,2918,5362,0.4558001,2,Fail,50,10
201000011,2010,19,2,LOS ANGELES,2010-04-13,El Segundo,2,M,M,Shall the ordinance amending El Segundo Municipal Code Chapter 3-7 that imposes a Utility User Tax on non-residential users in the City by updating and replacing the telephone tax regulations with modern communication services tax regulations be adopted?,5,5,Utility Tax,112,112,Revenues: Tax Creation/Incr./Contin.,1570,647,2217,0.7081642,M,1,Pass,0,201000011,1570,647,2217,0.7081642,1,Pass,1,110
201000012,2010,19,2,LOS ANGELES,2010-04-13,El Segundo,2,M,N,"Shall the ordinance amending El Segundo Municipal Code §§ 4-2-1, 4-2-3, and 4-2-4 to allow annual increases to the business license tax to fund general municipal services including, without limitation, police protection and crime suppression services, fire prevention and suppression services, and park and recreation facilities and services be adopted?",2,2,Business Tax,112,112,Revenues: Tax Creation/Incr./Contin.,1508,711,2219,0.6795854,M,1,Pass,0,201000012,1508,711,2219,0.6795854,1,Pass,1,110
201000013,2010,19,2,LOS ANGELES,2010-04-13,Lancaster,2,M,C,Shall the voters of the City of Lancaster adopt a charter to regain home-rule control and accountability from the State for local municipal affairs?,20,20,Charter Amendment,40,40,Governance,8996,3674,12670,0.7100237,M,1,Pass,0,201000013,8996,3674,12670,0.7100237,1,Pass,20,40
201000014,2010,19,2,LOS ANGELES,2010-04-13,Lancaster,2,M,I,"In response to a recent complaint, with respect to the invocations that contained reference to Jesus Christ, shall the City Council continue its invocation policy in randomly selecting local clergy of different faiths to deliver the invocation without restricting the content based on their beliefs, including references to Jesus Christ?",70,70,Ordinance,200,200,Other,9765,3116,12881,0.7580933,M,1,Pass,0,201000014,9765,3116,12881,0.7580933,1,Pass,70,200
201000015,2010,19,2,LOS ANGELES,2010-04-13,Lancaster,2,M,M,"Shall the term of office of the Mayor be four years, commencing in 2012?",70,70,Ordinance,43,43,Governance: Organization,7168,5768,12936,0.55411255,M,1,Pass,0,201000015,7168,5768,12936,0.55411255,1,Pass,70,40
201000016,2010,19,2,LOS ANGELES,2010-04-13,Sierra Madre,2,M,ED,"Shall an ordinance be adopted prohibiting the City of Sierra Madre from exercising the power of eminent domain for private purposes, or facilitating or funding the exercise of the power of eminent domain for private purposes?",70,70,Ordinance,40,40,Governance,2359,387,2746,0.85906774,M,1,Pass,0,201000016,2359,387,2746,0.85906774,1,Pass,70,40
201000017,2010,49,2,SONOMA,2010-04-13,Cotati,2,M,A,"To prevent potential elmination of the Police Department; restore Police services to 2008 levels; maintain financial viablity of the City; prevent cuts to street paving, pothole repair, and park maintencance; restore City Hall service hours; and maintain other City services, shall the City of Cotati enact a one-half cent sales tax, which will sunset in 5 years, and be subject to annual financial audits and public expenditure reports?",4,4,Sales Tax,112,112,Revenues: Tax Creation/Incr./Contin.,1120,750,1870,0.5989305,M,1,Pass,0,201000017,1120,750,1870,0.5989305,1,Pass,1,110
201000018,2010,7,3,CONTRA COSTA,2010-05-04,Acalanes Union High,2,M,A,"To avoid the severe loss of science, foreign language, English, social studies, the arts, and mathematics classes due to continuing deep cuts in the state's budget, and to provide students with high-quality programs and services, shall the Acalanes Union High School District be authorized to collect an emergency special tax at an annual cost of $112 per parcel for five years beginning July 1, 2010, with a citizens' overisght committee, and offering a senior exemption?",3,3,Property Tax,10,10,Education,27487,12647,40134,0.6848807,T,1,PassT,0,201000018,27487,12647,40134,0.6848807,1,PassT,1,10
201000019,2010,19,3,LOS ANGELES,2010-05-04,Pasadena Unified,2,M,CC,"To provide educational opportunities so local students are prepared to succeed in college and careers; to retain quality teachers; continue funding academic programs in advanced math, science, technology, music and art; keep school libraries open, and lessen the impact of state budget cuts, shall Pasadena Unified School District levy a tax of $120 per parcel annually for five years, with independent citizens' oversight, exemption for low-income seniors, and with all funds benefiting our local public schools and students?",3,3,Property Tax,10,10,Education,16845,14495,31340,0.53749204,T,2,FailT,0,201000019,16845,14495,31340,0.53749204,2,FailT,1,10
201000020,2010,41,3,SAN MATEO,2010-05-04,Menlo Park City Elementary,2,M,C,"To protect the excellent schools servinc the children of our community by maintaining small class sizes and high quality teachers in the face of deep state budget cuts and growing local enrollment, shall the Menlo Park City School District levy a 7-year parcel tax of $178 per year, adjusted annually for inflation, to be spent only on teachers and essential educational programs, with an exemption available to individuals age 65 and over?",3,3,Property Tax,10,10,Education,5877,1844,7721,0.7611708,T,1,PassT,0,201000020,5877,1844,7721,0.7611708,1,PassT,1,10
201000021,2010,41,3,SAN MATEO,2010-05-04,Portola Valley Elementary,2,M,D,"To maintain academic excellence and limit the impact of substantial state budges cuts, shall the Portola Valley Elementary School District continue its emphasis on science, math, reading and writing instruction; retain qualified and experienced teachers; minimize class size increases; and support arts and music programs, by levying $168 per parcel tax for four years with an exemption for seniors, mandatory annual audits, independent citizen oversight, no money for administrator salaries and all funds staying in Portola Valley for local schools?",3,3,Property Tax,10,10,Education,1989,574,2563,0.7760437,T,1,PassT,0,201000021,1989,574,2563,0.7760437,1,PassT,1,10
201000022,2010,43,3,SANTA CLARA,2010-05-04,Fremont Union High,2,M,B,"To provide, stable, local funds needed to protect teaching positions, and assure the Cupertino, Fremont, Homestead, Lynbrook, and Monte Vista High School District renew its existing, expiring parcel tax with a tax at the same annual rate of $98 per parcel for six years commencing July 1, 2010, with all funds benefiting local high schools, and offering an exemption to seniors and the disabled?",3,3,Property Tax,10,10,Education,28613,10874,39487,0.72461826,T,1,PassT,0,201000022,28613,10874,39487,0.72461826,1,PassT,1,10
201000023,2010,43,3,SANTA CLARA,2010-05-04,Lakeside Joint Elementary,2,M,C,"To protect quality education and small class sizes for all students in Lakeside Joint School district, and provide qualified teachers with specialized training, comprehensive science programs, updated classroom technology, and quality academic programs for middle school students, shall the Lakeside Joint School District be authorized to implement an annual education parcel tax of $311 for seven years, with citizen oversight, and exemption available for senior citizens, no funds for administrators' salaries, and every dollar spent on Lakeside students?",3,3,Property Tax,10,10,Education,517,252,769,0.6723017,T,1,PassT,1,201000025,888,421,1309,0.6783804,1,PassT,1,10
201000024,2010,43,3,SANTA CLARA,2010-05-04,Loma Prieta Joint Union,2,M,G,"To retain qualified and experienced teachers, keep schools safe and clean, maintain high quality academics, including reading, writing, math, and science, continue a well-rounded education including Spanish, art, and other educational enrichment programs, maintain updated computer technology, and maintain small class sizes, shall Loma Prieta Joint Union Elementary School District authorize an annual school parcel tax of $95 per parcel for four years, with an exemption for seniors, no funds used for administrator's salaries, and every dollar staying in local schools?",3,3,Property Tax,10,10,Education,1008,532,1540,0.6545454,T,2,FailT,1,201000026,1804,971,2775,0.6500901,2,FailT,1,10
201000025,2010,43,3,SANTA CLARA,2010-05-04,Palo Alto Unified,2,M,A,"To preserve excellence in core academic programs, including reading, writing, math, and science; reduce the impact of deep budget cuts with stable locally-controlled funding; minimize teacher layoffs and class size increases; continue teacher professinoal development; and help protect critical high school electives, including arts and music, shall Palo Alto Unified School District renew its expiring parcel tax for six years, increase the rate by $96, with an exemption for seniors, annual two percent escalation adjustments, and independent oversight?",3,3,Property Tax,10,10,Education,16342,4231,20573,0.7943421,T,1,PassT,0,201000023,16342,4231,20573,0.7943421,1,PassT,1,10
201000026,2010,43,3,SANTA CLARA,2010-05-04,Union Elementary,2,M,H,"To support high academic achievement for local Union Elementary School District students by protecting strong academic programs like English, math and science, retaining qualified teachers, keeping schools safe, providing classroom materials and technology and helping maintain small class sizes, shall Union Elementary School District authorize an annual education parcel tax of $96 per parcel for 6 years, exempting seniors, and gauranteeing: no use of funds for administrator salaries; independent oversight and annual audits; and every dollar staying in our local schools.",3,3,Property Tax,10,10,Education,8233,3133,11366,0.7243533,T,1,PassT,0,201000024,8233,3133,11366,0.7243533,1,PassT,1,10
201000027,2010,44,3,SANTA CRUZ,2010-05-04,Lakeside Joint Elementary,2,M,C,"To protect quality education and small class sizes for all students in Lakeside Joint School District, and provide qualified teachers with specialized, comprehensive science programs, updated classroom technology, and quality academic programs for middle school students, shall the Lakeside Joint School District be authorized to implement an annual education parcel tax of $311 for seven years, with citizen oversight, an exemption available for senior citizens, no funds for administrators' salaries, and every dollar spent on Lakeside students?",3,3,Property Tax,10,10,Education,371,169,540,0.68703705,T,1,PassT,1,201000025,888,421,1309,0.6783804,1,PassT,1,10
201000028,2010,44,3,SANTA CRUZ,2010-05-04,Loma Prieta Joint Union,2,M,G,"To retain qualified and experienced teachers, keep schools safe and clean, maintain high quality academics, including reading,writing, math, and science, continue a well-rounded education including Spanish, art, and other educational enrichment programs, maintain updated computer technology, and maintain small class sizes, shall Loma Prieta Joint Union Elementary School District authorzie an annual school parcel tax of $95 per parcel for four years, with an exemption for seniors, no funds used for adminsitrator's salaries, and every dollar staying in local schools?",3,3,Property Tax,10,10,Education,796,439,1235,0.6445344,T,2,FailT,1,201000026,1804,971,2775,0.6500901,2,FailT,1,10
201000029,2010,19,3,LOS ANGELES,2010-05-25,Santa Monica-Malibu Unified,2,M,A,"To protect our high-quality local schools against severe funding cuts imposed by the State of California; prevent widespread teacher layoffs; maintain academic excellence in reading, writing, math, and science; preserve elementary school music; keep school libraries open; shall the Santa Monica-Malibu Unified School District levy a parcel tax of $198/year for five years, with senior homeowner exemptions; mandatory annual public audits; independent citizen oversight; no funds used for administrator salaries; and all funds supporting our local Santa Monica and Malibu schools?",3,3,Property Tax,10,10,Education,13671,7607,21278,0.6424946,T,2,FailT,0,201000027,13671,7607,21278,0.6424946,2,FailT,1,10
201000030,2010,7,1,CONTRA COSTA,2010-06-08,Brentwood,2,M,F,"(INITIATIVE) Shall the Initiative Adopting a City of Brentwood Voter Approved Urban Limit Line; Permitting Mixed Use Development; and Providing Funds for jobs, Sports and Recreational Fields and Public Safety be adopted?",40,40,Initiative,21,21,Land Use: Growth Cap/Boundary,4251,5702,9953,0.4271074,M,2,Fail,0,201000028,4251,5702,9953,0.4271074,2,Fail,40,20
201000031,2010,7,1,CONTRA COSTA,2010-06-08,Kensington Police Protection and CSD,1,M,G,"Shall Kensington Police Protection and Community Services District Ordinance No.2010-01, which imposes a Supplemental Special Tax for Kensington Police Department services in an initial annual amount of not to exceed $200.00 for single family residential parcels, subject to CPI, with amounts for properties in other use categories identified in the ordinance, commencing FY 2010/11, be approved and shall the District appropriations limit be increased by the amount of this voter-approved tax?",3,3,Property Tax,32,32,Safety: Police,1478,677,2155,0.68584687,T,1,PassT,0,201000029,1478,677,2155,0.68584687,1,PassT,1,30
201000032,2010,21,1,MARIN,2010-06-08,Marin,2,M,A,"To provide critical funding to: bring local libraries up to date, prevent closures, and maintain library hours; provide children, teen, senior and disabled programs including adult and family literacy; maintain collections of books, CDs DVDs. Materials and services; provide ADA accessibility; and ensure local funding that can't be taken by the State, shall Marin County Free Library be authorized to levy $49 per parcel annually for 5 years, including independent citizen oversight and senior citizen exemptions?",3,3,Property Tax,71,71,Facilities: Libraries,30782,10340,41122,0.7485531,T,1,PassT,0,201000030,30782,10340,41122,0.7485531,1,PassT,1,70
201000033,2010,21,1,MARIN,2010-06-08,"Muir Beach, CSD",1,M,E,"Shall Muir Beach CSD Ordinance No. 2010-1, which imposes an annual special tax of $3,250.00 on each improved commercially zoned parcel, $300.00 per separate habitable structure on each residentially zoned parcel and $300.00 on all other parcels for a period of four (4) years, commencing FY 2010-2011 and teminating in FY 2014-2015, be approved and shall the Muir Beach CSD appropriations limit be increased by the amount of this voter approved tax?",3,3,Property Tax,112,112,Revenues: Tax Creation/Incr./Contin.,129,22,151,0.8543046,T,1,PassT,0,201000031,129,22,151,0.8543046,1,PassT,1,110
201000034,2010,25,1,MODOC,2010-06-08,Alturas,2,M,O,"Shall the Alturas City Council be authorzied to continue a supplemental charge of $1.50 per meter to minimum water rates to fund mosquito abatement in the City of Alturas through June 30, 2014?",5,5,Utility Tax,54,54,Environment: Regulation/Mitigation,771,199,970,0.79484534,M,1,Pass,0,201000032,771,199,970,0.79484534,1,Pass,1,50
201000035,2010,26,1,MONO,2010-06-08,Mono,2,M,M,Shall the Ordinance which permits up to two medical marijuana cooperatives in either the general commercial or industrial zones of the town be approved?,70,70,Ordinance,22,22,Land Use: Zoning,890,693,1583,0.5622236,T,2,FailT,0,201000033,890,693,1583,0.5622236,2,FailT,70,20
201000036,2010,26,1,MONO,2010-06-08,Mono,2,M,U,"Shall the Ordinance which extends the Utility Users Tax with no Increase to the current rate of 2.5%, and  which restricts the use of funds to Mobility, Recreation, &amp; Arts &amp; Culture, be approved?",5,5,Utility Tax,70,70,Facilities,1062,511,1573,0.67514306,T,1,PassT,0,201000034,1062,511,1573,0.67514306,1,PassT,1,70
201000037,2010,30,1,ORANGE,2010-06-08,Orange,2,M,C,Should an ordinance be adopted confirming the General Plan Designation for the Orange County Fair and Event Center as it is set forth in the General Plan as amended by GP-09-01 which amended the fairground land use designation in the Land Use Element of the 2000 general Plan to describe and maintain current fair and event uses on the site and requiring that further amendment be made only upon majority vote of the electorate?,70,70,Ordinance,26,26,Land Use: Voter Approval,13000,1829,14829,0.8766606,M,1,Pass,0,201000035,13000,1829,14829,0.8766606,1,Pass,70,20
201000038,2010,37,1,SAN DIEGO,2010-06-08,San Diego,2,M,A,(INITIATIVE) Shall this initiative be adopted for the purpose of siting a new recycling center and class III solid waste landfill on the East Otay Mesa area of unincorporated San Diego County?,40,40,Initiative,22,22,Land Use: Zoning,399127,73293,472420,0.84485626,M,1,Pass,0,201000036,399127,73293,472420,0.84485626,1,Pass,40,20
201000039,2010,37,1,SAN DIEGO,2010-06-08,San Diego,2,M,B,Shall the San Diego County Charter be amended to impose a limit of two terms for persons serving on the San Diego County Board of Supervisors?,20,20,Charter Amendment,45,45,Governance: Political Reform/Term Limits,336416,156374,492790,0.6826762,M,1,Pass,0,201000037,336416,156374,492790,0.6826762,1,Pass,20,40
201000040,2010,38,1,SAN FRANCISCO,2010-06-08,San Francisco,2,M,B,"To improve fire, earthquake and emergency response and ensure firefighters a reliable water supply for fires and disasters, through projects including: improving deteriorating pipes, hydrants, reservoirs, water cisterns and pumps built after the 1906 earthquake; improving neighborhood fire stations; replacing the seismically-unsafe emergency command center with an earthquake-safe building; and to pay related costs, shall the City and County of San Francisco issue $412,300,000 in general obligation bonds, subject to citizen oversight and regular audits?",11,11,GO Bond,34,34,Safety: Multiple Emergency Services,117553,30484,148037,0.7940785,T,1,PassT,0,201000038,117553,30484,148037,0.7940785,1,PassT,10,30
201000041,2010,38,1,SAN FRANCISCO,2010-06-08,San Francisco,2,M,C,"Shall the Charter be amended to require the City to have a Film Commission, consisting of five members appointed by the Board of Supervisors and six members appointed by the Mayor, with final authority to issue permits to film in San Francisco?",20,20,Charter Amendment,43,43,Governance: Organization,66125,76834,142959,0.46254522,M,2,Fail,0,201000039,66125,76834,142959,0.46254522,2,Fail,20,40
201000042,2010,38,1,SAN FRANCISCO,2010-06-08,San Francisco,2,M,D,Shall the City: calculate retirement benefits for new City employees using average monthly compensation over two years instead of over one year; increase the retirement benefit employee contribution for new safety employees and new employees in positions covered by the State retirement system; and require that savings from reduced employer contributions to the City’s retirement system be deposited in the Retiree Health Care Trust Fund?,70,70,Ordinance,42,42,Governance: Personnel/Labor Relations,112100,30222,142322,0.7876505,M,1,Pass,0,201000040,112100,30222,142322,0.7876505,1,Pass,70,40
201000043,2010,38,1,SAN FRANCISCO,2010-06-08,San Francisco,2,M,E,Shall the City require that the Police Department’s annual budget include a line item for the cost of security provided to City officials and visiting dignitaries?,70,70,Ordinance,32,32,Safety: Police,80364,63600,143964,0.5582229,M,1,Pass,0,201000041,80364,63600,143964,0.5582229,1,Pass,70,30
201000044,2010,38,1,SAN FRANCISCO,2010-06-08,San Francisco,2,M,F,"Shall the City amend its Residential Rent Ordinance to add provisions for tenants to apply to the Rent Board to postpone most rent increases if they become unemployed, their wages decrease by 20% or more, or they do not receive a cost of living increase in their government benefits and those benefits are their sole income?",70,70,Ordinance,82,82,Housing: Rent Control,62239,85071,147310,0.42250356,M,2,Fail,0,201000042,62239,85071,147310,0.42250356,2,Fail,70,80
201000045,2010,38,1,SAN FRANCISCO,2010-06-08,San Francisco,2,M,G,Shall it be City policy that the northern end of the planned San Francisco-to-Los Angeles high-speed rail line be located at the Transbay Transit Center at First and Mission streets?,70,70,Ordinance,61,61,Transport: Mass Transit,120788,23421,144209,0.83758986,M,1,Pass,0,201000043,120788,23421,144209,0.83758986,1,Pass,70,60
201000046,2010,42,1,SANTA BARBARA,2010-06-08,Santa Barbara,2,M,K,Shall an ordinance to continue Section 32-12 of the Santa Barbara County Code to sustain the current transient occupancy tax rate or ten percent (10%) upon transients occupying defined hotels located only within the unincorporated area of Santa Barbara County be approved?,9,9,Transient Occupancy Tax,112,112,Revenues: Tax Creation/Incr./Contin.,54169,21528,75697,0.715603,M,1,Pass,0,201000044,54169,21528,75697,0.715603,1,Pass,1,110
201000047,2010,49,1,SONOMA,2010-06-08,Sonoma,2,M,D,Shall the Sonoma County Civil Service Ordinance be amended to: change the appointing responsiblity for the director of human resources from the Civil Service Commission to the Board of Supervisors; add the director of human resources to the list of unclassified employees; and allow the Board of Supervisors to amend the Ordinance without voter approval so long as amendments do not nullify the basic principles of the Civil Service System?,70,70,Ordinance,43,43,Governance: Organization,50406,56617,107023,0.47098288,M,2,Fail,0,201000045,50406,56617,107023,0.47098288,2,Fail,70,40
201000048,2010,55,1,TUOLUMNE,2010-06-08,Tuolumne,2,M,A,"Shall Ordinance No. 3106, which amends Chapter 3.32 of the Tuolumne County Ordinance Code to increase the Transient Occupancy Tax rate from eight percent (8%) to ten percent (10%), be adopted?",5,5,Utility Tax,112,112,Revenues: Tax Creation/Incr./Contin.,8085,6524,14609,0.55342597,M,1,Pass,0,201000046,8085,6524,14609,0.55342597,1,Pass,1,110
