MeasID,YEAR,CO#,JUR,CNTYNAME,DATE,PLACE,CSD,MEASTYPE,LTR,BALQUEST,RECTYPE,RECTYPENAME,RECTOPIC,RECTOPICNAME,YES,NO,TOTAL,PERCENT,REQ,OUTCOME,PASSFAIL,Multi_CO,Multi_MeasID,YES_sum,NO_sum,Total_sum,Percent_sum,Outcome_sum,Passfail_sum,typerec,topcrec,OTH
201300135,2013,44,3,SANTA CRUZ,2013-11-05,Loma Prieta Joint Union,0,M,H,"To support high academic achievement for local students and provide stable local funding to maintain outstanding core academic programs in reading, writing, math, and science, retain highly qualified and experienced teachers, and prepare students for an excellent high school shall the Loma Prieta Joint Union Elementary School District authorize an annual school parcel tax of $164 per parcel for seven years with independent citizens’ oversight, an exemption for seniors, no funds for administrator’s salaries and every dollar staying in our schools?",3,Property Tax,10,Education,983,319,1302,0.755,T,1,PassT,1,201300131,1224,389,1613,0.7588344699318041,1,PassT,1,10,
201300132,2013,43,3,SANTA CLARA,2013-11-05,Sunnyvale Elementary,0,M,G,"To continue critical renovation, modernization and safety needs at the district’s schools and to make needed upgrades to classrooms, libraries, science and computer labs, improve student access to computers and instructional technology and continue to improve the energy efficiency of classrooms and buildings, shall the Sunnyvale School District issue $96,000,000 in bonds at legal interest rates with funds monitored by an Independent Citizens’ Oversight Committee and no funds spent on administrators?",11,GO Bond,11,Education: Bonds,6995,3225,10220,0.684,F,1,PassF,0,201300132,6995,3225,10220,0.6844422700587084,1,PassF,10,10,
201300134,2013,44,3,SANTA CRUZ,2013-05-07,Soquel Union Elementary,0,M,S,"To provide stable funding for New Brighton Middle, Main Street, Opal Cliffs, Santa Cruz Gardens and Soquel Elementary for academic programs in reading, writing, math and science, attracting and retaining quality teachers, smaller class sizes, school libraries/librarians, maintaining art and music programs, shall Soquel Union Elementary School District levy an education tax of $90 per parcel for eight years with citizen oversight, exempting senior citizens, no funds for administrators’ salaries, and all funds staying local?",3,Property Tax,10,Education,4116,2648,6764,0.609,T,2,FailT,0,201300133,4116,2648,6764,0.6085156712004731,2,FailT,1,10,
201300136,2013,54,3,TULARE,2013-04-09,Stone Corral Elementary,0,R,1,Shall Reynold Esquivel be recalled (removed) from the office of Governing Board Member?,50,Recall,13,Education: Recall,69,31,100,0.69,M,1,Pass,0,201300134,69,31,100,0.69,1,Pass,50,10,
201300137,2013,54,3,TULARE,2013-04-09,Stone Corral Elementary,0,R,2,Shall Rebecca Quintana be recalled (removed) from the office of Governing Board Member?,50,Recall,13,Education: Recall,66,34,100,0.66,M,1,Pass,0,201300135,66,34,100,0.66,1,Pass,50,10,
