MeasID,YEAR,CO,JUR,CNTYNAME,DATE,PLACE,CSD,MEASTYPE,LTR,BALQUEST,Orig_TYPE,RECTYPE,RECTYPENAME,Orig_TOPIC,RECTOPIC,RECTOPNAME,YES,NO,TOTAL,PERCENT,REQ,OUTCOME,PASSFAIL,Multi_CO,Multi_MeasID,YES_sum,NO_sum,Total_sum,Percent_sum,Outcome_sum,Passfail_sum,typerec,topicrec,OTH
201100039,2011,21,3,Marin,2011-05-03,Dixie Elementary,2,M,A,"To protect local elementary and middle schools, minimize the impact of state budget cuts, maintain stable local funding the State can't take away, and preserve quality education by: Retaining qualified teachers; Emphasizing reading, writing and math skills; Providing instructional materials for science programs; and Keeping school libraries open, Shall Dixie School District increase its expiring school parcel tax by $107 per parcel for 8 years, with exemptions for seniors, independent oversight/audits and all funds staying local?",3,3,Property Tax,10,10,Education,5843,1449,7292,0.801289,T,1,PassT,0,201100037,5843,1449,7292,0.801289,1,PassT,1,10,0
201100040,2011,41,3,San Mateo,2011-05-03,San Carlos,2,M,A,"To protect quality education for San Carlos elementary and middle school students; maintain educational programs including math, reading, and writing, and hands-on science instruction; attract and retain qualified teachers; maintain art and music classes, and keep school libraries open, shall San Carlos School District replace an expiring local school funding measure by extending --- without increasing --- the current tax rate of $110.60 per parcel per year for eight years, with citizen oversight and an exemption for seniors?",3,3,Property Tax,10,10,Education,6373,1451,7824,0.814545,T,1,PassT,0,201100038,6373,1451,7824,0.814545,1,PassT,1,10,0
201100041,2011,41,3,San Mateo,2011-05-03,Ravenswood,2,M,B,"To improve local elementary students' reading, writing, math, computer/technology, and other educational programs; increase safety for our children; maintain reduced class sizes; attract and retain highly qualified staff, shall the Ravenswood City School District levy a parcel tax of $98 for seven (7) years and extend the current parcel tax for the same seven-year period; with exemptions for seniors aged 65 and older; and within the District's total legal appropriations limit?",3,3,Property Tax,10,10,Education,782,370,1152,0.678819,T,1,PassT,0,201100039,782,370,1152,0.678819,1,PassT,1,10,0
201100042,2011,41,3,San Mateo,2011-05-03,Jefferson Union High,2,M,C,"To maintain/improve academic programs, including reading, writing, science, and math; retain highly qualified teachers; and fund computer technology, vocational training, adult education, arts and athletics at Jefferson, Oceana, Terra Nova, Thornton, and Westmoor High Schools; shall Jefferson Union High School District levy $96 per parcel annually for four years with senior exemptions, no money for administrators' salaries, independent community oversight, and all funds used for neighborhood schools and not taken by the State?",3,3,Property Tax,10,10,Education,8733,5859,14592,0.598479,T,2,FailT,0,201100040,8733,5859,14592,0.598479,2,FailT,1,10,0
201100043,2011,41,1,San Mateo,2011-05-03,Pacific Parc Territory,2,M,D,"Shall the Pacific Parc territory, which currently consists of twenty-five (25) parcels located at 600 Willow Road in Menlo Park, California, be transferred from the Ravenswood City School District to the Menlo Park City School District, such that by operation of law, persons residing within the subject territory would be considered residents of the Menlo Park City School District effective July 1, 2012?",70,70,Ordinance,12,12,Education: Districts,34,1,35,0.971429,M,1,Pass,0,201100041,34,1,35,0.971429,1,Pass,70,10,0
201100045,2011,43,3,Santa Clara,2011-05-03,Sunnyvale Elementary,2,M,B,"To support and maintain classroom programs including math, English, science and technology; to minimize the loss of teaching positions and to minimize increases in class size; shall the Sunnyvale School District be authorized to collect a qualified special tax at an annual cost of $59 per parcel for seven years beginning July 1, 2011, with all expenditures audited and reviewed by a citizens’ oversight committee, offering a senior exemption with no funds spent on administrators?",3,3,Property Tax,10,10,Education,7640,3321,10961,0.697017,T,1,PassT,0,201100043,7640,3321,10961,0.697017,1,PassT,1,10,0
201100046,2011,43,3,Santa Clara,2011-05-03,Cupertino Union Elementary,2,M,C,"Quality Local Schools and Academic Excellence Measure. To provide stable funding that the State cannot take away, protect outstanding core academic programs in reading, writing, math and science, retain highly qualified teachers, provide updated technology and keep libraries open, shall Cupertino Union School District be authorized to levy $125 per parcel annually for six years with citizen oversight, no funds for administrators’ salaries, an exemption available for seniors and all funds staying in our local schools?",3,3,Property Tax,10,10,Education,20122,8598,28720,0.700627,T,1,PassT,0,201100044,20122,8598,28720,0.700627,1,PassT,1,10,0
201100047,2011,43,3,Santa Clara,2011-05-03,Los Altos Elementary,2,M,E,"To protect excellent education in Los Altos elementary and Junior high schools; preserve core academic programs in reading, writing, math and science; retain highly qualified teachers; and provide books and classroom materials, shall Los Altos School District levy an annual education parcel tax of $193 per parcel for six years, with independent citizen oversight, no funds for administrators’ salaries, an exemption for senior citizens, and al funds used only for support of local elementary and junior high schools?",3,3,Property Tax,10,10,Education,9187,4512,13699,0.670633,T,1,PassT,0,201100045,9187,4512,13699,0.670633,1,PassT,1,10,0
201100049,2011,57,3,Yolo,2011-05-03,Davis Joint Unified,2,M,A,"Recognizing cuts in state funding, shall the Davis Joint Unified School District be authorized to levy an emergency special tax for a period of two years not to exceed the annual rate of $20.00 per dwelling unit for multi-dwelling parcels and $200.00 per parcel for all other parcels, to fund essential school programs including core subjects, elective classes, reduced class sizes, counselors and school site safety?",3,3,Property Tax,10,10,Education,11073,5403,16476,0.672068,T,1,PassT,0,201100046,11073,5403,16476,0.672068,1,PassT,1,10,0
201100050,2011,4,2,Butte,2011-06-07,Chico,2,M,A,"Shall Section 500 of the City Charter, which now provides that general municipal elections shall take place in November of each even-numbered year, be amended to provide that general municipal elections shall, instead, take place in June of each even-numbered year?",20,20,Charter Amendment,48,48,Governance: Elections,5244,10980,16224,0.323225,M,2,Fail,0,201100047,5244,10980,16224,0.323225,2,Fail,20,40,0
201100051,2011,7,2,Contra Costa,2011-06-07,Hercules,2,R,1,Shall Joanne Ward be recalled (removed) from the office of City Council?,50,50,Recall,46,46,Governance: Recall,3293,476,3769,0.873707,M,1,Pass,0,201100048,3293,476,3769,0.873707,1,Pass,50,40,0
201100052,2011,7,2,Contra Costa,2011-06-07,Hercules,2,R,2,Shall Don Kuehne be recalled (removed) from the office of City Council?,50,50,Recall,46,46,Governance: Recall,3004,739,3743,0.802565,M,1,Pass,0,201100049,3004,739,3743,0.802565,1,Pass,50,40,0
201100053,2011,7,2,Contra Costa,2011-06-07,Richmond,2,A,C,"(ADVISORY) Should the proceeds of any tax imposed pursuant to the City of Richmond sales tax of 2011 (also on this ballot) be spent one-half on Richmond programs to restore services to the poor that have been cut due to State takeaways, and one-half on School District programs in Richmond to restore educational services and programs that have been eliminated due to State takeaways?",30,30,Advisory,110,110,Revenues,4798,3635,8433,0.568955,M,1,Pass,0,201100050,4798,3635,8433,0.568955,1,Pass,30,110,0
201100054,2011,7,2,Contra Costa,2011-06-07,Richmond,2,M,D,Shall a ½ percent sales tax in the City of Richmond be approved?,4,4,Sales Tax,112,112,Revenues: Tax Creation/Incr./Contin.,3673,4781,8454,0.434469,M,2,Fail,0,201100051,3673,4781,8454,0.434469,2,Fail,1,110,0
201100055,2011,7,1,Contra Costa,2011-06-07,"Kensington, Police Protection and CSD",1,M,E,"Shall the appropriations limit of the Kensington Police Protection and Community Services District for Fiscal Year 2011-2012 be established at $3,305,662.00 and should the limit for that Fiscal Year (i.e., $3,305,662.00) be used to determine the limits for Fiscal Years 2012-2013 through 2014-2015?",60,60,Gann Limit,110,110,Revenues,1034,111,1145,0.903057,M,1,Pass,0,201100052,1034,111,1145,0.903057,1,Pass,60,110,0
201100056,2011,7,1,Contra Costa,2011-06-07,R-7A CSA,1,M,F,"Shall the appropriations limit under California Article XIII-B for County Service Area R-7A (Alamo Parks and Recreation) be increased to $1,650,000 and adjusted for changes in the cost-of-living and population, with the increase effective for the Fiscal Years 2010/2011 through 2013/2014 (inclusive) to provide for the expenditure of funds that will be available to the County Service Area during the stated fiscal years?",60,60,Gann Limit,110,110,Revenues,2153,499,2652,0.81184,M,1,Pass,0,201100053,2153,499,2652,0.81184,1,Pass,60,110,0
201100057,2011,30,2,Orange,2011-06-07,San Juan Capistrano,2,M,B,"Shall Resolution 10-11-02-02 approving a general plan amendment redesignating the 9.1 acre westerly portion of the Distrito La Novia site from ""Specific Plan"" to ""Planned Community"" and establishing land uses for the 153.8 acre Distrito La Novia-San Juan Meadows Planned Community located east of Valle Road at 7% general commercial, 3% high density residential, 44% open space recreation, 28% low density residential, and 18% natural open space, be approved?",70,70,Ordinance,22,22,Land Use: Zoning,3723,2946,6669,0.558255,M,1,Pass,0,201100054,3723,2946,6669,0.558255,1,Pass,70,20,0
201100058,2011,33,2,Riverside,2011-06-07,Menifee,2,M,C,"Shall the ordinance proposing adoption of a specific plan for commercial development of approximately 30 acres of undeveloped property located near the northwesterly portion of the interstate 215 interchange with Scott Road, be adopted?",70,70,Ordinance,22,22,Land Use: Zoning,8406,2592,10998,0.764321,M,1,Pass,0,201100055,8406,2592,10998,0.764321,1,Pass,70,20,0
201100059,2011,33,2,Riverside,2011-06-07,Wildomar,2,M,D,Shall Community Facilities District 2011-1 (Wildomar Parks) of the City of Wildomar be formed and authorized to levy a Special Tax at a maximum rate of $28 per benefit unit to provide park maintenance services?,3,3,Property Tax,105,105,General Services: Maintenance,2332,1828,4160,0.560577,T,2,FailT,0,201100056,2332,1828,4160,0.560577,2,FailT,1,100,0
201100060,2011,33,2,Riverside,2011-06-07,Canyon Lake,2,M,E,Shall Ordinance No. 133 enacting a special parcel tax to fund the continuation of existing police and fire protection services in the City of Canyon Lake be adopted?,3,3,Property Tax,34,34,Safety: Multiple Emergency Services,777,1274,2051,0.37884,T,2,FailT,0,201100057,777,1274,2051,0.37884,2,FailT,1,30,0
201100061,2011,35,3,San Benito,2011-06-07,Hollister Elementary,2,M,A,"To maintain and improve academic programs including reading, writing, science and math; improve student access to computer labs and technology; help keep school libraries open and minimize future classroom overcrowding; shall Hollister School District levy $96 per parcel annually for four years (see voter pamphlet) with senior exemptions, no money for administrators' salaries, independent community oversight, and all funds used for neighborhood schools and not taken by the State?",3,3,Property Tax,10,10,Education,2724,2539,5263,0.517576,T,2,FailT,0,201100058,2724,2539,5263,0.517576,2,FailT,1,10,0
201100062,2011,47,2,Siskiyou,2011-06-07,Mt. Shasta,2,M,H,"Shall the City of Mt. Shasta adopt an Ordinance adding Chapter 3.45 “Transactions and Use Tax – Libraries” to Title 3 of the Mt. Shasta Municipal Code, imposing a .25% Transactions and Use Tax to fund library operations of the Mt. Shasta Branch Library?",4,4,Sales Tax,71,71,Facilities: Libraries,635,201,836,0.759569,T,1,PassT,0,201100059,635,201,836,0.759569,1,PassT,1,70,0
201100063,2011,48,2,Solano,2011-06-07,Rio Vista,2,M,A,Shall an ordinance amending the Rio Vista Municipal Code to reduce water and wastewater rates be adopted?,70,70,Ordinance,104,104,General Services: Water,1123,1383,2506,0.448125,M,2,Fail,0,201100060,1123,1383,2506,0.448125,2,Fail,70,100,0
201100064,2011,36,3,San Bernardino,2011-06-21,Fontana Unified,2,M,E,"To maintain and improve academic programs including reading, writing, science and math; improve student access to computer labs and technology; retain teachers and counselors; help keep school libraries open and minimize future classroom overcrowding; shall Fontana Unified School District levy $96 per parcel annually for four years (see voter pamphlet) with senior exemptions, no money for administrators’ salaries, independent community oversight, and all funds used for neighborhood schools and not taken by the State?",3,3,Property Tax,10,10,Education,4153,3820,7973,0.520883,T,2,FailT,0,201100061,4153,3820,7973,0.520883,2,FailT,1,10,0
201100065,2011,57,3,Yolo,2011-07-12,Esparto Unified,2,M,B,"In order to reduce the impact of State budget cuts and provide financial stability for the Esparto Unified School District, shall the District be authorized to levy a parcel tax of $100 per parcel for five years, adjusted for inflation, for purposes of supporting student transportation, athletics, and core and elective academic programs? Parcel tax funds will not be spent on administrator salaries and will be audited annually by independent CPA’s as required by law.",3,3,Property Tax,10,10,Education,286,671,957,0.298851,T,2,FailT,0,201100062,286,671,957,0.298851,2,FailT,1,10,0
201100066,2011,12,1,Humboldt,2011-08-30,Scotia CSD - Proposed,1,M,T,"Shall the action taken on October 13,2010, by the Local Agency Formation Commission of Humboldt County by adoption of Resolution No. 10-09, thereby ordering the formation of the Scotia Community Services District in the territory described, subject to the terms and conditions specified in that resolution, be approved?",70,70,Ordinance,44,44,Governance: Incorporation/Formation/Annexation,140,9,149,0.939597,M,1,Pass,0,201100063,140,9,149,0.939597,1,Pass,70,40,0
201100067,2011,23,2,Mendocino,2011-08-30,Point Arena,2,R,1,Shall Riboli be recalled (removed) from the office of City Councilmember?,50,50,Recall,46,46,Governance: Recall,92,58,150,0.613333,M,1,Pass,0,201100064,92,58,150,0.613333,1,Pass,50,40,0
201100068,2011,23,2,Mendocino,2011-08-30,Point Arena,2,R,2,Shall Oropeza be recalled (removed) from the office of City Councilmember?,50,50,Recall,46,46,Governance: Recall,75,73,148,0.506757,M,1,Pass,0,201100065,75,73,148,0.506757,1,Pass,50,40,0
201100069,2011,23,2,Mendocino,2011-08-30,Point Arena,2,R,3,Shall Sinnott be recalled (removed) from the office of City Councilmember?,50,50,Recall,46,46,Governance: Recall,98,52,150,0.653333,M,1,Pass,0,201100066,98,52,150,0.653333,1,Pass,50,40,0
201100070,2011,23,2,Mendocino,2011-08-30,Point Arena,2,R,4,Shall Ingham be recalled (removed) from the office of City Councilmember?,50,50,Recall,46,46,Governance: Recall,85,63,148,0.574324,M,1,Pass,0,201100067,85,63,148,0.574324,1,Pass,50,40,0
201100071,2011,36,1,San Bernardino,2011-08-30,Lake Arrowhead CSD,1,A,1,(ADVISORY) Shall the mailed ballot be used to conduct all future general district elections?,30,30,Advisory,48,48,Governance: Elections,1910,147,2057,0.928537,M,1,Pass,0,201100068,1910,147,2057,0.928537,1,Pass,30,40,0
201100072,2011,40,2,San Luis Obispo,2011-08-30,San Luis Obispo,2,M,A-11,"Shall Section 1105 (Retirement) of the San Luis Obispo Charter, which authorizes the City Council to enter into a contract with the Board of Administration of the Public Employees' Retirement System (PERS), be amended to provide that the City Council may terminate or amend its contract or negotiate another contract to provide improved or reduced employee benefits only in accordance with state law and as permitted by the Board of Administration of PERS?",20,20,Charter Amendment,42,42,Governance: Personnel/Labor Relations,7848,2764,10612,0.73954,M,1,Pass,0,201100069,7848,2764,10612,0.73954,1,Pass,20,40,0
201100073,2011,40,2,San Luis Obispo,2011-08-30,San Luis Obispo,2,M,B-11,"Shall San Luis Obispo Charter Section 1107 (""Impartial and Binding Arbitration and San Luis Obispo Firefighters Association, IAFF Local 3523, Employee Disputes"") be repealed in its entirety, leaving resolution of disputes over wages, hours, or working conditions, which remain unresolved after good faith negotiations between the City and the two covered organizations, subject to the same State law procedures for impasse resolution that govern other public employee organizations?",20,20,Charter Amendment,42,42,Governance: Personnel/Labor Relations,7723,2905,10628,0.726665,M,1,Pass,0,201100070,7723,2905,10628,0.726665,1,Pass,20,40,0
201100074,2011,49,3,Sonoma,2011-08-30,Kenwood Elementary,2,M,A,"To preserve quality education despite inadequate state funding and prevent further program cuts, shall the Kenwood School District renew - without increasing - the existing school parcel tax of $52.00 per year for a period of five years, beginning July 1, 2012, with certain specific exemptions as set forth in the Resolution and Order of Election? Funds to be used for maintaining and enhancing core programs and essential enrichment programs and continuing our commitment to small class sizes.",3,3,Property Tax,10,10,Education,1388,326,1714,0.809802,T,1,PassT,0,201100071,1388,326,1714,0.809802,1,PassT,1,10,0
201100100,2011,19,3,Los Angeles,2011-11-08,Las Virgenes Unified,2,M,K,"To provide local school funding that cannot be taken by state government; retain high-quality teachers; preserve smaller class sizes; minimize teacher layoffs; and protect academic opportunities and high achievement in science, math, reading and the arts; shall the Las Virgenes Unified School District establish a local parcel tax of $95 annually for eight years, with exemptions for seniors, independent fiscal oversight, no funds for administrator salaries, and guaranteeing every dollar stays within our community preserving quality education?",3,3,Property Tax,10,10,Education,4290,3290,7580,0.565963,T,2,FailT,1,201100097,4460,3408,7868,0.566853,2,FailT,1,10,0
201100162,2011,56,3,Ventura,2011-11-08,Las Virgenes Unified,2,M,K,"To provide local school funding that cannot be taken by state government; retain high-quality teachers; preserve smaller class sizes; minimize teacher layoffs; and protect academic opportunities and high achievement in science, math, reading and the arts; shall Las Virgenes Unified School District serving Bell Canyon establish a parcel tax of $95 annually for eight years, exempting seniors, and guaranteeing independent fiscal oversight, no funds for administrators, and every dollar to local schools preserving quality education?",3,3,Property Tax,10,10,Education,170,118,288,0.590278,T,2,FailT,1,201100097,4460,3408,7868,0.566853,2,FailT,1,10,0
201100075,2011,1,2,Alameda,2011-11-08,Emeryville,2,M,C,"To maintain the high quality of life in Emeryville and fund essential services including police, fire, 9-1-1, park maintenance, litter abatement, graffiti removal, flood protection, street maintenance, accessibility improvements, child care, senior and recreation programs, shall an ordinance be adopted that increases the business tax rate to 0.10% of gross receipts, amends the definition of gross receipts and makes other clarifications?",2,2,Gasoline Tax,112,112,Revenues: Tax Creation/Incr./Contin.,1111,236,1347,0.824796,M,1,Pass,0,201100072,1111,236,1347,0.824796,1,Pass,1,110,0
201100076,2011,1,2,Alameda,2011-11-08,Emeryville,2,M,D,"To maintain the high quality of life in Emeryville and fund essential services including police, fire, 9-1-1, park maintenance, litter abatement, graffiti removal, flood protection, street maintenance, accessibility improvements, child care, senior and recreation programs, shall an ordinance be adopted that increases the limit on the maximum annual business tax that businesses pay?",2,2,Gasoline Tax,112,112,Revenues: Tax Creation/Incr./Contin.,1080,262,1342,0.804769,M,1,Pass,0,201100073,1080,262,1342,0.804769,1,Pass,1,110,0
201100077,2011,1,2,Alameda,2011-11-08,Emeryville,2,M,F,(INITIATIVE) Shall an initiative ordinance be enacted that amends Emeryville Municipal Code Section 2-1.302 to prohibit the Emeryville City Council from employing a City Attorney and subordinate employees in the City Attorney's Office and require the City Council by contract to designate a City Attorney or law firm to act as City Attorney?,40,40,Initiative,43,43,Governance: Organization,448,840,1288,0.347826,M,2,Fail,0,201100074,448,840,1288,0.347826,2,Fail,40,40,0
201100078,2011,1,3,Alameda,2011-11-08,Newark Unified,2,M,G,"To preserve quality education, provide safe and modern schools, and qualify for matching funds, shall Newark Unified School District update aging classrooms, libraries, and science labs to meet earthquake/fire/safety standards; improve access for students with disabilities, remove asbestos, lead and hazardous materials; and improve energy/operational efficiency to maximize funding for instructional programs; by issuing $63 million in bonds at legal rates, with independent oversight, no money for administrators' salaries, and all funds staying in Newark?",11,11,GO Bond,11,11,Education: Bonds,3286,2592,5878,0.559034,F,1,PassF,0,201100075,3286,2592,5878,0.559034,1,PassF,10,10,0
201100079,2011,7,2,Contra Costa,2011-11-08,Lafayette,2,M,G,"Shall the City of Lafayette be authorized to collect a parcel tax not to exceed $89 per year per equivalent residential unit for ten years, with the purpose to complete Lafayette’s road and drain reconstruction program and bring all failed public streets to a good quality, with a volunteer Oversight Committee reviewing expenditures annually to ensure conformance with the ballot measure, and with the tax terminating if the work is finished in less than ten years?",3,3,Property Tax,62,62,Transport: Roads,3683,2708,6391,0.576279,T,2,FailT,0,201100076,3683,2708,6391,0.576279,2,FailT,1,60,0
201100080,2011,7,2,Contra Costa,2011-11-08,Pittsburg,2,M,H,"To provide for and maintain the City’s programs and services, including youth facilities, police services, park and recreational facilities; city streets, and other city purposes, shall an ordinance be adopted increasing the transient occupancy tax, which is a general tax charged on persons renting hotel rooms, from 8 percent to a maximum of 12 percent and eliminating the tax exemption for federal and state employees traveling on official business?",9,9,Transient Occupancy Tax,112,112,Revenues: Tax Creation/Incr./Contin.,4264,1217,5481,0.77796,M,1,Pass,0,201100077,4264,1217,5481,0.77796,1,Pass,1,110,0
201100081,2011,7,2,Contra Costa,2011-11-08,Pittsburg,2,M,I,"To protect certain vacant land from development in the City of Antioch, shall an ordinance be adopted amending the City of Pittsburg's General Plan, amending the previously approved Urban Limit Line to include approximately 193.60 acres in City's southeast area; prezoning land within the amended Urban Limit Line to single family residential, high density residential and general industrial; and allowing for over three dwelling units an acre in residential development south of Buchanan Road?",70,70,Ordinance,21,21,Land Use: Growth Cap/Boundary,4361,1151,5512,0.791183,M,1,Pass,0,201100078,4361,1151,5512,0.791183,1,Pass,70,20,0
201100082,2011,10,1,Fresno,2011-11-08,Biola CSD,1,R,1,Shall Alfonso Rabago be recalled as board member; Biola Community Services District?,50,50,Recall,46,46,Governance: Recall,110,14,124,0.887097,M,1,Pass,0,201100079,110,14,124,0.887097,1,Pass,50,40,0
201100083,2011,10,3,Fresno,2011-11-08,Parlier Unified,2,R,1,Shall Mary Villanueva be recalled as board member; Parlier Unified School District?,50,50,Recall,13,13,Education: Recall,421,591,1012,0.416008,M,2,Fail,0,201100080,421,591,1012,0.416008,2,Fail,50,10,0
201100084,2011,10,1,Fresno,2011-11-08,Biola CSD,1,R,2,Shall Bibiana Rabago be recalled as board member; Biola Community Services District?,50,50,Recall,46,46,Governance: Recall,113,13,126,0.896825,M,1,Pass,0,201100081,113,13,126,0.896825,1,Pass,50,40,0
201100085,2011,10,3,Fresno,2011-11-08,Parlier Unified,2,R,2,Shall Enrique Maldonado be recalled as board member; Parlier Unified School District?,50,50,Recall,13,13,Education: Recall,416,590,1006,0.413519,M,2,Fail,0,201100082,416,590,1006,0.413519,2,Fail,50,10,0
201100086,2011,10,3,Fresno,2011-11-08,Parlier Unified,2,R,3,Shall David Torrez be recalled as board member; Parlier Unified School District?,50,50,Recall,13,13,Education: Recall,404,604,1008,0.400794,M,2,Fail,0,201100083,404,604,1008,0.400794,2,Fail,50,10,0
201100087,2011,10,3,Fresno,2011-11-08,Parlier Unified,2,R,4,Shall Melissa Cano be recalled as board member; Parlier Unified School District?,50,50,Recall,13,13,Education: Recall,408,602,1010,0.40396,M,2,Fail,0,201100084,408,602,1010,0.40396,2,Fail,50,10,0
201100088,2011,12,3,Humboldt,2011-11-08,Fortuna Union Elementary and Rohnerville Elementary,2,M,U,Proposed reorganization of Fortuna Union Elementary School District and Rohnerville School District.,70,70,Ordinance,12,12,Education: Districts,1226,1134,2360,0.519492,M,1,Pass,0,201100085,1226,1134,2360,0.519492,1,Pass,70,10,0
