MeasID,YEAR,CO,JUR,CNTYNAME,DATE,PLACE,CSD,MEASTYPE,LTR,BALQUEST,Orig_TYPE,RECTYPE,RECTYPENAME,Orig_TOPIC,RECTOPIC,RECTOPNAME,YES,NO,TOTAL,PERCENT,REQ,OUTCOME,PASSFAIL,Multi_CO,Multi_MeasID,YES_sum,NO_sum,Total_sum,Percent_sum,Outcome_sum,passfail_sum,typerec,topicrec
201000233,2010,19,2,LOS ANGELES,2010-11-02,Long Beach,2,M,B,"To protect public safety services such as 911 emergency response, police and fire, as well as essential quality of life programs like parks, libraries, public works and infrastructure, should the City of Long Beach impose a 15% tax on recreational marijuana businesses if legalized, with a $25 tax on cultivation sites per square foot, with an annual CPI adjustment?",2,2,Business Tax,112,112,Revenues: Tax Creation/Incr./Contin.,74781,27965,102746,0.727824,M,1,Pass,0,201000227,74781,27965,102746,0.727824,1,Pass,1,110
201000234,2010,19,2,LOS ANGELES,2010-11-02,Long Beach,2,M,C,"Shall Proposition C, which amends the Long Beach City Charter by increasing the credits given to disabled veterans in the hiring process, be ratified?",20,20,Charter Amendment,42,42,Governance: Personnel/Labor Relations,65388,30397,95785,0.68265384,M,1,Pass,0,201000228,65388,30397,95785,0.68265384,1,Pass,20,40
201000235,2010,19,2,LOS ANGELES,2010-11-02,Long Beach,2,M,D,"Shall Proposition D, which amends the Long Beach City Charter by changing the formula from 10% of net income to 5% of gross operating revenues in order to clarify the formula for the transfer of funds from Harbor Department revenues to the Tidelands Operating Fund, and clarifying that the management of the City's oil properties and subsidence control operations are under the exclusive control of the City Council, be ratified?",20,20,Charter Amendment,110,110,Revenues,49993,39947,89940,0.55584836,M,1,Pass,0,201000229,49993,39947,89940,0.55584836,1,Pass,20,110
201000236,2010,19,2,LOS ANGELES,2010-11-02,Long Beach,2,M,GG,"Shall Proposition GG which amends the Long Beach City Charter by transferring certain powers from the Civil Service Commision to the City Manager, including examination and certification for employment, classification creation, maintenance of eligibility lists, and the appointment management of a professional staff, be ratified?",20,20,Charter Amendment,43,43,Governance: Organization,42975,49044,92019,0.4670231,M,2,Fail,0,201000230,42975,49044,92019,0.4670231,2,Fail,20,40
201000237,2010,19,2,LOS ANGELES,2010-11-02,Pomona,2,M,SP,"Shall an ordinance be adopted to increase Pomona's Utility Users' Tax by (2%) for an initial period of 26 months, to fund general city services, including police, fire, street repair, parks, recreation and library programs; suspend the increase following the 26 month period, unless the Pomona City Council overrides the suspension by a 6/7ths vote; and provide a UUT payment exemption for the legally disabled?",5,5,Utility Tax,112,112,Revenues: Tax Creation/Incr./Contin.,5910,16060,21970,0.26900318,M,2,Fail,0,201000231,5910,16060,21970,0.26900318,2,Fail,1,110
201000238,2010,19,2,LOS ANGELES,2010-11-02,Ranch Palos Verdes,2,M,P,"Shall an ordinance be adopted that would enact a new specific plan and related amendments to the City of Rancho Palos Verdes (""City"") general plan and zoning ordinance to: (1) allow development of specified facility improvements, including dormitories, on the Marymount College Campus (""Campus"") located at 30800 Palos Verdes Drive East; (2) govern the operation of the Campus, and (3) supersede inconsistent provisions of the Municipal Code and prior City land use decisions regarding the Campus?",70,70,Ordinance,20,20,Land Use,8117,9686,17803,0.4559344,M,2,Fail,0,201000232,8117,9686,17803,0.4559344,2,Fail,70,20
201000239,2010,19,2,LOS ANGELES,2010-11-02,Redondo Beach,2,M,G,"Shall the Coastal Land Use Plan and the Zoning Ordinance for the Coastal Zone (""Coastal Zoning Ordinance"") for the AES Power Plant site, the Catalina Avenue corridor and the Harbor/Pier areas of the City of Redondo Beach be amended to provide for major changes in existing policies and development standards including changes in permitted uses, adoption of height limitations, floor-area-ratio (FAR) limitations and other development policies and standards?",70,70,Ordinance,22,22,Land Use: Zoning,12622,11422,24044,0.52495426,M,1,Pass,0,201000233,12622,11422,24044,0.52495426,1,Pass,70,20
201000240,2010,19,2,LOS ANGELES,2010-11-02,Santa Fe Springs,2,M,S,"To maintain funding for City services including police officers, firefighters, paramedics, senior programs, youth/gang, drug, and crime prevention programs, street repairs, parks, ball fields, afterschool library programs, community centers and other City services, shall an ordinance be adopted to establish a 5% utility users tax, exempting low income seniors/residents, with annual audits, no tax increase without voter approval and no funds for Sacramento?",5,5,Utility Tax,112,112,Revenues: Tax Creation/Incr./Contin.,2462,1594,4056,0.60700196,M,1,Pass,0,201000234,2462,1594,4056,0.60700196,1,Pass,1,110
201000241,2010,19,2,LOS ANGELES,2010-11-02,Santa Monica,2,M,RR,"Shall the City Charter be amended to protect all tenants and preserve community stability and diversity by adding requirements that a landlord show good cause to evict any tenant and serve a warning notice giving reasonable time to correct a rental agreement violation, except nonpayment of rent, and adding a prohibition against evicting long-term elderly, disabled or terminally ill tenants for owner occupancy unless the proposed owner-occupant is also elderly, disabled or terminally ill?",20,20,Charter Amendment,80,80,Housing,19897,10544,30441,0.6536251,M,1,Pass,0,201000235,19897,10544,30441,0.6536251,1,Pass,20,80
201000242,2010,19,2,LOS ANGELES,2010-11-02,Santa Monica,2,M,Y," Shall an ordinance be adopted to offset severe state budget cuts, protect and stabilize City finances, and maintain essential services including: police, fire, paramedic and emergency 911 response, school, educational and afterschool programs, public transit, services for the disabled, gang and drug prevention programs, enviromental, library and other general fund services, by enacting a City of Santa Monica ½ percent transactions and use tax, subject to independent annual audits, and no money going to Sacramento?",4,4,Sales Tax,112,112,Revenues: Tax Creation/Incr./Contin.,20046,12698,32744,0.6122038,M,1,Pass,0,201000236,20046,12698,32744,0.6122038,1,Pass,1,110
201000243,2010,19,2,LOS ANGELES,2010-11-02,Santa Monica,2,M,YY,"(ADVISORY) If a local transactions and use tax is enacted in the City of Santa Monica, should half of its revenue be used to support school, educational and afterschool programs, with half of its revenue being used for general City services such as: police, fire, paramedic and emegency 911 response, public transit, services for the disabled, gang and drug prevention programs, enviromental, library and other general fund services?",30,30,Advisory,112,112,Revenues: Tax Creation/Incr./Contin.,22077,10266,32343,0.68258977,M,1,Pass,0,201000237,22077,10266,32343,0.68258977,1,Pass,30,110
201000244,2010,19,2,LOS ANGELES,2010-11-02,South El Monte,2,M,R,"To offset severe state budget cuts and prevent drastic cuts to sheriffs' deputies patrols, pothole and street repairs, youth gang and drug prevention, after school programs, senior services, storm drain maintenance, graffiti removal, parks, recreation and general City services, shall an ordinance be adopted to enact a one-half cent transaction and use tax in the City of South El Monte, subject to annual independent audits, public expenditure reports and local use of all funds?",4,4,Sales Tax,112,112,Revenues: Tax Creation/Incr./Contin.,1573,979,2552,0.6163793,M,1,Pass,0,201000238,1573,979,2552,0.6163793,1,Pass,1,110
201000245,2010,20,2,MADERA,2010-11-02,Madera,2,M,E,"Shall members of the legislative body of the City of Madera be elected by districts described in Ordinance No. 871 C.S., and the Mayor of the City of Madera be elected on a citywide basis by the voters of the entire city?",70,70,Ordinance,48,48,Governance: Elections,6299,1699,7998,0.7875719,M,1,Pass,0,201000239,6299,1699,7998,0.7875719,1,Pass,70,40
201000246,2010,21,2,MARIN,2010-11-02,Corte Madera,2,M,C,"Shall Town of Corte Madera voters adopt an ordinance continuing a special tax for four more years for paramedic and/or emergency medical services at a rate of $60.00 per residence and $60.00 per 1,000 square feet of floor area for nonresidential uses for fiscal year 2011-2012, increasing $5.00 yearly to $75.00 per residence and $75.00 per 1,000 square feet of floor area for nonresidential uses in 2014-2015, and increasing the appropriations limit by the tax proceeds?",3,3,Property Tax,36,36,Safety: Emergency Medical/Paramedic,2689,1458,4147,0.6484206,T,2,FailT,0,201000240,2689,1458,4147,0.6484206,2,FailT,1,30
201000247,2010,21,2,MARIN,2010-11-02,Fairfax,2,M,D,"Shall there be a continuation of the special tax for paramedic services in the amount of $42.50 not exceeding $51.50 in the fourth year per taxable living unit or per 1,500 square feet of structure of each developed parcel in nonresidential use, to be collected in addition to trasport fees charged to insurance providers for Ross Valley residents, with the appropriations limit increased by the amount of said tax for the next four years?",7,7,Miscellaneous Tax,36,36,Safety: Emergency Medical/Paramedic,2855,977,3832,0.7450417,T,1,PassT,0,201000241,2855,977,3832,0.7450417,1,PassT,1,30
201000248,2010,21,2,MARIN,2010-11-02,Larkspur,2,M,E,"Shall there be a continuation of the special tax for paramedic services in the amount of $42.50 not exceeding $51.50 in the fourth year per taxable living unit or per 1,500 square feet of structure of each developed parcel in non-residential use, to be collected in addition to transport fees charged to insurance providers for Ross Valley residents, with the appropriations limit increased by the amount of said tax for the next four years?",7,7,Miscellaneous Tax,36,36,Safety: Emergency Medical/Paramedic,3855,1646,5501,0.7007817,T,1,PassT,0,201000242,3855,1646,5501,0.7007817,1,PassT,1,30
201000249,2010,21,2,MARIN,2010-11-02,Novato,2,M,F,"To offset/prevent additional budget cuts and maintain/restore vital general city services including, and not limited to: neighborhood police patrols, crime prevention programs, 9-1-1 response times; city street/pothole repair; park maintenance; preventing closure or elimination of youth and senior centers/services, shall the City of Novato enact a half-cent sales tax for 5 years, with review by a citizen committee, annual independent audits, and all funds spent locally for the benefit of Novato citizens?",4,4,Sales Tax,112,112,Revenues: Tax Creation/Incr./Contin.,11147,8018,19165,0.5816332,M,1,Pass,0,201000243,11147,8018,19165,0.5816332,1,Pass,1,110
201000250,2010,21,2,MARIN,2010-11-02,Ross,2,M,G,"Shall there be a continuation of the four year special tax for paramedic services in the amount of $42 (plus fifty cents County administrative fee) and incrementally increase if needed by $3, not to exceed $51 per year (plus fifty cent County administrative fee) per taxable living unit and per 1,500 square feet of structure developed parcel in non-residential use in the fourth year, to be collected in addition to fees for transport to the hospital charged to insurance providesr for Ross Valley residents, with the appropriations limit increased by the amount of said tax for the next four years?",7,7,Miscellaneous Tax,36,36,Safety: Emergency Medical/Paramedic,840,293,1133,0.7413945,T,1,PassT,0,201000244,840,293,1133,0.7413945,1,PassT,1,30
201000251,2010,21,2,MARIN,2010-11-02,San Anselmo,2,M,H,"Shall there be a continuation of the four year special tax for paramedic services in the amount of $42.50 not exceeding $51.50 in the fourth year per taxable living unit or per 1,500 square feet of structure of each developed parcel in non-residential use, to be collected in addition to transport fees charged to insurance providers for Ross Valley residents, with the Town appropriations limit increased by the amount of said tax for the next four years?",7,7,Miscellaneous Tax,36,36,Safety: Emergency Medical/Paramedic,4334,1645,5979,0.7248704,T,1,PassT,0,201000245,4334,1645,5979,0.7248704,1,PassT,1,30
201000252,2010,21,2,MARIN,2010-11-02,San Rafael,2,M,I,"To protect lifesaving paramedic services by maintaining rapid response times, providing advanced heart attack treatment, and keeping trained paramedics on fire engine companies, shall San Rafael Municipal Code Chapter 3.28 be amended to permit phased increases, up to $23.00 annually above the current rate, on residential units, and up to $.03 per square foot annually above the current rate on non-residential structures; and, shall San Rafael's appropriations limit be correspondingly increased?",7,7,Miscellaneous Tax,36,36,Safety: Emergency Medical/Paramedic,13588,6265,19853,0.68443054,T,1,PassT,0,201000246,13588,6265,19853,0.68443054,1,PassT,1,30
201000253,2010,27,2,MONTEREY,2010-11-02,King,2,M,O,"Shall the proposal charter for the City of King received and filed by the City Clerk on June 22, 2010 be adopted?",20,20,Charter Amendment,40,40,Governance,802,514,1316,0.6094225,M,1,Pass,0,201000247,802,514,1316,0.6094225,1,Pass,20,40
201000254,2010,27,2,MONTEREY,2010-11-02,Marina,2,M,M,"To preserve funding for general city services including but not limited to, maintaining firefighters and police officers for adequate emergency response, reducing crime and criminal gang and drug activity, maintaining city streets and parks, senior programs and youth after-school programs, shall the City of Marina adopt an ordinance enacting a temporary one percent (1%) transactions and use (sales) tax to automatically expire in five years, with all money staying locally to preserve Marina city services.",4,4,Sales Tax,112,112,Revenues: Tax Creation/Incr./Contin.,2966,1765,4731,0.62692875,M,1,Pass,0,201000248,2966,1765,4731,0.62692875,1,Pass,1,110
201000255,2010,27,2,MONTEREY,2010-11-02,Marina,2,M,N,"To preserve funding for general city services, including maintaining firefighters and police officers for adequate emergency response, reducing crime, maintaining city streets and parks, and senior and youth programs, shall the City of Marina temporarily increase the transient occupancy tax (hotel tax) rate from ten percent to twelve percent with the increase to expire in five years and tax to revert to ten percent with all money staying locally to preserve Marina city services?",9,9,Transient Occupancy Tax,112,112,Revenues: Tax Creation/Incr./Contin.,3385,1318,4703,0.7197533,M,1,Pass,0,201000249,3385,1318,4703,0.7197533,1,Pass,1,110
201000256,2010,27,2,MONTEREY,2010-11-02,Pacific Grove,2,M,Q,"Shall a new Chapter 6.70 be added to the Pacific Grove Municipal Code to impose a tax at the rate of $90.00 per year for all Owners of Parcels in the City of Pacific Grove as well as $45.00 per year per unit for multi-Common Household units, in order to create a dedicated and restricted revenue source solely to provide, maintain, and improve core library services for the Pacific Grove public library in the City of Pacific Grove such?",3,3,Property Tax,71,71,Facilities: Libraries,4109,2542,6651,0.61780185,T,2,FailT,0,201000250,4109,2542,6651,0.61780185,2,FailT,1,70
201000257,2010,27,2,MONTEREY,2010-11-02,Pacific Grove,2,M,R,"(INITIATIVE) Shall the Pacific Grove City Charter be amended to conform to the ""Voter Initiative Limiting the Ability of the City of Pacific Grove to Approve or Modify Agreements That Provide Retirement Benefits to City Employees,"" provide City officers/employees do not hold rights to future employment or future employment benefits, and amend the Pacific Grove Municipal Code to clarify that voter-approved limits relating to long-term City debt or financial liabilities apply only to retirement plans or agreements?",40,40,Initiative,42,42,Governance: Personnel/Labor Relations,4390,1572,5962,0.7363301,M,1,Pass,0,201000251,4390,1572,5962,0.7363301,1,Pass,40,40
201000258,2010,28,2,NAPA,2010-11-02,American Canyon,2,M,E,"To preserve funding for essential public services in American Canyon, including parks, recreation, police, streets and libraries, shall the City of American Canyon approve an ordinance amending the American Canyon Municipal Code to increase the rate of the City’s existing transient occupancy tax (“Hotel Visitor’s Tax”) from 10% to12% on the rate charged to hotel guests within the City?",9,9,Transient Occupancy Tax,112,112,Revenues: Tax Creation/Incr./Contin.,3660,1016,4676,0.78272027,M,1,Pass,0,201000252,3660,1016,4676,0.78272027,1,Pass,1,110
201000259,2010,28,2,NAPA,2010-11-02,American Canyon,2,M,F,"To preserve funding for essential public services in American Canyon, including parks, recreation, police, streets and libraries, shall the City of American Canyon approve an ordinance authorizing a “Cardroom Admission Tax” a new general tax in the amount of $2.00 per patron for the right or privilege of being admitted to or to use any cardroom establishment, or to participate in any cardroom event?",7,7,Miscellaneous Tax,112,112,Revenues: Tax Creation/Incr./Contin.,3493,1164,4657,0.7500537,M,1,Pass,0,201000253,3493,1164,4657,0.7500537,1,Pass,1,110
201000260,2010,28,2,NAPA,2010-11-02,Saint Helena,2,M,C,"To offset state budget cuts, stabilize City finances, and to maintain and protect essential City services; shall the City of St. Helena adopt an ordinance enacting a one half of one percent transactions and use tax, automatically expiring in five years, with citizen oversight, mandatory audits and all money staying local to preserve St. Helena city services?",4,4,Sales Tax,112,112,Revenues: Tax Creation/Incr./Contin.,884,1362,2246,0.3935886,M,2,Fail,0,201000254,884,1362,2246,0.3935886,2,Fail,1,110
201000261,2010,30,2,ORANGE,2010-11-02,Anaheim,2,M,J,Shall Section 1212 be added to the City Charter to authorize the use of design-build procurement for public works projects in the City of Anaheim?,20,20,Charter Amendment,47,47,Governance: Contracting/Bidding/Leasing,38404,21268,59672,0.6435849,M,1,Pass,0,201000255,38404,21268,59672,0.6435849,1,Pass,20,40
201000262,2010,30,2,ORANGE,2010-11-02,Anaheim,2,M,K,Shall Section 1213 be added to the City Charter to prohibit the use of red light cameras or other automated traffic enforcement systems in the City of Anaheim?,20,20,Charter Amendment,63,63,Transport: Traffic Regulation/Reduction,47246,17688,64934,0.72760034,M,1,Pass,0,201000256,47246,17688,64934,0.72760034,1,Pass,20,60
201000263,2010,30,2,ORANGE,2010-11-02,Costa Mesa,2,M,L,"Shall the City increase the existing Transient Occupancy Tax from 6% to 8%, which tax is, and will continue to be, imposed only on transients occupying hotels and motels within the City, for the funding of general city services and programs?",9,9,Transient Occupancy Tax,112,112,Revenues: Tax Creation/Incr./Contin.,14227,13048,27275,0.5216132,M,1,Pass,0,201000257,14227,13048,27275,0.5216132,1,Pass,1,110
201000264,2010,30,2,ORANGE,2010-11-02,Fullerton,2,M,M,"Shall the ordinance be adopted to enact term limits upon members of the Fullerton City Council, preventing any person who serves three (3) successive terms from serving again until an intervening period of four (4) years has elapsed?",70,70,Ordinance,45,45,Governance: Political Reform/Term Limits,27559,7077,34636,0.79567504,M,1,Pass,0,201000258,27559,7077,34636,0.79567504,1,Pass,70,40
201000265,2010,30,2,ORANGE,2010-11-02,Huntington Beach,2,M,N,"Shall proposed Charter Amendment No.1, revising and restating the Charter of the City of Huntington Beach (exculding changes to Section 617 entitled Infrastructure Fund) as set forth in the proposed measure be approved?",20,20,Charter Amendment,40,40,Governance,30084,24543,54627,0.5507167,M,1,Pass,0,201000259,30084,24543,54627,0.5507167,1,Pass,20,40
201000266,2010,30,2,ORANGE,2010-11-02,Huntington Beach,2,M,O,"Shall proposed Charter Amendment No.2, amending Section 617 of the Charter of the City of Huntington Beach entitled Infrastructure Fund, as set forth in the proposed measure be approved?",20,20,Charter Amendment,40,40,Governance,26343,31555,57898,0.45498982,M,2,Fail,0,201000260,26343,31555,57898,0.45498982,2,Fail,20,40
201000267,2010,30,2,ORANGE,2010-11-02,Huntington Beach,2,M,Q,(ADVISORY) Shall the City permit the installation of a mobile telephone antenna at Harbour View Park located at 16600 Saybrook Lane and at Bolsa View Park located at 5741 Brighton Drive?,30,30,Advisory,74,74,Facilities: Public Works,27674,35834,63508,0.43575612,M,2,Fail,0,201000261,27674,35834,63508,0.43575612,2,Fail,30,70
201000268,2010,30,2,ORANGE,2010-11-02,Irvine,2,M,R,"(INITIATIVE) Shall an ordinance be adopted to direct the City of Irvine to continue financial support to Irvine schools, through the Irvine Educational Partnership Fund and the Challenge Match Grant programs, on the same general terms and conditions and at same general levels as approved in Fiscal Year 2010-2011, for three additional fiscal years commencing with Fiscal Year 2011-2012?",40,40,Initiative,10,10,Education,40861,11415,52276,0.78163975,M,1,Pass,0,201000262,40861,11415,52276,0.78163975,1,Pass,40,10
201000269,2010,30,2,ORANGE,2010-11-02,Irvine,2,M,S,(INITIATIVE) Shall an ordinance be adopted by the City of Irvine to ratify and implement policies in support of renewable energy and environmental programs for a sustainable community?,40,40,Initiative,50,50,Environment,35239,17479,52718,0.66844344,M,1,Pass,0,201000263,35239,17479,52718,0.66844344,1,Pass,40,50
201000270,2010,30,2,ORANGE,2010-11-02,La Palma,2,M,U,"(INITIATIVE) Shall Initiative Ordinance 10-01, authorizing the City Council to annually reduce the rate of the Utility Users Tax to a lower rate than the law currently allows, be adopted?",40,40,Initiative,111,111,Revenues: Tax Repeal/Reduction/Limit,4387,391,4778,0.9181666,M,1,Pass,0,201000264,4387,391,4778,0.9181666,1,Pass,40,110
201000271,2010,30,2,ORANGE,2010-11-02,Laguna Hills,2,M,T,Shall Laguna Hills Municipal Code Section 2-04.080 be adopted to establish that any person who has served two (2) consecutive terms of office as a member of the City Council is not eligible to hold office again as a member of the City Council until the expiration of at least two (2) years following the conclusion of such person's last term of office?,70,70,Ordinance,45,45,Governance: Political Reform/Term Limits,7919,2749,10668,0.74231344,M,1,Pass,0,201000265,7919,2749,10668,0.74231344,1,Pass,70,40
201000272,2010,30,2,ORANGE,2010-11-02,Newport Beach,2,M,V,Shall the Charter be amended and ordinances repealed to: close Charter loopholes that circumvent Proposition 13; restrict oil operations; amend legal document publication requirements; simplify franchise processes; increase formal bidding thresholds; adjust misdemeanor penalties; require redistricting appointments every ten years; amend Civil Service System; repeal Chamber of Commerce contribution limit; remove City contract term limitations; require vote for the sale of City owned waterfront property; make administrative changes to comply with state and federal law?,20,20,Charter Amendment,40,40,Governance,19777,12362,32139,0.6153583,M,1,Pass,0,201000266,19777,12362,32139,0.6153583,1,Pass,20,40
201000273,2010,30,2,ORANGE,2010-11-02,Placentia,2,M,W,"Without raising current tax rates and to preserve funding for critical city services, including police, fire, 911 emergency response, street repair, graffiti removal, park maintenance, and other city services; shall the City of Placentia's existing utility user tax ordinance be amended to reflect changes in technology and Federal law, treating taxpayers equally regardless of technology services used; including exemptions available for low-income residents, independent audits, with all funds dedicated to preserving Placentia city services?",5,5,Utility Tax,110,110,Revenues,8975,5642,14617,0.6140111,M,1,Pass,0,201000267,8975,5642,14617,0.6140111,1,Pass,1,110
201000274,2010,30,2,ORANGE,2010-11-02,Tustin,2,M,X,Shall the office of the City Clerk be appointive?,70,70,Ordinance,43,43,Governance: Organization,9551,5911,15462,0.6177079,M,1,Pass,0,201000268,9551,5911,15462,0.6177079,1,Pass,70,40
201000275,2010,30,2,ORANGE,2010-11-02,Westminster,2,M,AA,"Shall Chapter 9.64 of the Westminster Municipal Code prohibiting the possession, storage, sale, and use of state-approved fireworks in the City of Westminster, be repealed?",70,70,Ordinance,200,200,Other,14360,8264,22624,0.6347242,M,1,Pass,0,201000269,14360,8264,22624,0.6347242,1,Pass,70,200
201000276,2010,30,2,ORANGE,2010-11-02,Yorba Linda,2,M,Y,"Shall an ordinance titled the ""Yorba Linda Ethics Ordinance"" be adopted to ensure that the highest level of ethics is practiced by all elected and appointed officials and staff that serve the City of Yorba Linda?",70,70,Ordinance,40,40,Governance,22415,3937,26352,0.8505996,M,1,Pass,0,201000270,22415,3937,26352,0.8505996,1,Pass,70,40
201000277,2010,30,2,ORANGE,2010-11-02,Yorba Linda,2,M,Z,Shall an ordinance be adopted amending the Yorba Linda General Plan and approving a zone change to permit the development of affordable housing up to a maximum density of 30 dwelling units per acre and a maximum height of 45 feet within the Savi Ranch Planned Development zone?,70,70,Ordinance,22,22,Land Use: Zoning,13147,13344,26491,0.49628174,M,2,Fail,0,201000271,13147,13344,26491,0.49628174,2,Fail,70,20
