MeasID,YEAR,CO#,JUR,CNTYNAME,DATE,PLACE,CSD,MEASTYPE,LTR,BALQUEST,RECTYPE,RECTYPENAME,RECTOPIC,RECTOPICNAME,YES,NO,TOTAL,PERCENT,REQ,OUTCOME,PASSFAIL,Multi_CO,Multi_MeasID,YES_sum,NO_sum,Total_sum,Percent_sum,Outcome_sum,Passfail_sum,typerec,topcrec,OTH
201300095,2013,44,2,SANTA CRUZ,2013-11-05,Scotts Valley,0,M,U,"Shall a temporary one-half of one percent sales tax rate increase be approved for an eight year period to keep the budget balanced and to preserve police, parks, recreation and other city services for the residents of Scotts Valley?",4,Sales Tax,112,Revenues: Tax Creation/Incr./Contin.,2029,667,2696,0.753,M,1,Pass,0,201300095,2029,667,2696,0.7525964391691394,1,Pass,1,110,
201300096,2013,48,2,SOLANO,2013-11-05,Vallejo,0,M,E,"Shall Charter sections 302, 319, and 1000 be amended to change the City's general municipal elections from odd-numbered to even-numbered years to consolidate with Statewide elections and reduce election costs by approximately $205,000 and to extend the term of the existing council members and mayor approximately 13  months to make that transition, and change the date elected candidates and the vice mayor assume office?",20,Charter Amendment,48,Governance: Elections,10520,3151,13671,0.77,M,1,Pass,0,201300096,10520,3151,13671,0.7695121059176359,1,Pass,20,40,
201300097,2013,49,2,SONOMA,2013-11-05,Rohnert Park,0,M,A,"To preserve the safely and character of Rohnert Park, and maintain/protect general City services, including 9-1-1 emergency response; fire protection, neighborhood police patrols; gang/sex offender enforcement; disaster preparedness; street paving/pothole repair; park maintenance; and other essential services, shall the City of Rohnert Park continue a voter-approved ½ cent sales tax, subject to annual audits and public review, keeping money from Sacramento, and without raising existing tax rates?",4,Sales Tax,112,Revenues: Tax Creation/Incr./Contin.,4187,2033,6220,0.673,T,1,PassT,0,201300097,4187,2033,6220,0.6731511254019292,1,PassT,1,110,
201300098,2013,49,2,SONOMA,2013-11-19,Sonoma,0,M,B,Shall the Hotel Limitation Measure be adopted?,70,Ordinance,21,Land Use: Growth Cap/Boundary,1908,2032,3940,0.484,M,2,Fail,0,201300098,1908,2032,3940,0.4842639593908629,2,Fail,70,20,
201300099,2013,50,2,STANISLAUS,2013-11-05,Modesto,0,M,V,"Shall the City provide sewer service to the following area of the Modesto General Plan? The unincorporated area designated ""Airport Neighborhood"" or the east portion of “Area 12"" in Modesto's 2009 Urban Growth Review. The area is generally bordered by Hyde Street on the north, Conejo Avenue on the east, Oregon Drive on the south, and Santa Rosa Avenue on the west.",70,Ordinance,102,General Services: Wastewater/Sewage,15718,7255,22973,0.684,M,1,Pass,0,201300099,15718,7255,22973,0.6841944891829539,1,Pass,70,100,
201300100,2013,50,2,STANISLAUS,2013-11-05,Modesto,0,M,X,"To address crime, gangs, drugs and youth violence, improve the local economy/jobs, and maintain/improve essential City services, including: Police/Fire Protection; Neighborhood Police Patrols; 9-1-1 Emergency Response; Gang Crime, Theft and Burglary Prevention; Street/Pothole Repair; Programs Attracting Businesses/Creating Jobs; and Other City Services. Shall the City of Modesto enact a one-cent sales tax, for 6 years, with independent annual audits, citizens’ oversight, and no money for Sacramento?",4,Sales Tax,112,Revenues: Tax Creation/Incr./Contin.,11815,12322,24137,0.489,M,2,Fail,0,201300100,11815,12322,24137,0.48949745204457884,2,Fail,1,110,
201300101,2013,50,2,STANISLAUS,2013-11-05,Waterford,0,M,W,"Shall the city of Waterford be allowed to levy a special tax every year within Community Facilities District No. 2013-1 (Public Services) to pay for landscape and lighting services and replace the Lighting and Landscaping Districts which are running deficits, according to the rates established by the city Council in Resolution of Formation, beginning July 1, 2014, and shall the City be authorized to spend for these services all that is receives?",7,Miscellaneous Tax,105,General Services: Maintenance,275,668,943,0.292,T,2,FailT,0,201300101,275,668,943,0.2916224814422057,2,FailT,1,100,
201300102,2013,57,2,YOLO,2013-03-05,Davis,0,M,I,"Shall Ordinance No. 2399 - be adopted, which grants permission to the City of Davis to proceed with the Davis Woodland Water Supply Project, to provide surface water as an additional supply of water, subject to the adoption of water rates in accordance with the California Constitution (Proposition 218)?",70,Ordinance,104,General Services: Water,8014,6802,14816,0.541,M,1,Pass,0,201300102,8014,6802,14816,0.540901727861771,1,Pass,70,100,
201300103,2013,1,3,ALAMEDA,2013-03-05,Piedmont Unified,0,M,A,"To prevent local school funding from expiring and to maintain the quality of Piedmont's schools, to attract, train and retain qualified teachers, to protect programs in math, science and technology, to continue funding for music, visual and performing arts programs, and to keep textbooks and instructional technology up-to-date, shall the Piedmont Unified School District continue to levy a special tax as specified in the voter pamphlet, with all funds staying in Piedmont to benefit our schools?",3,Property Tax,10,Education,3414,1049,4463,0.765,T,1,PassT,0,201300103,3414,1049,4463,0.764956307416536,1,PassT,1,10,
201300104,2013,7,3,CONTRA COSTA,2013-11-05,Moraga Elementary,0,M,B,"To maintain the high quality of Moraga schools and continue funding for effective math, science, music and arts programs; maintain manageable class sizes; keep schools safe and well maintained; keep school libraries open; keep classroom technology up-to-date; and attract and retain the best qualified teachers; shall the Moraga School District levy a temporary six-year $192 parcel tax with an exemption for low-income seniors, independent audits, and with all funds staying local to benefit Moraga students?",3,Property Tax,10,Education,3969,1837,5806,0.684,T,1,PassT,0,201300104,3969,1837,5806,0.6836031691353772,1,PassT,1,10,
201300105,2013,13,3,IMPERIAL,2013-11-05,Calipatria Unified School District,0,M,T,"To improve the quality of education, modernize vocational classrooms, ensure local students have access to classroom and facilities comparable to neighboring schools, modernize Wirt Auditorium and Hornet Gymnasium (Old Gym), improve student support facilities, provide the required match to access up to $4.4 million in State grants, shall Calipatria Unified School District be authorized to issue $9.0 million in bonds at legal interest rates, with annual audits, independent Citizens' Oversight Committee and no money for administrator salaries?",11,GO Bond,11,Education: Bonds,422,283,705,0.599,F,1,PassF,0,201300105,422,283,705,0.5985815602836879,1,PassF,10,10,
201300106,2013,15,3,KERN,2013-06-04,Wasco Union High,0,M,A,"Shall there be formed a unified school district on the boundaries of the Wasco High School District, with the entire territory of the high school district included for high school purposes, so that the Wasco High School District and Wasco Elementary School District will be unified for all purposes while the Lost Hills, Maple and Semitropic Elementary School Districts shall retain their independence and separate identity for elementary school purposes as authorized by Education Code section 35542(b)?",70,Ordinance,12,Education: Districts,466,930,1396,0.334,M,2,Fail,0,201300106,466,930,1396,0.333810888252149,2,Fail,70,10,
201300107,2013,15,3,KERN,2013-11-05,Mojave Unified School District,0,M,C,"To maintain quality academic programs, school facilities, and activities that provide improved college and career pathways within SFID No. 2, shall the Mojave Unified School District levy a parcel tax in the amount of $42 to be levied annually for a period of five years, with mandatory audits, no money for administrative salaries, and with every dollar staying in our local schools?",3,Property Tax,10,Education,332,163,495,0.671,T,1,PassT,0,201300107,332,163,495,0.6707070707070707,1,PassT,1,10,
201300108,2013,15,3,KERN,2013-11-05,Semitropic School District,0,M,D,"To repair, modernize, and upgrade Semitropic School, improve student safety and security, provide the classrooms and facilities to continue improving student achievement, and sustain the School’s investment in modern classroom technology, shall the Semitropic School District be authorized to issue up to $5,000,000 in bonds at legal interest rates, with an independent taxpayers’ oversight committee, annual audits, NO funds for administrator salaries and ALL funds dedicated locally to improving the School?",11,GO Bond,11,Education: Bonds,12,9,21,0.571,T,2,FailT,0,201300108,12,9,21,0.5714285714285714,2,FailT,10,10,
201300109,2013,19,3,LOS ANGELES,2013-03-05,Burbank Unified,0,M,S,"To improve the quality and safety of Burbank school facilities, to upgrade classrooms, computers and technology, to replace aging portable classrooms, electrical systems, plumbing and sewer lines, roofs and play areas, to improve student safety and security including upgraded fire protection, increase energy efficiency and to provide accessibility for students with disabilities, shall Burbank Unified School District be authorized to issue $110,000,000 in bonds, at legal rates, with independent citizens oversight and annual audits?",11,GO Bond,11,Education: Bonds,4663,2884,7547,0.618,F,1,PassF,0,201300109,4663,2884,7547,0.6178614018815424,1,PassF,10,10,
201300110,2013,19,3,LOS ANGELES,2013-03-12,San Marino Unified,0,M,R,"In order to continue funding quality educational programs and classroom instruction, prevent increases in class sizes and reductions in teaching positions, attract and retain high quality teachers and employees, and support educational programs that enhance student achievement, shall the San Marino Unified School District extend its expiring school parcel tax for six years at $330 per parcel with an exemption for seniors, adjustment for inflation and all money staying in our community to benefit our local schools?",3,Property Tax,10,Education,2267,900,3167,0.716,T,1,PassT,0,201300110,2267,900,3167,0.7158193874329019,1,PassT,1,10,
201300111,2013,19,3,LOS ANGELES,2013-03-12,South Pasadena Unified,0,M,S,"To prepare students for success in college/careers and minimize local impacts of state school funding cuts; continue local funding to attract/retain highly qualified teachers; maintain manageable class sizes, advanced instruction in math/science/technology, and music/art programs; shall South Pasadena Unified School District renew/increase its expiring annual school parcel tax by $98 (as described in the ballot pamphlet) for five years, with senior exemptions and all funds staying local?",3,Property Tax,10,Education,4679,1751,6430,0.728,T,1,PassT,0,201300111,4679,1751,6430,0.7276827371695179,1,PassT,1,10,
201300112,2013,19,3,LOS ANGELES,2013-11-05,Wiseburn Elementary,0,M,W,Shall the Wiseburn School District be reorganized to form the Wiseburn Unified School District from part of the territory formerly covered by the Centinela Valley Union High School District?,70,Ordinance,12,Education: Districts,1579,123,1702,0.928,M,1,Pass,0,201300112,1579,123,1702,0.9277320799059929,1,Pass,70,10,
201300113,2013,21,3,MARIN,2013-05-07,San Rafael Elementary,0,M,A,"To protect quality education at all San Rafael elementary and middle schools by maintaining stable local funding the State can’t take away, including: enhancing core academic programs like math, science, and reading; maintaining small class sizes and programs that support learning; and attracting and retaining high quality teachers, shall San Rafael Elementary School District extend the expiring school parcel tax for eight years with exemptions for seniors, independent citizen oversight, no funds for administrator salaries and all funds staying
local?",3,Property Tax,10,Education,7752,2106,9858,0.786,T,1,PassT,0,201300113,7752,2106,9858,0.7863664029214851,1,PassT,1,10,
201300114,2013,21,3,MARIN,2013-05-07,San Rafael High,0,M,B,"To protect quality education at San Rafael and Terra Linda High Schools with stable local funding the State can’t take away, including: enhancing math, science, technology, music and fine art instruction; maintaining small class sizes; preparing students for college and 21st-century careers; and attracting and retaining quality teachers, shall San Rafael High School District extend the expiring school parcel tax for eight years with senior exemptions, independent oversight, no funds for administrator salaries and all funds staying local?",3,Property Tax,10,Education,12513,3310,15823,0.791,T,1,PassT,0,201300114,12513,3310,15823,0.7908108449725084,1,PassT,1,10,
201300115,2013,21,3,MARIN,2013-06-04,Bolinas-Stinson Union,0,M,A,"Shall the Bolinas-Stinson Union School District continue funding quality educational programs by levying a special tax assessment of $300 per year per assessor’s parcel for a limited period of six (6) years, beginning July 1, 2014, with an exemption for any beneficial owner of a parcel who has attained
the age of 65 on or before May 1 of any applicable year, who uses that parcel as his or her principal residence?",3,Property Tax,10,Education,367,167,534,0.687,T,1,PassT,0,201300115,367,167,534,0.6872659176029963,1,PassT,1,10,
201300116,2013,21,3,MARIN,2013-11-05,Lagunitas Elementary,0,M,A,"To modernize learning environments, classrooms and libraries; renovate outdated school facilities; improve energy efficiency; enhance student access to technology; make health and safety renovations; upgrade playgrounds and playfields; and replace outdated windows and heating, ventilation, and air-conditioning systems, shall the Lagunitas School District issue $5,000,000 of bonds at legal interest rates, have an independent citizens’ oversight committee and have no bond money taken by the state or used for teacher or administrator salaries?",11,GO Bond,11,Education: Bonds,754,339,1093,0.69,F,1,PassF,0,201300116,754,339,1093,0.6898444647758463,1,PassF,10,10,
201300117,2013,27,3,MONTEREY,2013-11-05,North Monterey County Unified,0,M,H,"To renovate and modernize aging school facilities and classrooms, upgrade libraries, replace leaking and deteriorating roofs, improve energy efficiency by upgrading heating, electrical and plumbing systems, upgrade athletic facilities, upgrade access to instructional technology, and improve school safety and security, shall the North Monterey County Unified School District be authorized to issue $23,800,000 in bonds at legal interest rates with no funds for administrator salaries and an appointed Independent Citizens' Oversight Committee to monitor all bond expenditures?",11,GO Bond,11,Education: Bonds,2453,1566,4019,0.61,F,1,PassF,0,201300117,2453,1566,4019,0.6103508335406818,1,PassF,10,10,
201300118,2013,27,3,MONTEREY,2013-11-05,Pacific Grove Unified,0,M,G,"To increase student access to computers; maintain and upgrade educational technology; keep pace with 21st century technological innovations; implement statewide technology requirements for testing and learning; and significantly reduce borrowing costs, shall Pacific Grove Unified School District issue $27.8 million of short-term bonds with the interest rates below the legal limit, independent citizen oversight, and no money for administrator/teacher salaries, so long as all funds are spent locally and cannot be taken by the State?",11,GO Bond,11,Education: Bonds,2828,2593,5421,0.522,F,2,FailF,0,201300118,2828,2593,5421,0.5216749677181332,2,FailF,10,10,
201300119,2013,36,3,SAN BERNARDINO,2013-06-11,Hesperia Unified,0,M,Y,"Shall Community Facilities District No. 2013-1 (""CFD No.2013-1"") of the Hesperia Unified School District (""School District"") be authorized to finance the cost of public school facilities, as described in Resolution No. 2012/13-27 of the School District, by incurring bonded indebtedness in a maximum amount of $2,750,000, and shall CFD No. 2013-1 be authorized to levy special taxes on an annual basis, as shall be applicable, on property within CFD No. 2013-1, as set forth in Resolution Nos. 2012/13-21, as amended by Resolution No. 2012/13-26 and Resolution No. 2012/13-27, to pay for public school facilities and to pay for bonded indebtedness authorized under the Proposition (Measure Y), and for each year, commending with fiscal year 2013-2014, shall an appropriations limit, as defined by Article XIIIB of the California Constitution, be established for CFD No. 2013-1 in an amount equal to $2,750,000, as periodically adjusted pursuant to applicable State law?",11,GO Bond,11,Education: Bonds,176,11,187,0.941,T,1,PassT,0,201300119,176,11,187,0.9411764705882353,1,PassT,10,10,
201300120,2013,36,3,SAN BERNARDINO,2013-07-16,Fontana Unified,0,R,1,Shall Leticia Garcia be recalled (removed) from the office of Governing Board Member?,50,Recall,13,Education: Recall,3086,1336,4422,0.698,M,1,Pass,0,201300120,3086,1336,4422,0.6978742650384442,1,Pass,50,10,
201300121,2013,36,3,SAN BERNARDINO,2013-07-16,Fontana Unified,0,R,2,Shall Sophia Green be recalled (removed) from the office of Governing Board Member?,50,Recall,13,Education: Recall,3071,1278,4349,0.706,M,1,Pass,0,201300121,3071,1278,4349,0.706139342377558,1,Pass,50,10,
201300122,2013,41,3,SAN MATEO,2013-05-07,La Honda-Pescadero Unified,0,M,N,"Shall the La Honda-Pescadero Unified School District continue a successful local parcel tax to improve access to technology in classrooms, provide enrichment opportunities for students, quality professional development for teachers and increase student achievement, in the amount of $100 per year per taxable parcel for seven years, with exemptions for contiguous parcels and parcels owned by persons 65 years and older, with funds staying in local schools, and with independent community review of all expenditures?",3,Property Tax,10,Education,433,207,640,0.677,T,1,PassT,0,201300122,433,207,640,0.6765625,1,PassT,1,10,
201300123,2013,41,3,SAN MATEO,2013-05-07,Portola Valley Elementary,0,M,O,"To protect quality education in local elementary/middle schools, with funds that cannot be taken by the State and - maintain quality science, math, reading/writing instruction, - retain qualified/experienced teacher, - minimize class size increases, - support music/art programs, - develop advanced programs in engineering/technology, shall Portola Valley Elementary School District extend expiring school parcel taxes for eight years, increase rates by $123 annually, with senior exemptions independent citizen oversight, no money for administrator salaries, all funds staying local?",3,Property Tax,10,Education,1512,678,2190,0.69,T,1,PassT,0,201300123,1512,678,2190,0.6904109589041096,1,PassT,1,10,
201300124,2013,41,3,SAN MATEO,2013-11-05,Belmont-Redwood Shores Elementary,0,M,R,"Without increasing the current tax rate and to maintain excellent student achievement by protecting math, science, reading and writing programs, supporting school libraries, attracting and retaining qualified teachers, and maintaining a well-rounded curriculum, including music and art, shall Belmont-Redwood Shores Elementary School District renew its existing parcel taxes for ten years, with no funds for administrators' salaries, exempting senior citizens and requiring independent citizen oversight, generating funds that cannot be taken by the State to benefit local schools?",3,Property Tax,10,Education,5551,2161,7712,0.72,T,1,PassT,0,201300124,5551,2161,7712,0.7197873443983402,1,PassT,1,10,
201300125,2013,41,3,SAN MATEO,2013-11-05,Las Lomitas Elementary,0,M,S,"To repair and improve aging schools to protect quality academic instruction with funding that cannot be taken by Sacramento, shall Las Lomitas Elementary School District build classrooms for increased student enrollment, update/replace aging classrooms to meet current health/safety codes, renovate heating/electrical systems to save money, support 21st century instructional technology, acquire, repair, construct sites, facilities, equipment by issuing $60,000,000 in bonds at legal rates, with citizens' oversight, no money for administrators, and all funds staying local?",11,GO Bond,11,Education: Bonds,2305,812,3117,0.739,F,1,PassF,0,201300125,2305,812,3117,0.7394931023419955,1,PassF,10,10,
201300126,2013,41,3,SAN MATEO,2013-11-05,Menlo Park City Elementary,0,M,W,"To support high quality education, avoid student overcrowding at our existing schools as enrollment continues to increase, and renovate and expand educational facilities at the O'Connor Elementary School site planned to reopen in Menlo Park's Willows neighborhood, all as described in the Bond Project List, shall the Menlo Park City School District issue $23 million of bonds at legal interest rates, establish an independent citizens' oversight committee, perform annual audits, and use no bond money for teacher or administrator salaries?",11,GO Bond,11,Education: Bonds,4222,1383,5605,0.753,F,1,PassF,0,201300126,4222,1383,5605,0.7532560214094558,1,PassF,10,10,
201300127,2013,41,3,SAN MATEO,2013-11-05,San Mateo-Foster City Elementary,0,M,P,"To improve local schools and protect high quality math, science, reading and writing instruction with funding that cannot be taken by the State, shall San Mateo-Foster City Elementary School District upgrade classrooms, science labs, and libraries, relieve school overcrowding, update classroom technology for higher 21 st century academic standards, and repair, construct, or acquire equipment, classrooms, sites and facilities by issuing $130,000,000 in bonds at legal rates, with citizen oversight, no money for administrators, and all funds staying local?",11,GO Bond,11,Education: Bonds,8002,9195,17197,0.465,F,2,FailF,0,201300127,8002,9195,17197,0.46531371750886785,2,FailF,10,10,
201300128,2013,43,3,SANTA CLARA,2013-05-07,Lakeside Joint Elementary,0,M,A,"Shall 17 parcels located on Marty Road and Jensen Springs Road be transferred from the Lakeside Join Union School District (“Lakeside”) in the Loma Prieta Joint Union School District (LPJUSD); transferring the designated attendance for elementary education (K-8) and the associated property tax revenue; relieving , then reapportioning the parcels’ G.O. Bond obligations to remaining Lakeside parcels; relieving the $311 annual Lakeside parcel tax; and requiring an assessment of $150 annually for the LPJUSD parcel tax?",70,Ordinance,12,Education: Districts,22,174,196,0.112,M,2,Fail,1,201300128,103,555,658,0.15653495440729484,2,Fail,70,10,
201300133,2013,44,3,SANTA CRUZ,2013-05-07,Lakeside Joint Elementary,0,M,A,"Shall 17 parcels located on Marty Road and Jensen Springs Road be transferred from the Lakeside Joint Union School District (“Lakeside”) into the Loma Prieta Joint Union School District (LPJUSD); transferring the designated attendance for elementary education (K-8) and the associated property tax revenue; relieving, then reapportioning the parcels’ G.O. Bond obligations to remaining Lakeside parcels; relieving the $311 annual Lakeside parcel tax; and requiring an assessment of $150 annually for the LPJUSD parcel tax?",70,Ordinance,12,Education: Districts,81,381,462,0.175,M,2,Fail,1,201300128,103,555,658,0.15653495440729484,2,Fail,70,10,
201300129,2013,43,3,SANTA CLARA,2013-05-07,Los Gatos Union Elementary,0,M,B,"Without increasing tax rates and to protect outstanding core academic programs in reading, writing, math, and science; retain highly-qualified teachers; keep classroom technology, science resources, books and instructional materials updated; and maintain art and music; shall the Los Gatos Union School District be authorized to renew its expiring annual education tax of $290 per parcel for eight years, with citizen oversight, no funds for administrators' salaries, a senior citizen exemption, and all funds staying in Los Gatos schools?",3,Property Tax,10,Education,6070,1355,7425,0.818,T,1,PassT,0,201300129,6070,1355,7425,0.8175084175084175,1,PassT,1,10,
201300130,2013,43,3,SANTA CLARA,2013-11-05,Campbell Union High,0,M,E,"To support quality education in local high schools with funds that cannot be taken by the State including academic instruction in science, math, English, Advanced Placement, art, music, technology, vocational courses; recruit/retain qualified teachers; maintain small class sizes; and provide safe/clean schools; shall Campbell Union High School District renew – with no tax increase – an existing $85 annual parcel tax for 8 years, with exemptions for seniors and qualified disabled citizens, independent fiscal oversight, and no administrator salaries?",3,Property Tax,10,Education,19341,5857,25198,0.768,T,1,PassT,0,201300130,19341,5857,25198,0.7675609175331376,1,PassT,1,10,
201300131,2013,43,3,SANTA CLARA,2013-11-05,Loma Prieta Joint Union,0,M,H,"To support high academic achievement for local students and provide stable local funding to maintain outstanding core academic programs in reading, writing, math, and science, retain highly qualified and experienced teachers, and prepare students for an excellent high school shall the Loma Priesta Joint Union Elementary School District authorized an annual school parcel tax of $164 per parcel for seven years with independent citizens’ oversight, an exemption for seniors, no funds for administrator’s salaries and every dollar staying in our schools?",3,Property Tax,10,Education,241,70,311,0.775,T,1,PassT,1,201300131,1224,389,1613,0.7588344699318041,1,PassT,1,10,
