MeasID,YEAR,CO,JUR,CNTYNAME,DATE,PLACE,CSD,MEASTYPE,LTR,BALQUEST,Orig_TYPE,RECTYPE,RECTYPENAME,Orig_TOPIC,RECTOPIC,RECTOPNAME,YES,NO,TOTAL,PERCENT,REQ,OUTCOME,PASSFAIL,Multi_CO,Multi_MeasID,YES_sum,NO_sum,Total_sum,Percent_sum,Outcome_sum,passfail_sum,typerec,topicrec
199600414,1996,33,2,RIVERSIDE,1996-11-05,DESERT HOT SPRINGS,0,M,EE,Shall the City Council of the City of Desert Hot Springs establish a Police Commission to advise the City Council on matters concerning the funding of police services and establishing levels of law enforcement service in the City (as outlined in Resolution 96-21)?,30,30,Advisory,32,32,Safety: Police,1640,1333,2973,0.5516313488059199,M,1,Pass,0,199600413,1640,1333,2973,0.5516313488059199,1,Pass,30,30
199600415,1996,33,2,RIVERSIDE,1996-11-05,LA QUINTA,0,M,W,Shall the Charter be adopted making La Quinta a charter city so that the laws of La Quinta shall prevail over state law with respect to municipal affairs?,20,20,Charter Amendment,42,42,Governance: Personnel/Labor Relations,3073,2447,5520,0.5567028985507246,M,1,Pass,0,199600414,3073,2447,5520,0.5567028985507246,1,Pass,20,40
199600416,1996,33,2,RIVERSIDE,1996-11-05,MORENO VALLEY,0,M,AA,"Shall the ordinance entitled:  ""AN ORDINANCE OF THE CITY OF MORENO VALLEY, CALIFORNIA, REENACTING THE EXISTING 6% UTILITY USERS TAX OTHERWISE SUBJECT TO REPEAL AS OF DECEMBER 31, 1996"" be approved?",5,5,Utility Tax,100,112,Revenues: Tax Creation/Incr./Contin.,16149,14668,30817,0.52402894506279,M,1,Pass,0,199600415,16149,14668,30817,0.52402894506279,1,Pass,1,110
199600417,1996,33,2,RIVERSIDE,1996-11-05,MORENO VALLEY,0,M,BB,"Shall the ordinance entitled ""AN ORDINANCE OF THE CITY OF MORENO VALLEY, CALIFORNIA, REENACTING THE EXISTING BUSINESS LICENSE TAX OTHERWISE SUBJECT TO REPEAL AS OF DECEMBER 31, 1996"" be approved?",2,2,Business Tax,100,112,Revenues: Tax Creation/Incr./Contin.,16186,14483,30669,0.5277641918549676,M,1,Pass,0,199600416,16186,14483,30669,0.5277641918549676,1,Pass,1,110
199600418,1996,33,2,RIVERSIDE,1996-11-05,RANCHO MIRAGE,0,M,X,"Shall the City Council of Rancho Mirage be permitted to review, act on a settlement agreement including a land lease on terms and conditions acceptable to the City Council, and after proper land use application and review, allow Olympus Rancho Mirage P. L.. to develop a golf course on that land?",70,70,Ordinance,24,24,Land Use: Private Projects,3593,1644,5237,0.686079816688944,M,1,Pass,0,199600417,3593,1644,5237,0.686079816688944,1,Pass,70,20
199600419,1996,34,2,SACRAMENTO,1996-11-05,CITRUS HEIGHTS (PROPOSED CITY),0,M,R,"PROPOSED INCORPORATION OF THE CITY OF CITRUS HEIGHTS.  Shall the order adopted on July 23, 1996 by the Board of Supervisors ordering the incorporation of the territory described in the order and designated in the order as Incorporation of Citrus Heights, California (29-86/94) be confirmed subject to the terms and conditions including the annual payment from the City to the County of Sacramento of $5,621,000 commencing with a partial payment in 1996-1997 and terminating, as adjusted, after 2021-2022; and including authorization, as approved by the voters through this measure, for the City to continue to levy and collect within its territory the same general taxes, fees, charges, assessments and rates as presently levied and collected by the County of Sacramento, as more particularly described and set forth in the order?",70,70,Ordinance,44,44,Governance: Incorporation/Formation/Annexation,16833,10140,26973,0.6240685129574018,M,1,Pass,0,199600418,16833,10140,26973,0.6240685129574018,1,Pass,70,40
199600420,1996,34,2,SACRAMENTO,1996-11-05,FOLSOM,0,M,F,"To expand Lembi Park to provide indoor recreational facilities, swimming pools, and related facilities for children and adults of all ages, shall the City of Folsom issue $8.25 million of general obligation bonds?",11,11,GO Bond,51,51,Environment: Parks/Recreation,6737,8445,15182,0.443749176656567,T,2,FailT,0,199600419,6737,8445,15182,0.443749176656567,2,FailT,10,50
199600421,1996,34,2,SACRAMENTO,1996-11-05,FOLSOM,0,M,G,"To preserve, enhance and acquire park facilities, historic ranch land, and improve the City Zoo, shall the City of Folsom issue $9 million of general obligations bonds to enhance Humbug-Willow Creek Parkway Trails, acquire the Broder Cattle Ranch for future community use, provide for planned expansion at the Folsom City Zoo, acquire a site and construct a public gym north of the American River, and construct or renovate neighborhood parks throughout the city?",11,11,GO Bond,51,51,Environment: Parks/Recreation,7376,7889,15265,0.4831968555519162,T,2,FailT,0,199600420,7376,7889,15265,0.48319685555191616,2,FailT,10,50
199600422,1996,34,2,SACRAMENTO,1996-11-05,GALT,0,M,H,Shall Ordinance No. 96-09 of the City of Galt be approved so as to establish a special tax for Police Protection Services for a five year term?,2,2,Business Tax,32,32,Safety: Police,1543,2812,4355,0.35430539609644085,T,2,FailT,0,199600421,1543,2812,4355,0.35430539609644085,2,FailT,1,30
199600423,1996,34,2,SACRAMENTO,1996-11-05,ISLETON,0,M,I,"CITY OF ISLETON BUSINESS OPERATIONS TAXES.  Shall Ordinance No. 336 of the City of Isleton, an ordinance authorizing the City Council to impose various business operation taxes upon businesses operating in the City of Isleton, be approved?",2,2,Business Tax,100,112,Revenues: Tax Creation/Incr./Contin.,177,161,338,0.5236686390532544,M,1,Pass,0,199600422,177,161,338,0.5236686390532544,1,Pass,1,110
199600424,1996,34,2,SACRAMENTO,1996-11-05,ISLETON,0,M,J,"CITY OF ISLETON SHORT-TERM PARKING TAXES.  Shall Ordinance No. 339 of the City of Isleton, an ordinance authorizing the City Council to impose an excise tax of not more than $1.00 per day on Short-term commercial parking in the City of Isleton, be approved?",4,4,Sales Tax,100,112,Revenues: Tax Creation/Incr./Contin.,213,122,335,0.6358208955223881,M,1,Pass,0,199600423,213,122,335,0.6358208955223881,1,Pass,1,110
199600425,1996,34,2,SACRAMENTO,1996-11-05,ISLETON,0,M,K,"CITY OF ISLETON TRANSIENT OCCUPANCY TAX.  Shall Ordinance No. 338 of the City of Isleton, an ordinance to increase the transient occupancy tax of the City for hotel guests from seven percent (%) to ten percent (10%) of room rent, be approved.",2,2,Business Tax,100,112,Revenues: Tax Creation/Incr./Contin.,233,107,340,0.6852941176470588,M,1,Pass,0,199600424,233,107,340,0.6852941176470588,1,Pass,1,110
199600426,1996,34,2,SACRAMENTO,1996-11-05,ISLETON,0,M,L,"CITY OF ISLETON CARDROOM TAXES.  Shall Ordinance No. 337 of the City of Isleton, an ordinance to impose business operation taxes upon cardrooms, be approved?",2,2,Business Tax,100,112,Revenues: Tax Creation/Incr./Contin.,271,75,346,0.7832369942196532,M,1,Pass,0,199600425,271,75,346,0.7832369942196532,1,Pass,1,110
199600427,1996,34,2,SACRAMENTO,1996-11-05,ISLETON,0,M,M,CITY OF ISLETON INITIATIVE TAXING CONCEALED WEAPONS LICENSE APPLICATIONS.  Shall an initiative ordinance imposing an general tax of $150 upon each application for a license to carry a concealed weapon and imposing a general tax of $50 for each application for renewal of such a license be approved?,40,40,Initiative,100,112,Revenues: Tax Creation/Incr./Contin.,241,108,349,0.6905444126074498,M,1,Pass,0,199600426,241,108,349,0.6905444126074498,1,Pass,40,110
199600428,1996,34,2,SACRAMENTO,1996-11-05,SACRAMENTO,0,M,O,"To support continued maintenance of trees and parks within the City of Sacramento, shall the existing assessment of $10.89 per year for single family residential properties, $7.41 per unit per year for multi family residential properties, $19.10 per year for 0-25,000 square foot business properties, $95.50 per year for 25,000-100,000 square foot business properties, $198.65 per year for 100,000-or-more square foot business properties, under the Landscaping and Lighting Act, be continued for that same purpose?",3,3,Property Tax,51,51,Environment: Parks/Recreation,74803,29366,104169,0.7180927147231903,T,1,PassT,0,199600427,74803,29366,104169,0.7180927147231903,1,PassT,1,50
199600429,1996,34,2,SACRAMENTO,1996-11-05,SACRAMENTO,0,M,P,"To restore open hours, restore funding for new books, and updated technology in all branch libraries, shall single family residences be assessed $22 per year and all other properties at specified proportional amounts for 10 years, with adjustments not exceeding 3% annually or more than $7 for single family residences during the life of the assessment, and requiring current City library funding either to be maintained or only be reduced proportionally with other non-safety services?",3,3,Property Tax,71,71,Facilities: Libraries,66951,39679,106630,0.6278814592516178,T,2,FailT,0,199600428,66951,39679,106630,0.6278814592516178,2,FailT,1,70
199600430,1996,34,2,SACRAMENTO,1996-11-05,SACRAMENTO,0,M,Q,"Shall the Charter amendment adding Article XVII (Sections 500 through 503) to the Charter of the City of Sacramento providing for mandatory binding arbitration when labor negations between the City and a recognized employee organization ( Union) for police department employees reach impasse, be adopted?",20,20,Charter Amendment,32,32,Safety: Police,56024,43810,99834,0.5611715447643087,M,1,Pass,0,199600429,56024,43810,99834,0.5611715447643087,1,Pass,20,30
199600431,1996,35,2,SAN BENITO,1996-11-05,HOLLISTER,0,M,F,"Shall the two percent (2%) Utility User's Tax imposed by Chapter 19, Article VI, of the Municipal Code be extended for a period of 4 years beginning July 1, 1997?",5,5,Utility Tax,100,112,Revenues: Tax Creation/Incr./Contin.,2281,4624,6905,0.3303403330919624,M,2,Fail,0,199600430,2281,4624,6905,0.33034033309196237,2,Fail,1,110
199600432,1996,36,2,SAN BERNARDINO,1996-11-05,COLTON,0,R,Z,Shall GEORGE V. FULP BE RECALLED (removed) from the office of Mayor (Term Ending November 1998)?,50,50,Recall,48,46,Governance: Recall,4900,4255,9155,0.5352266521026762,M,1,Pass,0,199600431,4900,4255,9155,0.5352266521026762,1,Pass,50,40
199600433,1996,36,2,SAN BERNARDINO,1996-11-05,LOMA LINDA,0,M,A,"Shall the Ordinance of the City of Loma Linda, California, levying a 1.25 percent utility users special tax for police services be approved, and shall the City's appropriations limit be increased by the amount of revenue derived from this tax?",5,5,Utility Tax,32,32,Safety: Police,2355,2393,4748,0.4959983150800337,T,2,FailT,0,199600432,2355,2393,4748,0.4959983150800337,2,FailT,1,30
199600434,1996,36,2,SAN BERNARDINO,1996-11-05,LOMA LINDA,0,M,B,"Shall the Ordinance of the City of Loma Linda, California, levying a .75 percent utility users special tax for street repairs/rehabilitation be approved and shall the City's appropriations limit be increased by the amount of revenue derived from this tax?",5,5,Utility Tax,62,62,Transport: Roads,2212,2491,4703,0.4703380820752711,T,2,FailT,0,199600433,2212,2491,4703,0.4703380820752711,2,FailT,1,60
199600435,1996,36,2,SAN BERNARDINO,1996-11-05,REDLANDS,0,M,C,"Shall Ordinance No. 2328 entitled ""An ordinance of the City of Redlands amending Chapter 3.26 of the Redlands Municipal Code relating to the establishment of an admissions tax"" be approved, and shall a corresponding adjustment in the City's appropriations limit also be adopted?",2,2,Business Tax,200,112,Revenues: Tax Creation/Incr./Contin.,10483,10889,21372,0.49050159086655437,T,2,FailT,0,199600434,10483,10889,21372,0.49050159086655437,2,FailT,1,110
199600436,1996,36,2,SAN BERNARDINO,1996-11-05,REDLANDS,0,M,D,"Shall Ordinance No. 2330 entitled ""An ordinance of the City of Redlands approving assessments levied pursuant to the Landscaping and Lighting Act of 1972"" be adopted?",3,3,Property Tax,100,105,General Services: Maintenance,10689,10439,21128,0.5059163195759182,M,1,Pass,0,199600435,10689,10439,21128,0.5059163195759182,1,Pass,1,100
199600437,1996,36,2,SAN BERNARDINO,1996-11-05,SAN BERNARDINO,0,M,E,"Approves a Charter Amendment which will allow the Mayor power to veto, under the same checks and balances as on the Common Council, any order or resolution of the City of San Bernardino's Community Development Commission.  This veto may be overridden by two-thirds vote of the Redevelopment Commission.",20,20,Charter Amendment,42,42,Governance: Personnel/Labor Relations,18404,14103,32507,0.566154982003876,M,1,Pass,0,199600436,18404,14103,32507,0.566154982003876,1,Pass,20,40
199600438,1996,37,2,SAN DIEGO,1996-11-05,CORONADO,0,M,J,Transient Occupancy Tax of 8%.,2,2,Business Tax,100,112,Revenues: Tax Creation/Incr./Contin.,5765,2286,8051,0.7160601167556826,M,1,Pass,0,199600437,5765,2286,8051,0.7160601167556825,1,Pass,1,110
199600439,1996,37,2,SAN DIEGO,1996-11-05,DEL MAR,0,M,K,Establishes that Regular Municipal Elections would:  1)  Remain in April of even numbered years (576 votes)2)  Change to consolidate with the Statewide Primary election (279 votes)3)  Change to consolidate with the Statewide General election (1605 votes),70,70,Ordinance,48,48,Governance: Elections,1605,576,2181,0.7359009628610729,M,1,Pass,0,199600438,1605,576,2181,0.7359009628610729,1,Pass,70,40
199600440,1996,37,2,SAN DIEGO,1996-11-05,DEL MAR,0,M,L,Advisory Vote Only.  Should the City of Del Mar seek authority to conduct municipal elections by mail ballot?,40,40,Initiative,48,48,Governance: Elections,436,1862,2298,0.18973020017406442,M,2,Fail,0,199600439,436,1862,2298,0.18973020017406442,2,Fail,40,40
199600441,1996,37,2,SAN DIEGO,1996-11-05,EL CAJON,0,M,M,Would repeal an ordinance pertaining to business license tax increases.,2,2,Business Tax,100,111,Revenues: Tax Repeal/Reduction/Limit,10222,12068,22290,0.45859129654553615,M,2,Fail,0,199600440,10222,12068,22290,0.4585912965455361,2,Fail,1,110
199600442,1996,37,2,SAN DIEGO,1996-11-05,ESCONDIDO,0,M,N,Would extend the term of Mayor from two to four years.,70,70,Ordinance,42,42,Governance: Personnel/Labor Relations,16616,14667,31283,0.531151104433718,M,1,Pass,0,199600441,16616,14667,31283,0.531151104433718,1,Pass,70,40
199600443,1996,37,2,SAN DIEGO,1996-11-05,ESCONDIDO,0,M,O,Would amend the Mobilehome Rent Protection Ordinance passed in June 1988.,70,70,Ordinance,82,82,Housing: Rent Control,14093,15368,29461,0.4783612233121754,M,2,Fail,0,199600442,14093,15368,29461,0.4783612233121754,2,Fail,70,80
199600444,1996,37,2,SAN DIEGO,1996-11-05,ESCONDIDO,0,M,P,Would increase the Transient Occupancy Tax to 10%.,2,2,Business Tax,100,112,Revenues: Tax Creation/Incr./Contin.,16569,12671,29240,0.5666552667578659,M,1,Pass,0,199600443,16569,12671,29240,0.5666552667578659,1,Pass,1,110
199600445,1996,37,2,SAN DIEGO,1996-11-05,OCEANSIDE,0,M,R,"Shall the proposed ""Charter of the City of Oceanside"" be adopted?",20,20,Charter Amendment,43,43,Governance: Organization,16026,23365,39391,0.4068442029905308,M,2,Fail,0,199600444,16026,23365,39391,0.4068442029905308,2,Fail,20,40
199600446,1996,37,2,SAN DIEGO,1996-11-05,POWAY,0,M,S,An ordinance to amend the Municipal Code regarding the keeping of horses and other large animals.,70,70,Ordinance,200,200,Other,3495,15214,18709,0.1868084878935272,M,2,Fail,0,199600445,3495,15214,18709,0.1868084878935272,2,Fail,70,200
199600447,1996,37,2,SAN DIEGO,1996-11-05,SAN DIEGO,0,M,C,Charter Amendment.  Would create a branch library Endowment Fund and a Construction Fund with City's proceeds from a Countywide 1/4 cent sales tax.,4,4,Sales Tax,71,71,Facilities: Libraries,178937,157804,336741,0.531378715392542,T,2,FailT,0,199600446,178937,157804,336741,0.531378715392542,2,FailT,1,70
199600448,1996,37,2,SAN DIEGO,1996-11-05,SAN DIEGO,0,M,D,Charter Amendment.  Health insurance benefits for retired city employees to be paid from San Diego City Retirement System.,20,20,Charter Amendment,41,41,Governance: Benefits/Compensation,231410,88537,319947,0.7232760425945547,M,1,Pass,0,199600447,231410,88537,319947,0.7232760425945547,1,Pass,20,40
199600449,1996,37,2,SAN DIEGO,1996-11-05,SAN DIEGO,0,M,E,"Progress Guide and General Plan Amendment.  Phase Shift; change the designation of Seabreeze Farms from ""Future Urbanizing"" to ""Planned Urbanizing.""",70,70,Ordinance,22,22,Land Use: Zoning,180848,131518,312366,0.5789618588450728,M,1,Pass,0,199600448,180848,131518,312366,0.5789618588450728,1,Pass,70,20
199600450,1996,37,2,SAN DIEGO,1996-11-05,SAN DIEGO,0,M,F,"Progress Guide and General Plan Amendment.  Phase Shift; change the designation of specific property (13 acres) within the North City Future Urbanizing Area from ""Future Urbanizing"" to ""Planned Urbanizing.""",70,70,Ordinance,22,22,Land Use: Zoning,97892,220146,318038,0.30779969689156644,M,2,Fail,0,199600449,97892,220146,318038,0.30779969689156644,2,Fail,70,20
199600451,1996,37,2,SAN DIEGO,1996-11-05,SAN DIEGO,0,M,G,"Progress Guide and General Plan Amendment.  Phase Shift; change the designation of specific property (32.8 acres) within the North City Future Urbanizing Area from ""Future Urbanizing"" to ""Planned Urbanizing.""",70,70,Ordinance,22,22,Land Use: Zoning,91424,226101,317525,0.28792693488701676,M,2,Fail,0,199600450,91424,226101,317525,0.28792693488701676,2,Fail,70,20
199600452,1996,37,2,SAN DIEGO,1996-11-05,SAN DIEGO,0,M,H,"Progress Guide and General Plan Amendment.  Phase Shift; change the designation of Torrey Highlands from ""Future Urbanizing"" to ""Planned Urbanizing.""",70,70,Ordinance,22,22,Land Use: Zoning,174388,149609,323997,0.5382395516007864,M,1,Pass,0,199600451,174388,149609,323997,0.5382395516007864,1,Pass,70,20
199600453,1996,37,2,SAN DIEGO,1996-11-05,SAN MARCOS,0,M,T,Would provide for residents review and approval of proposed changes in mobilehome park rules and regulations.,70,70,Ordinance,80,80,Housing,8219,5710,13929,0.590063895469883,M,1,Pass,0,199600452,8219,5710,13929,0.590063895469883,1,Pass,70,80
199600454,1996,39,2,SAN JOAQUIN,1996-11-05,LATHROP,0,M,S,Should the City of Lathrop Impose an Annual Growth Rate Cap of Two Percent (2%) of the Then-Existing Residential Housing?,70,70,Ordinance,21,21,Land Use: Growth Cap/Boundary,724,1419,2143,0.33784414372375177,M,2,Fail,0,199600453,724,1419,2143,0.33784414372375177,2,Fail,70,20
199600455,1996,40,2,SAN LUIS OBISPO,1996-11-05,ATASCADERO,0,M,K,"Shall the adjustments made to the Transient Occupancy Tax (TOT) by Ordinance No. 257 adopted on October 13, 1992 be ratified and approved?",2,2,Business Tax,100,112,Revenues: Tax Creation/Incr./Contin.,6177,3387,9564,0.6458594730238394,M,1,Pass,0,199600454,6177,3387,9564,0.6458594730238394,1,Pass,1,110
199600456,1996,40,2,SAN LUIS OBISPO,1996-11-05,GROVER BEACH,0,R,I,Shall MARCIA HAMILTON be recalled (removed) from the office of Council Member?,50,50,Recall,48,46,Governance: Recall,3147,931,4078,0.7717018146150073,M,1,Pass,0,199600455,3147,931,4078,0.7717018146150073,1,Pass,50,40
199600457,1996,40,2,SAN LUIS OBISPO,1996-11-05,GROVER BEACH,0,M,J,"Shall a measure enacting an ordinance setting a limit of two consecutive terms for elected officials in Grover Beach, be adopted?",70,70,Ordinance,45,45,Governance: Political Reform/Term Limits,3293,743,4036,0.8159068384539149,M,1,Pass,0,199600456,3293,743,4036,0.8159068384539148,1,Pass,70,40
199600458,1996,40,2,SAN LUIS OBISPO,1996-11-05,MORRO BAY,0,M,L,Shall an Ordinance be enacted to create a Community Cablecasting Commission?,70,70,Ordinance,43,43,Governance: Organization,3390,1354,4744,0.7145868465430015,M,1,Pass,0,199600457,3390,1354,4744,0.7145868465430016,1,Pass,70,40
199600459,1996,40,2,SAN LUIS OBISPO,1996-11-05,MORRO BAY,0,M,M,"Shall the Morro Bay Municipal Code be amended to add Chapter 3.22, imposing a transactions and use tax in the amount of one-half of one percent?",4,4,Sales Tax,100,112,Revenues: Tax Creation/Incr./Contin.,3526,1248,4774,0.7385839966485128,M,1,Pass,0,199600458,3526,1248,4774,0.7385839966485128,1,Pass,1,110
199600460,1996,40,2,SAN LUIS OBISPO,1996-11-05,MORRO BAY,0,M,N,"Shall the Ordnance amending Section 3.24.030 of the Morro Bay Municipal Code to increase the Transient Occupancy Tax (""bed tax"") from nine percent (9%) to ten percent (10%) be adopted?",2,2,Business Tax,100,112,Revenues: Tax Creation/Incr./Contin.,3043,1840,4883,0.6231824697931599,M,1,Pass,0,199600459,3043,1840,4883,0.6231824697931599,1,Pass,1,110
199600461,1996,40,2,SAN LUIS OBISPO,1996-11-05,SAN LUIS OBISPO,0,M,O,"ADVISORY VOTE ONLY.  Should the City form a City-wide assessment district for open space protection and park acquisition and development that would raise $1 million annually for this purpose, in accordance with the program guidelines recommended by the Open Space Financing Task Force?",30,30,Advisory,23,23,Land Use: Open Space,8898,8491,17389,0.5117028006210823,M,1,Pass,0,199600460,8898,8491,17389,0.5117028006210823,1,Pass,30,20
199600462,1996,40,2,SAN LUIS OBISPO,1996-11-05,SAN LUIS OBISPO,0,M,P,"Shall City Charter Article IX be amended to add ""Section 909.  Use of Water Supply Reliability Reserve""?",20,20,Charter Amendment,104,104,General Services: Water,9092,4549,13641,0.6665200498497178,M,1,Pass,0,199600461,9092,4549,13641,0.6665200498497178,1,Pass,20,100
199600463,1996,40,2,SAN LUIS OBISPO,1996-11-05,SAN LUIS OBISPO,0,M,Q,Shall City Charter Section 406 be amended to extend the period to time in which to hold an election to fill a Council Vacancy?,20,20,Charter Amendment,48,48,Governance: Elections,9222,4952,14174,0.6506279102582194,M,1,Pass,0,199600462,9222,4952,14174,0.6506279102582193,1,Pass,20,40
199600464,1996,40,2,SAN LUIS OBISPO,1996-11-05,SAN LUIS OBISPO,0,M,R,Shall City Charter Section 109 be amended to delete reference to the City Jail?,20,20,Charter Amendment,31,31,Safety: Jails/Courts,9205,4109,13314,0.6913774973711883,M,1,Pass,0,199600463,9205,4109,13314,0.6913774973711883,1,Pass,20,30
199600465,1996,40,2,SAN LUIS OBISPO,1996-11-05,SAN LUIS OBISPO,0,M,S,Shall City Charter Section 404 (c) extending Councilmember terms of office be deleted?,20,20,Charter Amendment,42,42,Governance: Personnel/Labor Relations,9474,3605,13079,0.7243673063689885,M,1,Pass,0,199600464,9474,3605,13079,0.7243673063689885,1,Pass,20,40
199600466,1996,40,2,SAN LUIS OBISPO,1996-11-05,SAN LUIS OBISPO,0,M,T,Shall City Charter Section 407 concerning the powers and duties of Mayor during an emergency be amended to bring them into conformance with Municipal Code Chapter 2.24?,20,20,Charter Amendment,42,42,Governance: Personnel/Labor Relations,11166,2199,13365,0.8354657687991022,M,1,Pass,0,199600465,11166,2199,13365,0.8354657687991022,1,Pass,20,40
199600467,1996,40,2,SAN LUIS OBISPO,1996-11-05,SAN LUIS OBISPO,0,M,U,Shall City Charter Section 410 concerning the time of payment of Council Compensation be amended to conform with the regular City payroll schedule?,20,20,Charter Amendment,41,41,Governance: Benefits/Compensation,10986,2431,13417,0.8188119549824849,M,1,Pass,0,199600466,10986,2431,13417,0.8188119549824849,1,Pass,20,40
199600468,1996,40,2,SAN LUIS OBISPO,1996-11-05,SAN LUIS OBISPO,0,M,V,Shall City Charter Section 709 be amended to allow the Council to adopt a Personnel Policy by ordinance or resolution?,20,20,Charter Amendment,42,42,Governance: Personnel/Labor Relations,8827,4127,12954,0.6814111471360198,M,1,Pass,0,199600467,8827,4127,12954,0.6814111471360198,1,Pass,20,40
199600469,1996,40,2,SAN LUIS OBISPO,1996-11-05,SAN LUIS OBISPO,0,M,W,Shall City Charter Section 807 concerning property taxes be deleted?,3,3,Property Tax,200,111,Revenues: Tax Repeal/Reduction/Limit,8397,4274,12671,0.6626943414095178,M,1,Pass,0,199600468,8397,4274,12671,0.6626943414095178,1,Pass,1,110
199600470,1996,40,2,SAN LUIS OBISPO,1996-11-05,SAN LUIS OBISPO,0,M,X,Shall City Charter Section 901(A) concerning public works to be done by contract be amended to refer to the Public Contracts Code?,20,20,Charter Amendment,47,47,Governance: Contracting/Bidding/Leasing,10492,2513,13005,0.8067666282199154,M,1,Pass,0,199600469,10492,2513,13005,0.8067666282199154,1,Pass,20,40
199600471,1996,41,2,SAN MATEO,1996-11-05,FOSTER CITY,0,M,X,Shall the ordinance adopted by the City Council stating that no person may hold the office of Councilmember for more than two four-year terms in succession be approved?,70,70,Ordinance,45,45,Governance: Political Reform/Term Limits,7688,3454,11142,0.6900017950098726,M,1,Pass,0,199600470,7688,3454,11142,0.6900017950098726,1,Pass,70,40
199600472,1996,41,2,SAN MATEO,1996-11-05,PACIFICA,0,M,W,Shall the City of Pacifica amend its Municipal Code to prohibit the sale and use of all State-approved fireworks in the City of Pacifica?,70,70,Ordinance,200,206,Other: Fireworks,10744,4582,15326,0.7010309278350515,M,1,Pass,0,199600471,10744,4582,15326,0.7010309278350515,1,Pass,70,200
199600473,1996,42,2,SANTA BARBARA,1996-11-05,GUADALUPE,0,M,L96,"Shall the adjustments made to the Utility Users Tax by Ordinance No. 94-328 adopted by the City Council of the City of Guadalupe, California on March 28, 1994 be ratified and approved, thus retroactively validating all tax previously collected and thus authorizing the continued collection of such tax in the future?",5,5,Utility Tax,200,112,Revenues: Tax Creation/Incr./Contin.,402,682,1084,0.37084870848708484,T,2,FailT,0,199600472,402,682,1084,0.37084870848708484,2,FailT,1,110
199600474,1996,42,2,SANTA BARBARA,1996-11-05,SOLVANG,0,M,N96,Shall an ordinance amending section 3.20.010 and 3.20.020 of Chapter 3.20 of Title 3 of the Solvang Municipal Code to increase the transient occupancy tax be adopted?,2,2,Business Tax,100,112,Revenues: Tax Creation/Incr./Contin.,1251,1074,2325,0.5380645161290323,M,1,Pass,0,199600473,1251,1074,2325,0.5380645161290323,1,Pass,1,110
199600475,1996,43,2,SANTA CLARA,1996-11-05,GILROY,0,M,M,"Shall the City Charter be amended to delete Section 903, an obsolete procedural reference to the election of 1960 that terminated the terms of office of members of boards and commissions in existence at that time?",20,20,Charter Amendment,42,42,Governance: Personnel/Labor Relations,5944,1628,7572,0.7849973586899102,M,1,Pass,0,199600474,5944,1628,7572,0.7849973586899102,1,Pass,20,40
